{
  "files": [
    {
      "features": [
        {
          "FEATURES_METHOD_INVOCATION": {},
          "FEATURES_TYPEACCESS": {},
          "FEATURES_VARS": {},
          "S10_METHOD_CALL_WITH_NULL_GUARD": "false",
          "S11_FAULTY_CLASS_EXCEPTION_TYPE": "false",
          "S12_METHOD_CALL_WITH_TRY_CATCH": "false",
          "S13_TYPE_OF_FAULTY_STATEMENT_AFTER_1": "",
          "S13_TYPE_OF_FAULTY_STATEMENT_AFTER_2": "",
          "S13_TYPE_OF_FAULTY_STATEMENT_AFTER_3": "",
          "S13_TYPE_OF_FAULTY_STATEMENT_BEFORE_1": "LocalVariable",
          "S13_TYPE_OF_FAULTY_STATEMENT_BEFORE_2": "LocalVariable",
          "S13_TYPE_OF_FAULTY_STATEMENT_BEFORE_3": "Invocation",
          "S14_TYPE_OF_FAULTY_STATEMENT_PARENT": "Try",
          "S15_HAS_OBJECTIVE_METHOD_CALL": "true",
          "S16_HAS_Invocations_Prone_Exception": "false",
          "S18_In_Synchronized_Method": "false",
          "S1_LOCAL_VAR_NOT_ASSIGNED": "false",
          "S1_LOCAL_VAR_NOT_USED": "false",
          "S2_SIMILAR_OBJECT_TYPE_WITH_NORMAL_GUARD": "false",
          "S2_SIMILAR_OBJECT_TYPE_WITH_NULL_GUARD": "false",
          "S3_TYPE_OF_FAULTY_STATEMENT": "Return",
          "S4_Field_NOT_ASSIGNED": "false",
          "S4_Field_NOT_USED": "false",
          "S5_SIMILAR_PRIMITIVE_TYPE_WITH_NORMAL_GUARD": "false",
          "S5_SIMILAR_PRIMITIVE_TYPE_WITH_NULL_GUARD": "false",
          "S6_METHOD_THROWS_EXCEPTION": "false",
          "S7_OBJECT_USED_IN_ASSIGNMENT": "false",
          "S8_PRIMITIVE_USED_IN_ASSIGNMENT": "false",
          "S9_METHOD_CALL_WITH_NORMAL_GUARD": "false",
          "ast_info": {
            "dst": "null",
            "dst_parent": "null",
            "dst_parent_type": "null",
            "dst_type": "null",
            "operator": "DEL",
            "src": "com.google.gson.internal.UnsafeAllocator.assertInstantiable(c)",
            "src_parent": "{\n    com.google.gson.internal.UnsafeAllocator.assertInstantiable(c);\n    return ((T) (allocateInstance.invoke(unsafe, c)));\n}",
            "src_parent_type": "Block",
            "src_type": "Invocation"
          }
        },
        {
          "FEATURES_METHOD_INVOCATION": {},
          "FEATURES_TYPEACCESS": {},
          "FEATURES_VARS": {},
          "S10_METHOD_CALL_WITH_NULL_GUARD": "false",
          "S11_FAULTY_CLASS_EXCEPTION_TYPE": "false",
          "S12_METHOD_CALL_WITH_TRY_CATCH": "false",
          "S13_TYPE_OF_FAULTY_STATEMENT_AFTER_1": "",
          "S13_TYPE_OF_FAULTY_STATEMENT_AFTER_2": "",
          "S13_TYPE_OF_FAULTY_STATEMENT_AFTER_3": "",
          "S13_TYPE_OF_FAULTY_STATEMENT_BEFORE_1": "Invocation",
          "S13_TYPE_OF_FAULTY_STATEMENT_BEFORE_2": "LocalVariable",
          "S13_TYPE_OF_FAULTY_STATEMENT_BEFORE_3": "LocalVariable",
          "S14_TYPE_OF_FAULTY_STATEMENT_PARENT": "Try",
          "S15_HAS_OBJECTIVE_METHOD_CALL": "true",
          "S16_HAS_Invocations_Prone_Exception": "false",
          "S18_In_Synchronized_Method": "false",
          "S1_LOCAL_VAR_NOT_ASSIGNED": "false",
          "S1_LOCAL_VAR_NOT_USED": "false",
          "S2_SIMILAR_OBJECT_TYPE_WITH_NORMAL_GUARD": "false",
          "S2_SIMILAR_OBJECT_TYPE_WITH_NULL_GUARD": "false",
          "S3_TYPE_OF_FAULTY_STATEMENT": "Return",
          "S4_Field_NOT_ASSIGNED": "false",
          "S4_Field_NOT_USED": "false",
          "S5_SIMILAR_PRIMITIVE_TYPE_WITH_NORMAL_GUARD": "false",
          "S5_SIMILAR_PRIMITIVE_TYPE_WITH_NULL_GUARD": "false",
          "S6_METHOD_THROWS_EXCEPTION": "false",
          "S7_OBJECT_USED_IN_ASSIGNMENT": "false",
          "S8_PRIMITIVE_USED_IN_ASSIGNMENT": "false",
          "S9_METHOD_CALL_WITH_NORMAL_GUARD": "false",
          "ast_info": {
            "dst": "null",
            "dst_parent": "null",
            "dst_parent_type": "null",
            "dst_type": "null",
            "operator": "DEL",
            "src": "com.google.gson.internal.UnsafeAllocator.assertInstantiable(c)",
            "src_parent": "{\n    com.google.gson.internal.UnsafeAllocator.assertInstantiable(c);\n    return ((T) (newInstance.invoke(null, c, constructorId)));\n}",
            "src_parent_type": "Block",
            "src_type": "Invocation"
          }
        },
        {
          "FEATURES_METHOD_INVOCATION": {},
          "FEATURES_TYPEACCESS": {},
          "FEATURES_VARS": {},
          "S10_METHOD_CALL_WITH_NULL_GUARD": "false",
          "S11_FAULTY_CLASS_EXCEPTION_TYPE": "false",
          "S12_METHOD_CALL_WITH_TRY_CATCH": "false",
          "S13_TYPE_OF_FAULTY_STATEMENT_AFTER_1": "",
          "S13_TYPE_OF_FAULTY_STATEMENT_AFTER_2": "",
          "S13_TYPE_OF_FAULTY_STATEMENT_AFTER_3": "",
          "S13_TYPE_OF_FAULTY_STATEMENT_BEFORE_1": "Invocation",
          "S13_TYPE_OF_FAULTY_STATEMENT_BEFORE_2": "LocalVariable",
          "S13_TYPE_OF_FAULTY_STATEMENT_BEFORE_3": "",
          "S14_TYPE_OF_FAULTY_STATEMENT_PARENT": "Try",
          "S15_HAS_OBJECTIVE_METHOD_CALL": "true",
          "S16_HAS_Invocations_Prone_Exception": "false",
          "S18_In_Synchronized_Method": "false",
          "S1_LOCAL_VAR_NOT_ASSIGNED": "false",
          "S1_LOCAL_VAR_NOT_USED": "false",
          "S2_SIMILAR_OBJECT_TYPE_WITH_NORMAL_GUARD": "false",
          "S2_SIMILAR_OBJECT_TYPE_WITH_NULL_GUARD": "false",
          "S3_TYPE_OF_FAULTY_STATEMENT": "Return",
          "S4_Field_NOT_ASSIGNED": "false",
          "S4_Field_NOT_USED": "false",
          "S5_SIMILAR_PRIMITIVE_TYPE_WITH_NORMAL_GUARD": "false",
          "S5_SIMILAR_PRIMITIVE_TYPE_WITH_NULL_GUARD": "false",
          "S6_METHOD_THROWS_EXCEPTION": "false",
          "S7_OBJECT_USED_IN_ASSIGNMENT": "false",
          "S8_PRIMITIVE_USED_IN_ASSIGNMENT": "false",
          "S9_METHOD_CALL_WITH_NORMAL_GUARD": "false",
          "ast_info": {
            "dst": "null",
            "dst_parent": "null",
            "dst_parent_type": "null",
            "dst_type": "null",
            "operator": "DEL",
            "src": "com.google.gson.internal.UnsafeAllocator.assertInstantiable(c)",
            "src_parent": "{\n    com.google.gson.internal.UnsafeAllocator.assertInstantiable(c);\n    return ((T) (newInstance.invoke(null, c, java.lang.Object.class)));\n}",
            "src_parent_type": "Block",
            "src_type": "Invocation"
          }
        },
        {
          "FEATURES_METHOD_INVOCATION": {},
          "FEATURES_TYPEACCESS": {},
          "FEATURES_VARS": {},
          "S10_METHOD_CALL_WITH_NULL_GUARD": "false",
          "S11_FAULTY_CLASS_EXCEPTION_TYPE": "false",
          "S12_METHOD_CALL_WITH_TRY_CATCH": "false",
          "S13_TYPE_OF_FAULTY_STATEMENT_AFTER_1": "",
          "S13_TYPE_OF_FAULTY_STATEMENT_AFTER_2": "",
          "S13_TYPE_OF_FAULTY_STATEMENT_AFTER_3": "",
          "S13_TYPE_OF_FAULTY_STATEMENT_BEFORE_1": "",
          "S13_TYPE_OF_FAULTY_STATEMENT_BEFORE_2": "",
          "S13_TYPE_OF_FAULTY_STATEMENT_BEFORE_3": "",
          "S14_TYPE_OF_FAULTY_STATEMENT_PARENT": "Class",
          "S15_HAS_OBJECTIVE_METHOD_CALL": "false",
          "S16_HAS_Invocations_Prone_Exception": "false",
          "S18_In_Synchronized_Method": "false",
          "S1_LOCAL_VAR_NOT_ASSIGNED": "false",
          "S1_LOCAL_VAR_NOT_USED": "false",
          "S2_SIMILAR_OBJECT_TYPE_WITH_NORMAL_GUARD": "false",
          "S2_SIMILAR_OBJECT_TYPE_WITH_NULL_GUARD": "false",
          "S3_TYPE_OF_FAULTY_STATEMENT": "Method",
          "S4_Field_NOT_ASSIGNED": "false",
          "S4_Field_NOT_USED": "false",
          "S5_SIMILAR_PRIMITIVE_TYPE_WITH_NORMAL_GUARD": "false",
          "S5_SIMILAR_PRIMITIVE_TYPE_WITH_NULL_GUARD": "false",
          "S7_OBJECT_USED_IN_ASSIGNMENT": "false",
          "S8_PRIMITIVE_USED_IN_ASSIGNMENT": "false",
          "S9_METHOD_CALL_WITH_NORMAL_GUARD": "false",
          "ast_info": {
            "dst": "null",
            "dst_parent": "null",
            "dst_parent_type": "null",
            "dst_type": "null",
            "operator": "DEL",
            "src": "private static void assertInstantiable(java.lang.Class<?> c) {\n    int modifiers = c.getModifiers();\n    if (java.lang.reflect.Modifier.isInterface(modifiers)) {\n        throw new java.lang.UnsupportedOperationException(\"Interface can't be instantiated! Interface name: \" + c.getName());\n    }\n    if (java.lang.reflect.Modifier.isAbstract(modifiers)) {\n        throw new java.lang.UnsupportedOperationException(\"Abstract class can't be instantiated! Class name: \" + c.getName());\n    }\n}",
            "src_parent": "public abstract class UnsafeAllocator {\n    public abstract <T> T newInstance(java.lang.Class<T> c) throws java.lang.Exception;\n\n    public static com.google.gson.internal.UnsafeAllocator create() {\n        try {\n            java.lang.Class<?> unsafeClass = java.lang.Class.forName(\"sun.misc.Unsafe\");\n            java.lang.reflect.Field f = unsafeClass.getDeclaredField(\"theUnsafe\");\n            f.setAccessible(true);\n            final java.lang.Object unsafe = f.get(null);\n            final java.lang.reflect.Method allocateInstance = unsafeClass.getMethod(\"allocateInstance\", java.lang.Class.class);\n            return new com.google.gson.internal.UnsafeAllocator() {\n                @java.lang.Override\n                @java.lang.SuppressWarnings(\"unchecked\")\n                public <T> T newInstance(java.lang.Class<T> c) throws java.lang.Exception {\n                    com.google.gson.internal.UnsafeAllocator.assertInstantiable(c);\n                    return ((T) (allocateInstance.invoke(unsafe, c)));\n                }\n            };\n        } catch (java.lang.Exception ignored) {\n        }\n        try {\n            java.lang.reflect.Method getConstructorId = java.io.ObjectStreamClass.class.getDeclaredMethod(\"getConstructorId\", java.lang.Class.class);\n            getConstructorId.setAccessible(true);\n            final int constructorId = ((java.lang.Integer) (getConstructorId.invoke(null, java.lang.Object.class)));\n            final java.lang.reflect.Method newInstance = java.io.ObjectStreamClass.class.getDeclaredMethod(\"newInstance\", java.lang.Class.class, int.class);\n            newInstance.setAccessible(true);\n            return new com.google.gson.internal.UnsafeAllocator() {\n                @java.lang.Override\n                @java.lang.SuppressWarnings(\"unchecked\")\n                public <T> T newInstance(java.lang.Class<T> c) throws java.lang.Exception {\n                    com.google.gson.internal.UnsafeAllocator.assertInstantiable(c);\n                    return ((T) (newInstance.invoke(null, c, constructorId)));\n                }\n            };\n        } catch (java.lang.Exception ignored) {\n        }\n        try {\n            final java.lang.reflect.Method newInstance = java.io.ObjectInputStream.class.getDeclaredMethod(\"newInstance\", java.lang.Class.class, java.lang.Class.class);\n            newInstance.setAccessible(true);\n            return new com.google.gson.internal.UnsafeAllocator() {\n                @java.lang.Override\n                @java.lang.SuppressWarnings(\"unchecked\")\n                public <T> T newInstance(java.lang.Class<T> c) throws java.lang.Exception {\n                    com.google.gson.internal.UnsafeAllocator.assertInstantiable(c);\n                    return ((T) (newInstance.invoke(null, c, java.lang.Object.class)));\n                }\n            };\n        } catch (java.lang.Exception ignored) {\n        }\n        return new com.google.gson.internal.UnsafeAllocator() {\n            @java.lang.Override\n            public <T> T newInstance(java.lang.Class<T> c) {\n                throw new java.lang.UnsupportedOperationException(\"Cannot allocate \" + c);\n            }\n        };\n    }\n\n    private static void assertInstantiable(java.lang.Class<?> c) {\n        int modifiers = c.getModifiers();\n        if (java.lang.reflect.Modifier.isInterface(modifiers)) {\n            throw new java.lang.UnsupportedOperationException(\"Interface can't be instantiated! Interface name: \" + c.getName());\n        }\n        if (java.lang.reflect.Modifier.isAbstract(modifiers)) {\n            throw new java.lang.UnsupportedOperationException(\"Abstract class can't be instantiated! Class name: \" + c.getName());\n        }\n    }\n}",
            "src_parent_type": "Class",
            "src_type": "Method"
          }
        }
      ],
      "file_name": "UnsafeAllocator"
    }
  ],
  "id": "Gson_8"
}