{
  "files": [
    {
      "features": [
        {
          "FEATURES_METHOD_INVOCATION": {},
          "FEATURES_TYPEACCESS": {},
          "FEATURES_VARS": {},
          "S10_METHOD_CALL_WITH_NULL_GUARD": "false",
          "S11_FAULTY_CLASS_EXCEPTION_TYPE": "false",
          "S12_METHOD_CALL_WITH_TRY_CATCH": "false",
          "S13_TYPE_OF_FAULTY_STATEMENT_AFTER_1": "",
          "S13_TYPE_OF_FAULTY_STATEMENT_AFTER_2": "",
          "S13_TYPE_OF_FAULTY_STATEMENT_AFTER_3": "",
          "S13_TYPE_OF_FAULTY_STATEMENT_BEFORE_1": "",
          "S13_TYPE_OF_FAULTY_STATEMENT_BEFORE_2": "",
          "S13_TYPE_OF_FAULTY_STATEMENT_BEFORE_3": "",
          "S14_TYPE_OF_FAULTY_STATEMENT_PARENT": "Method",
          "S15_HAS_OBJECTIVE_METHOD_CALL": "false",
          "S16_HAS_Invocations_Prone_Exception": "false",
          "S18_In_Synchronized_Method": "false",
          "S1_LOCAL_VAR_NOT_ASSIGNED": "false",
          "S1_LOCAL_VAR_NOT_USED": "false",
          "S2_SIMILAR_OBJECT_TYPE_WITH_NORMAL_GUARD": "false",
          "S2_SIMILAR_OBJECT_TYPE_WITH_NULL_GUARD": "false",
          "S3_TYPE_OF_FAULTY_STATEMENT": "Return",
          "S4_Field_NOT_ASSIGNED": "false",
          "S4_Field_NOT_USED": "false",
          "S5_SIMILAR_PRIMITIVE_TYPE_WITH_NORMAL_GUARD": "false",
          "S5_SIMILAR_PRIMITIVE_TYPE_WITH_NULL_GUARD": "false",
          "S6_METHOD_THROWS_EXCEPTION": "false",
          "S7_OBJECT_USED_IN_ASSIGNMENT": "false",
          "S8_PRIMITIVE_USED_IN_ASSIGNMENT": "false",
          "S9_METHOD_CALL_WITH_NORMAL_GUARD": "false",
          "ast_info": {
            "dst": "canCreateFromBoolean()",
            "dst_parent": "((((((canCreateUsingDefault() || canCreateUsingDelegate()) || canCreateFromObjectWith()) || canCreateFromString()) || canCreateFromInt()) || canCreateFromLong()) || canCreateFromDouble()) || canCreateFromBoolean()",
            "dst_parent_type": "BinaryOperator",
            "dst_type": "Invocation",
            "operator": "UPD",
            "src": "canCreateFromDouble()",
            "src_parent": "(((((((canCreateUsingDefault() || canCreateUsingDelegate()) || canCreateUsingArrayDelegate()) || canCreateFromObjectWith()) || canCreateFromString()) || canCreateFromInt()) || canCreateFromLong()) || canCreateFromDouble())",
            "src_parent_type": "BinaryOperator",
            "src_type": "Invocation"
          }
        },
        {
          "FEATURES_METHOD_INVOCATION": {},
          "FEATURES_TYPEACCESS": {},
          "FEATURES_VARS": {},
          "S10_METHOD_CALL_WITH_NULL_GUARD": "false",
          "S11_FAULTY_CLASS_EXCEPTION_TYPE": "false",
          "S12_METHOD_CALL_WITH_TRY_CATCH": "false",
          "S13_TYPE_OF_FAULTY_STATEMENT_AFTER_1": "",
          "S13_TYPE_OF_FAULTY_STATEMENT_AFTER_2": "",
          "S13_TYPE_OF_FAULTY_STATEMENT_AFTER_3": "",
          "S13_TYPE_OF_FAULTY_STATEMENT_BEFORE_1": "",
          "S13_TYPE_OF_FAULTY_STATEMENT_BEFORE_2": "",
          "S13_TYPE_OF_FAULTY_STATEMENT_BEFORE_3": "",
          "S14_TYPE_OF_FAULTY_STATEMENT_PARENT": "Method",
          "S15_HAS_OBJECTIVE_METHOD_CALL": "false",
          "S16_HAS_Invocations_Prone_Exception": "false",
          "S18_In_Synchronized_Method": "false",
          "S1_LOCAL_VAR_NOT_ASSIGNED": "false",
          "S1_LOCAL_VAR_NOT_USED": "false",
          "S2_SIMILAR_OBJECT_TYPE_WITH_NORMAL_GUARD": "false",
          "S2_SIMILAR_OBJECT_TYPE_WITH_NULL_GUARD": "false",
          "S3_TYPE_OF_FAULTY_STATEMENT": "Return",
          "S4_Field_NOT_ASSIGNED": "false",
          "S4_Field_NOT_USED": "false",
          "S5_SIMILAR_PRIMITIVE_TYPE_WITH_NORMAL_GUARD": "false",
          "S5_SIMILAR_PRIMITIVE_TYPE_WITH_NULL_GUARD": "false",
          "S6_METHOD_THROWS_EXCEPTION": "false",
          "S7_OBJECT_USED_IN_ASSIGNMENT": "false",
          "S8_PRIMITIVE_USED_IN_ASSIGNMENT": "false",
          "S9_METHOD_CALL_WITH_NORMAL_GUARD": "false",
          "ast_info": {
            "dst": "canCreateFromDouble()",
            "dst_parent": "((((((canCreateUsingDefault() || canCreateUsingDelegate()) || canCreateFromObjectWith()) || canCreateFromString()) || canCreateFromInt()) || canCreateFromLong()) || canCreateFromDouble())",
            "dst_parent_type": "BinaryOperator",
            "dst_type": "Invocation",
            "operator": "UPD",
            "src": "canCreateFromLong()",
            "src_parent": "((((((canCreateUsingDefault() || canCreateUsingDelegate()) || canCreateUsingArrayDelegate()) || canCreateFromObjectWith()) || canCreateFromString()) || canCreateFromInt()) || canCreateFromLong())",
            "src_parent_type": "BinaryOperator",
            "src_type": "Invocation"
          }
        },
        {
          "FEATURES_METHOD_INVOCATION": {},
          "FEATURES_TYPEACCESS": {},
          "FEATURES_VARS": {},
          "S10_METHOD_CALL_WITH_NULL_GUARD": "false",
          "S11_FAULTY_CLASS_EXCEPTION_TYPE": "false",
          "S12_METHOD_CALL_WITH_TRY_CATCH": "false",
          "S13_TYPE_OF_FAULTY_STATEMENT_AFTER_1": "",
          "S13_TYPE_OF_FAULTY_STATEMENT_AFTER_2": "",
          "S13_TYPE_OF_FAULTY_STATEMENT_AFTER_3": "",
          "S13_TYPE_OF_FAULTY_STATEMENT_BEFORE_1": "",
          "S13_TYPE_OF_FAULTY_STATEMENT_BEFORE_2": "",
          "S13_TYPE_OF_FAULTY_STATEMENT_BEFORE_3": "",
          "S14_TYPE_OF_FAULTY_STATEMENT_PARENT": "Method",
          "S15_HAS_OBJECTIVE_METHOD_CALL": "false",
          "S16_HAS_Invocations_Prone_Exception": "false",
          "S18_In_Synchronized_Method": "false",
          "S1_LOCAL_VAR_NOT_ASSIGNED": "false",
          "S1_LOCAL_VAR_NOT_USED": "false",
          "S2_SIMILAR_OBJECT_TYPE_WITH_NORMAL_GUARD": "false",
          "S2_SIMILAR_OBJECT_TYPE_WITH_NULL_GUARD": "false",
          "S3_TYPE_OF_FAULTY_STATEMENT": "Return",
          "S4_Field_NOT_ASSIGNED": "false",
          "S4_Field_NOT_USED": "false",
          "S5_SIMILAR_PRIMITIVE_TYPE_WITH_NORMAL_GUARD": "false",
          "S5_SIMILAR_PRIMITIVE_TYPE_WITH_NULL_GUARD": "false",
          "S6_METHOD_THROWS_EXCEPTION": "false",
          "S7_OBJECT_USED_IN_ASSIGNMENT": "false",
          "S8_PRIMITIVE_USED_IN_ASSIGNMENT": "false",
          "S9_METHOD_CALL_WITH_NORMAL_GUARD": "false",
          "ast_info": {
            "dst": "canCreateFromLong()",
            "dst_parent": "(((((canCreateUsingDefault() || canCreateUsingDelegate()) || canCreateFromObjectWith()) || canCreateFromString()) || canCreateFromInt()) || canCreateFromLong())",
            "dst_parent_type": "BinaryOperator",
            "dst_type": "Invocation",
            "operator": "UPD",
            "src": "canCreateFromInt()",
            "src_parent": "(((((canCreateUsingDefault() || canCreateUsingDelegate()) || canCreateUsingArrayDelegate()) || canCreateFromObjectWith()) || canCreateFromString()) || canCreateFromInt())",
            "src_parent_type": "BinaryOperator",
            "src_type": "Invocation"
          }
        },
        {
          "FEATURES_METHOD_INVOCATION": {},
          "FEATURES_TYPEACCESS": {},
          "FEATURES_VARS": {},
          "S10_METHOD_CALL_WITH_NULL_GUARD": "false",
          "S11_FAULTY_CLASS_EXCEPTION_TYPE": "false",
          "S12_METHOD_CALL_WITH_TRY_CATCH": "false",
          "S13_TYPE_OF_FAULTY_STATEMENT_AFTER_1": "",
          "S13_TYPE_OF_FAULTY_STATEMENT_AFTER_2": "",
          "S13_TYPE_OF_FAULTY_STATEMENT_AFTER_3": "",
          "S13_TYPE_OF_FAULTY_STATEMENT_BEFORE_1": "",
          "S13_TYPE_OF_FAULTY_STATEMENT_BEFORE_2": "",
          "S13_TYPE_OF_FAULTY_STATEMENT_BEFORE_3": "",
          "S14_TYPE_OF_FAULTY_STATEMENT_PARENT": "Method",
          "S15_HAS_OBJECTIVE_METHOD_CALL": "false",
          "S16_HAS_Invocations_Prone_Exception": "false",
          "S18_In_Synchronized_Method": "false",
          "S1_LOCAL_VAR_NOT_ASSIGNED": "false",
          "S1_LOCAL_VAR_NOT_USED": "false",
          "S2_SIMILAR_OBJECT_TYPE_WITH_NORMAL_GUARD": "false",
          "S2_SIMILAR_OBJECT_TYPE_WITH_NULL_GUARD": "false",
          "S3_TYPE_OF_FAULTY_STATEMENT": "Return",
          "S4_Field_NOT_ASSIGNED": "false",
          "S4_Field_NOT_USED": "false",
          "S5_SIMILAR_PRIMITIVE_TYPE_WITH_NORMAL_GUARD": "false",
          "S5_SIMILAR_PRIMITIVE_TYPE_WITH_NULL_GUARD": "false",
          "S6_METHOD_THROWS_EXCEPTION": "false",
          "S7_OBJECT_USED_IN_ASSIGNMENT": "false",
          "S8_PRIMITIVE_USED_IN_ASSIGNMENT": "false",
          "S9_METHOD_CALL_WITH_NORMAL_GUARD": "false",
          "ast_info": {
            "dst": "canCreateFromInt()",
            "dst_parent": "((((canCreateUsingDefault() || canCreateUsingDelegate()) || canCreateFromObjectWith()) || canCreateFromString()) || canCreateFromInt())",
            "dst_parent_type": "BinaryOperator",
            "dst_type": "Invocation",
            "operator": "UPD",
            "src": "canCreateFromString()",
            "src_parent": "((((canCreateUsingDefault() || canCreateUsingDelegate()) || canCreateUsingArrayDelegate()) || canCreateFromObjectWith()) || canCreateFromString())",
            "src_parent_type": "BinaryOperator",
            "src_type": "Invocation"
          }
        },
        {
          "FEATURES_METHOD_INVOCATION": {},
          "FEATURES_TYPEACCESS": {},
          "FEATURES_VARS": {},
          "S10_METHOD_CALL_WITH_NULL_GUARD": "false",
          "S11_FAULTY_CLASS_EXCEPTION_TYPE": "false",
          "S12_METHOD_CALL_WITH_TRY_CATCH": "false",
          "S13_TYPE_OF_FAULTY_STATEMENT_AFTER_1": "",
          "S13_TYPE_OF_FAULTY_STATEMENT_AFTER_2": "",
          "S13_TYPE_OF_FAULTY_STATEMENT_AFTER_3": "",
          "S13_TYPE_OF_FAULTY_STATEMENT_BEFORE_1": "",
          "S13_TYPE_OF_FAULTY_STATEMENT_BEFORE_2": "",
          "S13_TYPE_OF_FAULTY_STATEMENT_BEFORE_3": "",
          "S14_TYPE_OF_FAULTY_STATEMENT_PARENT": "Method",
          "S15_HAS_OBJECTIVE_METHOD_CALL": "false",
          "S16_HAS_Invocations_Prone_Exception": "false",
          "S18_In_Synchronized_Method": "false",
          "S1_LOCAL_VAR_NOT_ASSIGNED": "false",
          "S1_LOCAL_VAR_NOT_USED": "false",
          "S2_SIMILAR_OBJECT_TYPE_WITH_NORMAL_GUARD": "false",
          "S2_SIMILAR_OBJECT_TYPE_WITH_NULL_GUARD": "false",
          "S3_TYPE_OF_FAULTY_STATEMENT": "Return",
          "S4_Field_NOT_ASSIGNED": "false",
          "S4_Field_NOT_USED": "false",
          "S5_SIMILAR_PRIMITIVE_TYPE_WITH_NORMAL_GUARD": "false",
          "S5_SIMILAR_PRIMITIVE_TYPE_WITH_NULL_GUARD": "false",
          "S6_METHOD_THROWS_EXCEPTION": "false",
          "S7_OBJECT_USED_IN_ASSIGNMENT": "false",
          "S8_PRIMITIVE_USED_IN_ASSIGNMENT": "false",
          "S9_METHOD_CALL_WITH_NORMAL_GUARD": "false",
          "ast_info": {
            "dst": "canCreateFromString()",
            "dst_parent": "(((canCreateUsingDefault() || canCreateUsingDelegate()) || canCreateFromObjectWith()) || canCreateFromString())",
            "dst_parent_type": "BinaryOperator",
            "dst_type": "Invocation",
            "operator": "UPD",
            "src": "canCreateFromObjectWith()",
            "src_parent": "(((canCreateUsingDefault() || canCreateUsingDelegate()) || canCreateUsingArrayDelegate()) || canCreateFromObjectWith())",
            "src_parent_type": "BinaryOperator",
            "src_type": "Invocation"
          }
        },
        {
          "FEATURES_METHOD_INVOCATION": {},
          "FEATURES_TYPEACCESS": {},
          "FEATURES_VARS": {},
          "S10_METHOD_CALL_WITH_NULL_GUARD": "false",
          "S11_FAULTY_CLASS_EXCEPTION_TYPE": "false",
          "S12_METHOD_CALL_WITH_TRY_CATCH": "false",
          "S13_TYPE_OF_FAULTY_STATEMENT_AFTER_1": "",
          "S13_TYPE_OF_FAULTY_STATEMENT_AFTER_2": "",
          "S13_TYPE_OF_FAULTY_STATEMENT_AFTER_3": "",
          "S13_TYPE_OF_FAULTY_STATEMENT_BEFORE_1": "",
          "S13_TYPE_OF_FAULTY_STATEMENT_BEFORE_2": "",
          "S13_TYPE_OF_FAULTY_STATEMENT_BEFORE_3": "",
          "S14_TYPE_OF_FAULTY_STATEMENT_PARENT": "Method",
          "S15_HAS_OBJECTIVE_METHOD_CALL": "false",
          "S16_HAS_Invocations_Prone_Exception": "false",
          "S18_In_Synchronized_Method": "false",
          "S1_LOCAL_VAR_NOT_ASSIGNED": "false",
          "S1_LOCAL_VAR_NOT_USED": "false",
          "S2_SIMILAR_OBJECT_TYPE_WITH_NORMAL_GUARD": "false",
          "S2_SIMILAR_OBJECT_TYPE_WITH_NULL_GUARD": "false",
          "S3_TYPE_OF_FAULTY_STATEMENT": "Return",
          "S4_Field_NOT_ASSIGNED": "false",
          "S4_Field_NOT_USED": "false",
          "S5_SIMILAR_PRIMITIVE_TYPE_WITH_NORMAL_GUARD": "false",
          "S5_SIMILAR_PRIMITIVE_TYPE_WITH_NULL_GUARD": "false",
          "S6_METHOD_THROWS_EXCEPTION": "false",
          "S7_OBJECT_USED_IN_ASSIGNMENT": "false",
          "S8_PRIMITIVE_USED_IN_ASSIGNMENT": "false",
          "S9_METHOD_CALL_WITH_NORMAL_GUARD": "false",
          "ast_info": {
            "dst": "canCreateFromObjectWith()",
            "dst_parent": "((canCreateUsingDefault() || canCreateUsingDelegate()) || canCreateFromObjectWith())",
            "dst_parent_type": "BinaryOperator",
            "dst_type": "Invocation",
            "operator": "UPD",
            "src": "canCreateUsingArrayDelegate()",
            "src_parent": "((canCreateUsingDefault() || canCreateUsingDelegate()) || canCreateUsingArrayDelegate())",
            "src_parent_type": "BinaryOperator",
            "src_type": "Invocation"
          }
        },
        {
          "FEATURES_METHOD_INVOCATION": {},
          "FEATURES_TYPEACCESS": {},
          "FEATURES_VARS": {},
          "S10_METHOD_CALL_WITH_NULL_GUARD": "false",
          "S11_FAULTY_CLASS_EXCEPTION_TYPE": "false",
          "S12_METHOD_CALL_WITH_TRY_CATCH": "false",
          "S13_TYPE_OF_FAULTY_STATEMENT_AFTER_1": "",
          "S13_TYPE_OF_FAULTY_STATEMENT_AFTER_2": "",
          "S13_TYPE_OF_FAULTY_STATEMENT_AFTER_3": "",
          "S13_TYPE_OF_FAULTY_STATEMENT_BEFORE_1": "",
          "S13_TYPE_OF_FAULTY_STATEMENT_BEFORE_2": "",
          "S13_TYPE_OF_FAULTY_STATEMENT_BEFORE_3": "",
          "S14_TYPE_OF_FAULTY_STATEMENT_PARENT": "Method",
          "S15_HAS_OBJECTIVE_METHOD_CALL": "false",
          "S16_HAS_Invocations_Prone_Exception": "false",
          "S18_In_Synchronized_Method": "false",
          "S1_LOCAL_VAR_NOT_ASSIGNED": "false",
          "S1_LOCAL_VAR_NOT_USED": "false",
          "S2_SIMILAR_OBJECT_TYPE_WITH_NORMAL_GUARD": "false",
          "S2_SIMILAR_OBJECT_TYPE_WITH_NULL_GUARD": "false",
          "S3_TYPE_OF_FAULTY_STATEMENT": "Return",
          "S4_Field_NOT_ASSIGNED": "false",
          "S4_Field_NOT_USED": "false",
          "S5_SIMILAR_PRIMITIVE_TYPE_WITH_NORMAL_GUARD": "false",
          "S5_SIMILAR_PRIMITIVE_TYPE_WITH_NULL_GUARD": "false",
          "S6_METHOD_THROWS_EXCEPTION": "false",
          "S7_OBJECT_USED_IN_ASSIGNMENT": "false",
          "S8_PRIMITIVE_USED_IN_ASSIGNMENT": "false",
          "S9_METHOD_CALL_WITH_NORMAL_GUARD": "false",
          "ast_info": {
            "dst": "null",
            "dst_parent": "null",
            "dst_parent_type": "null",
            "dst_type": "null",
            "operator": "DEL",
            "src": "(((((((canCreateUsingDefault() || canCreateUsingDelegate()) || canCreateUsingArrayDelegate()) || canCreateFromObjectWith()) || canCreateFromString()) || canCreateFromInt()) || canCreateFromLong()) || canCreateFromDouble()) || canCreateFromBoolean()",
            "src_parent": "return (((((((canCreateUsingDefault() || canCreateUsingDelegate()) || canCreateUsingArrayDelegate()) || canCreateFromObjectWith()) || canCreateFromString()) || canCreateFromInt()) || canCreateFromLong()) || canCreateFromDouble()) || canCreateFromBoolean()",
            "src_parent_type": "Return",
            "src_type": "BinaryOperator"
          }
        },
        {
          "FEATURES_METHOD_INVOCATION": {},
          "FEATURES_TYPEACCESS": {},
          "FEATURES_VARS": {},
          "S10_METHOD_CALL_WITH_NULL_GUARD": "false",
          "S11_FAULTY_CLASS_EXCEPTION_TYPE": "false",
          "S12_METHOD_CALL_WITH_TRY_CATCH": "false",
          "S13_TYPE_OF_FAULTY_STATEMENT_AFTER_1": "",
          "S13_TYPE_OF_FAULTY_STATEMENT_AFTER_2": "",
          "S13_TYPE_OF_FAULTY_STATEMENT_AFTER_3": "",
          "S13_TYPE_OF_FAULTY_STATEMENT_BEFORE_1": "",
          "S13_TYPE_OF_FAULTY_STATEMENT_BEFORE_2": "",
          "S13_TYPE_OF_FAULTY_STATEMENT_BEFORE_3": "",
          "S14_TYPE_OF_FAULTY_STATEMENT_PARENT": "Method",
          "S15_HAS_OBJECTIVE_METHOD_CALL": "false",
          "S16_HAS_Invocations_Prone_Exception": "false",
          "S18_In_Synchronized_Method": "false",
          "S1_LOCAL_VAR_NOT_ASSIGNED": "false",
          "S1_LOCAL_VAR_NOT_USED": "false",
          "S2_SIMILAR_OBJECT_TYPE_WITH_NORMAL_GUARD": "false",
          "S2_SIMILAR_OBJECT_TYPE_WITH_NULL_GUARD": "false",
          "S3_TYPE_OF_FAULTY_STATEMENT": "Return",
          "S4_Field_NOT_ASSIGNED": "false",
          "S4_Field_NOT_USED": "false",
          "S5_SIMILAR_PRIMITIVE_TYPE_WITH_NORMAL_GUARD": "false",
          "S5_SIMILAR_PRIMITIVE_TYPE_WITH_NULL_GUARD": "false",
          "S6_METHOD_THROWS_EXCEPTION": "false",
          "S7_OBJECT_USED_IN_ASSIGNMENT": "false",
          "S8_PRIMITIVE_USED_IN_ASSIGNMENT": "false",
          "S9_METHOD_CALL_WITH_NORMAL_GUARD": "false",
          "ast_info": {
            "dst": "((((((canCreateUsingDefault() || canCreateUsingDelegate()) || canCreateFromObjectWith()) || canCreateFromString()) || canCreateFromInt()) || canCreateFromLong()) || canCreateFromDouble()) || canCreateFromBoolean()",
            "dst_parent": "return ((((((canCreateUsingDefault() || canCreateUsingDelegate()) || canCreateFromObjectWith()) || canCreateFromString()) || canCreateFromInt()) || canCreateFromLong()) || canCreateFromDouble()) || canCreateFromBoolean()",
            "dst_parent_type": "Return",
            "dst_type": "BinaryOperator",
            "operator": "MOV",
            "src": "(((((((canCreateUsingDefault() || canCreateUsingDelegate()) || canCreateUsingArrayDelegate()) || canCreateFromObjectWith()) || canCreateFromString()) || canCreateFromInt()) || canCreateFromLong()) || canCreateFromDouble())",
            "src_parent": "(((((((canCreateUsingDefault() || canCreateUsingDelegate()) || canCreateUsingArrayDelegate()) || canCreateFromObjectWith()) || canCreateFromString()) || canCreateFromInt()) || canCreateFromLong()) || canCreateFromDouble()) || canCreateFromBoolean()",
            "src_parent_type": "BinaryOperator",
            "src_type": "BinaryOperator"
          }
        }
      ],
      "file_name": "ValueInstantiator"
    },
    {
      "features": [
        {
          "FEATURES_METHOD_INVOCATION": {},
          "FEATURES_TYPEACCESS": {},
          "FEATURES_VARS": {},
          "S10_METHOD_CALL_WITH_NULL_GUARD": "false",
          "S11_FAULTY_CLASS_EXCEPTION_TYPE": "false",
          "S12_METHOD_CALL_WITH_TRY_CATCH": "false",
          "S13_TYPE_OF_FAULTY_STATEMENT_AFTER_1": "",
          "S13_TYPE_OF_FAULTY_STATEMENT_AFTER_2": "",
          "S13_TYPE_OF_FAULTY_STATEMENT_AFTER_3": "",
          "S13_TYPE_OF_FAULTY_STATEMENT_BEFORE_1": "",
          "S13_TYPE_OF_FAULTY_STATEMENT_BEFORE_2": "",
          "S13_TYPE_OF_FAULTY_STATEMENT_BEFORE_3": "",
          "S14_TYPE_OF_FAULTY_STATEMENT_PARENT": "Class",
          "S15_HAS_OBJECTIVE_METHOD_CALL": "false",
          "S16_HAS_Invocations_Prone_Exception": "false",
          "S18_In_Synchronized_Method": "false",
          "S1_LOCAL_VAR_NOT_ASSIGNED": "false",
          "S1_LOCAL_VAR_NOT_USED": "false",
          "S2_SIMILAR_OBJECT_TYPE_WITH_NORMAL_GUARD": "false",
          "S2_SIMILAR_OBJECT_TYPE_WITH_NULL_GUARD": "false",
          "S3_TYPE_OF_FAULTY_STATEMENT": "Method",
          "S4_Field_NOT_ASSIGNED": "false",
          "S4_Field_NOT_USED": "false",
          "S5_SIMILAR_PRIMITIVE_TYPE_WITH_NORMAL_GUARD": "false",
          "S5_SIMILAR_PRIMITIVE_TYPE_WITH_NULL_GUARD": "false",
          "S7_OBJECT_USED_IN_ASSIGNMENT": "false",
          "S8_PRIMITIVE_USED_IN_ASSIGNMENT": "false",
          "S9_METHOD_CALL_WITH_NORMAL_GUARD": "false",
          "ast_info": {
            "dst": "null",
            "dst_parent": "null",
            "dst_parent_type": "null",
            "dst_type": "null",
            "operator": "DEL",
            "src": "@java.lang.Override\npublic boolean canInstantiate() {\n    return (((((((canCreateUsingDefault() || canCreateUsingDelegate()) || canCreateUsingArrayDelegate()) || canCreateFromObjectWith()) || canCreateFromString()) || canCreateFromInt()) || canCreateFromLong()) || canCreateFromDouble()) || canCreateFromBoolean();\n}",
            "src_parent": "@com.fasterxml.jackson.databind.annotation.JacksonStdImpl\npublic class StdValueInstantiator extends com.fasterxml.jackson.databind.deser.ValueInstantiator implements java.io.Serializable {\n    private static final long serialVersionUID = 1L;\n\n    protected final java.lang.String _valueTypeDesc;\n\n    protected final java.lang.Class<?> _valueClass;\n\n    protected com.fasterxml.jackson.databind.introspect.AnnotatedWithParams _defaultCreator;\n\n    protected com.fasterxml.jackson.databind.introspect.AnnotatedWithParams _withArgsCreator;\n\n    protected com.fasterxml.jackson.databind.deser.SettableBeanProperty[] _constructorArguments;\n\n    protected com.fasterxml.jackson.databind.JavaType _delegateType;\n\n    protected com.fasterxml.jackson.databind.introspect.AnnotatedWithParams _delegateCreator;\n\n    protected com.fasterxml.jackson.databind.deser.SettableBeanProperty[] _delegateArguments;\n\n    protected com.fasterxml.jackson.databind.JavaType _arrayDelegateType;\n\n    protected com.fasterxml.jackson.databind.introspect.AnnotatedWithParams _arrayDelegateCreator;\n\n    protected com.fasterxml.jackson.databind.deser.SettableBeanProperty[] _arrayDelegateArguments;\n\n    protected com.fasterxml.jackson.databind.introspect.AnnotatedWithParams _fromStringCreator;\n\n    protected com.fasterxml.jackson.databind.introspect.AnnotatedWithParams _fromIntCreator;\n\n    protected com.fasterxml.jackson.databind.introspect.AnnotatedWithParams _fromLongCreator;\n\n    protected com.fasterxml.jackson.databind.introspect.AnnotatedWithParams _fromDoubleCreator;\n\n    protected com.fasterxml.jackson.databind.introspect.AnnotatedWithParams _fromBooleanCreator;\n\n    protected com.fasterxml.jackson.databind.introspect.AnnotatedParameter _incompleteParameter;\n\n    @java.lang.Deprecated\n    public StdValueInstantiator(com.fasterxml.jackson.databind.DeserializationConfig config, java.lang.Class<?> valueType) {\n        _valueTypeDesc = (valueType == null) ? \"UNKNOWN TYPE\" : valueType.getName();\n        _valueClass = (valueType == null) ? java.lang.Object.class : valueType;\n    }\n\n    public StdValueInstantiator(com.fasterxml.jackson.databind.DeserializationConfig config, com.fasterxml.jackson.databind.JavaType valueType) {\n        _valueTypeDesc = (valueType == null) ? \"UNKNOWN TYPE\" : valueType.toString();\n        _valueClass = (valueType == null) ? java.lang.Object.class : valueType.getRawClass();\n    }\n\n    protected StdValueInstantiator(com.fasterxml.jackson.databind.deser.std.StdValueInstantiator src) {\n        _valueTypeDesc = src._valueTypeDesc;\n        _valueClass = src._valueClass;\n        _defaultCreator = src._defaultCreator;\n        _constructorArguments = src._constructorArguments;\n        _withArgsCreator = src._withArgsCreator;\n        _delegateType = src._delegateType;\n        _delegateCreator = src._delegateCreator;\n        _delegateArguments = src._delegateArguments;\n        _arrayDelegateType = src._arrayDelegateType;\n        _arrayDelegateCreator = src._arrayDelegateCreator;\n        _arrayDelegateArguments = src._arrayDelegateArguments;\n        _fromStringCreator = src._fromStringCreator;\n        _fromIntCreator = src._fromIntCreator;\n        _fromLongCreator = src._fromLongCreator;\n        _fromDoubleCreator = src._fromDoubleCreator;\n        _fromBooleanCreator = src._fromBooleanCreator;\n    }\n\n    public void configureFromObjectSettings(com.fasterxml.jackson.databind.introspect.AnnotatedWithParams defaultCreator, com.fasterxml.jackson.databind.introspect.AnnotatedWithParams delegateCreator, com.fasterxml.jackson.databind.JavaType delegateType, com.fasterxml.jackson.databind.deser.SettableBeanProperty[] delegateArgs, com.fasterxml.jackson.databind.introspect.AnnotatedWithParams withArgsCreator, com.fasterxml.jackson.databind.deser.SettableBeanProperty[] constructorArgs) {\n        _defaultCreator = defaultCreator;\n        _delegateCreator = delegateCreator;\n        _delegateType = delegateType;\n        _delegateArguments = delegateArgs;\n        _withArgsCreator = withArgsCreator;\n        _constructorArguments = constructorArgs;\n    }\n\n    public void configureFromArraySettings(com.fasterxml.jackson.databind.introspect.AnnotatedWithParams arrayDelegateCreator, com.fasterxml.jackson.databind.JavaType arrayDelegateType, com.fasterxml.jackson.databind.deser.SettableBeanProperty[] arrayDelegateArgs) {\n        _arrayDelegateCreator = arrayDelegateCreator;\n        _arrayDelegateType = arrayDelegateType;\n        _arrayDelegateArguments = arrayDelegateArgs;\n    }\n\n    public void configureFromStringCreator(com.fasterxml.jackson.databind.introspect.AnnotatedWithParams creator) {\n        _fromStringCreator = creator;\n    }\n\n    public void configureFromIntCreator(com.fasterxml.jackson.databind.introspect.AnnotatedWithParams creator) {\n        _fromIntCreator = creator;\n    }\n\n    public void configureFromLongCreator(com.fasterxml.jackson.databind.introspect.AnnotatedWithParams creator) {\n        _fromLongCreator = creator;\n    }\n\n    public void configureFromDoubleCreator(com.fasterxml.jackson.databind.introspect.AnnotatedWithParams creator) {\n        _fromDoubleCreator = creator;\n    }\n\n    public void configureFromBooleanCreator(com.fasterxml.jackson.databind.introspect.AnnotatedWithParams creator) {\n        _fromBooleanCreator = creator;\n    }\n\n    public void configureIncompleteParameter(com.fasterxml.jackson.databind.introspect.AnnotatedParameter parameter) {\n        _incompleteParameter = parameter;\n    }\n\n    @java.lang.Override\n    public java.lang.String getValueTypeDesc() {\n        return _valueTypeDesc;\n    }\n\n    @java.lang.Override\n    public java.lang.Class<?> getValueClass() {\n        return _valueClass;\n    }\n\n    @java.lang.Override\n    public boolean canCreateFromString() {\n        return _fromStringCreator != null;\n    }\n\n    @java.lang.Override\n    public boolean canCreateFromInt() {\n        return _fromIntCreator != null;\n    }\n\n    @java.lang.Override\n    public boolean canCreateFromLong() {\n        return _fromLongCreator != null;\n    }\n\n    @java.lang.Override\n    public boolean canCreateFromDouble() {\n        return _fromDoubleCreator != null;\n    }\n\n    @java.lang.Override\n    public boolean canCreateFromBoolean() {\n        return _fromBooleanCreator != null;\n    }\n\n    @java.lang.Override\n    public boolean canCreateUsingDefault() {\n        return _defaultCreator != null;\n    }\n\n    @java.lang.Override\n    public boolean canCreateUsingDelegate() {\n        return _delegateType != null;\n    }\n\n    @java.lang.Override\n    public boolean canCreateUsingArrayDelegate() {\n        return _arrayDelegateType != null;\n    }\n\n    @java.lang.Override\n    public boolean canCreateFromObjectWith() {\n        return _withArgsCreator != null;\n    }\n\n    @java.lang.Override\n    public boolean canInstantiate() {\n        return (((((((canCreateUsingDefault() || canCreateUsingDelegate()) || canCreateUsingArrayDelegate()) || canCreateFromObjectWith()) || canCreateFromString()) || canCreateFromInt()) || canCreateFromLong()) || canCreateFromDouble()) || canCreateFromBoolean();\n    }\n\n    @java.lang.Override\n    public com.fasterxml.jackson.databind.JavaType getDelegateType(com.fasterxml.jackson.databind.DeserializationConfig config) {\n        return _delegateType;\n    }\n\n    @java.lang.Override\n    public com.fasterxml.jackson.databind.JavaType getArrayDelegateType(com.fasterxml.jackson.databind.DeserializationConfig config) {\n        return _arrayDelegateType;\n    }\n\n    @java.lang.Override\n    public com.fasterxml.jackson.databind.deser.SettableBeanProperty[] getFromObjectArguments(com.fasterxml.jackson.databind.DeserializationConfig config) {\n        return _constructorArguments;\n    }\n\n    @java.lang.Override\n    public java.lang.Object createUsingDefault(com.fasterxml.jackson.databind.DeserializationContext ctxt) throws java.io.IOException {\n        if (_defaultCreator == null) {\n            return super.createUsingDefault(ctxt);\n        }\n        try {\n            return _defaultCreator.call();\n        } catch (java.lang.Throwable t) {\n            return ctxt.handleInstantiationProblem(_defaultCreator.getDeclaringClass(), null, rewrapCtorProblem(ctxt, t));\n        }\n    }\n\n    @java.lang.Override\n    public java.lang.Object createFromObjectWith(com.fasterxml.jackson.databind.DeserializationContext ctxt, java.lang.Object[] args) throws java.io.IOException {\n        if (_withArgsCreator == null) {\n            return super.createFromObjectWith(ctxt, args);\n        }\n        try {\n            return _withArgsCreator.call(args);\n        } catch (java.lang.Throwable t) {\n            return ctxt.handleInstantiationProblem(_withArgsCreator.getDeclaringClass(), args, rewrapCtorProblem(ctxt, t));\n        }\n    }\n\n    @java.lang.Override\n    public java.lang.Object createUsingDelegate(com.fasterxml.jackson.databind.DeserializationContext ctxt, java.lang.Object delegate) throws java.io.IOException {\n        if (_delegateCreator == null) {\n            if (_arrayDelegateCreator != null) {\n                return _createUsingDelegate(_arrayDelegateCreator, _arrayDelegateArguments, ctxt, delegate);\n            }\n        }\n        return _createUsingDelegate(_delegateCreator, _delegateArguments, ctxt, delegate);\n    }\n\n    @java.lang.Override\n    public java.lang.Object createUsingArrayDelegate(com.fasterxml.jackson.databind.DeserializationContext ctxt, java.lang.Object delegate) throws java.io.IOException {\n        if (_arrayDelegateCreator == null) {\n            if (_delegateCreator != null) {\n                return createUsingDelegate(ctxt, delegate);\n            }\n        }\n        return _createUsingDelegate(_arrayDelegateCreator, _arrayDelegateArguments, ctxt, delegate);\n    }\n\n    @java.lang.Override\n    public java.lang.Object createFromString(com.fasterxml.jackson.databind.DeserializationContext ctxt, java.lang.String value) throws java.io.IOException {\n        if (_fromStringCreator == null) {\n            return _createFromStringFallbacks(ctxt, value);\n        }\n        try {\n            return _fromStringCreator.call1(value);\n        } catch (java.lang.Throwable t) {\n            return ctxt.handleInstantiationProblem(_fromStringCreator.getDeclaringClass(), value, rewrapCtorProblem(ctxt, t));\n        }\n    }\n\n    @java.lang.Override\n    public java.lang.Object createFromInt(com.fasterxml.jackson.databind.DeserializationContext ctxt, int value) throws java.io.IOException {\n        if (_fromIntCreator != null) {\n            java.lang.Object arg = java.lang.Integer.valueOf(value);\n            try {\n                return _fromIntCreator.call1(arg);\n            } catch (java.lang.Throwable t0) {\n                return ctxt.handleInstantiationProblem(_fromIntCreator.getDeclaringClass(), arg, rewrapCtorProblem(ctxt, t0));\n            }\n        }\n        if (_fromLongCreator != null) {\n            java.lang.Object arg = java.lang.Long.valueOf(value);\n            try {\n                return _fromLongCreator.call1(arg);\n            } catch (java.lang.Throwable t0) {\n                return ctxt.handleInstantiationProblem(_fromLongCreator.getDeclaringClass(), arg, rewrapCtorProblem(ctxt, t0));\n            }\n        }\n        return super.createFromInt(ctxt, value);\n    }\n\n    @java.lang.Override\n    public java.lang.Object createFromLong(com.fasterxml.jackson.databind.DeserializationContext ctxt, long value) throws java.io.IOException {\n        if (_fromLongCreator == null) {\n            return super.createFromLong(ctxt, value);\n        }\n        java.lang.Object arg = java.lang.Long.valueOf(value);\n        try {\n            return _fromLongCreator.call1(arg);\n        } catch (java.lang.Throwable t0) {\n            return ctxt.handleInstantiationProblem(_fromLongCreator.getDeclaringClass(), arg, rewrapCtorProblem(ctxt, t0));\n        }\n    }\n\n    @java.lang.Override\n    public java.lang.Object createFromDouble(com.fasterxml.jackson.databind.DeserializationContext ctxt, double value) throws java.io.IOException {\n        if (_fromDoubleCreator == null) {\n            return super.createFromDouble(ctxt, value);\n        }\n        java.lang.Object arg = java.lang.Double.valueOf(value);\n        try {\n            return _fromDoubleCreator.call1(arg);\n        } catch (java.lang.Throwable t0) {\n            return ctxt.handleInstantiationProblem(_fromDoubleCreator.getDeclaringClass(), arg, rewrapCtorProblem(ctxt, t0));\n        }\n    }\n\n    @java.lang.Override\n    public java.lang.Object createFromBoolean(com.fasterxml.jackson.databind.DeserializationContext ctxt, boolean value) throws java.io.IOException {\n        if (_fromBooleanCreator == null) {\n            return super.createFromBoolean(ctxt, value);\n        }\n        final java.lang.Boolean arg = java.lang.Boolean.valueOf(value);\n        try {\n            return _fromBooleanCreator.call1(arg);\n        } catch (java.lang.Throwable t0) {\n            return ctxt.handleInstantiationProblem(_fromBooleanCreator.getDeclaringClass(), arg, rewrapCtorProblem(ctxt, t0));\n        }\n    }\n\n    @java.lang.Override\n    public com.fasterxml.jackson.databind.introspect.AnnotatedWithParams getDelegateCreator() {\n        return _delegateCreator;\n    }\n\n    @java.lang.Override\n    public com.fasterxml.jackson.databind.introspect.AnnotatedWithParams getArrayDelegateCreator() {\n        return _arrayDelegateCreator;\n    }\n\n    @java.lang.Override\n    public com.fasterxml.jackson.databind.introspect.AnnotatedWithParams getDefaultCreator() {\n        return _defaultCreator;\n    }\n\n    @java.lang.Override\n    public com.fasterxml.jackson.databind.introspect.AnnotatedWithParams getWithArgsCreator() {\n        return _withArgsCreator;\n    }\n\n    @java.lang.Override\n    public com.fasterxml.jackson.databind.introspect.AnnotatedParameter getIncompleteParameter() {\n        return _incompleteParameter;\n    }\n\n    @java.lang.Deprecated\n    protected com.fasterxml.jackson.databind.JsonMappingException wrapException(java.lang.Throwable t) {\n        for (java.lang.Throwable curr = t; curr != null; curr = curr.getCause()) {\n            if (curr instanceof com.fasterxml.jackson.databind.JsonMappingException) {\n                return ((com.fasterxml.jackson.databind.JsonMappingException) (curr));\n            }\n        }\n        return new com.fasterxml.jackson.databind.JsonMappingException(null, ((\"Instantiation of \" + getValueTypeDesc()) + \" value failed: \") + t.getMessage(), t);\n    }\n\n    protected com.fasterxml.jackson.databind.JsonMappingException unwrapAndWrapException(com.fasterxml.jackson.databind.DeserializationContext ctxt, java.lang.Throwable t) {\n        for (java.lang.Throwable curr = t; curr != null; curr = curr.getCause()) {\n            if (curr instanceof com.fasterxml.jackson.databind.JsonMappingException) {\n                return ((com.fasterxml.jackson.databind.JsonMappingException) (curr));\n            }\n        }\n        return ctxt.instantiationException(getValueClass(), t);\n    }\n\n    protected com.fasterxml.jackson.databind.JsonMappingException wrapAsJsonMappingException(com.fasterxml.jackson.databind.DeserializationContext ctxt, java.lang.Throwable t) {\n        if (t instanceof com.fasterxml.jackson.databind.JsonMappingException) {\n            return ((com.fasterxml.jackson.databind.JsonMappingException) (t));\n        }\n        return ctxt.instantiationException(getValueClass(), t);\n    }\n\n    protected com.fasterxml.jackson.databind.JsonMappingException rewrapCtorProblem(com.fasterxml.jackson.databind.DeserializationContext ctxt, java.lang.Throwable t) {\n        if ((t instanceof java.lang.ExceptionInInitializerError) || (t instanceof java.lang.reflect.InvocationTargetException)) {\n            java.lang.Throwable cause = t.getCause();\n            if (cause != null) {\n                t = cause;\n            }\n        }\n        return wrapAsJsonMappingException(ctxt, t);\n    }\n\n    private java.lang.Object _createUsingDelegate(com.fasterxml.jackson.databind.introspect.AnnotatedWithParams delegateCreator, com.fasterxml.jackson.databind.deser.SettableBeanProperty[] delegateArguments, com.fasterxml.jackson.databind.DeserializationContext ctxt, java.lang.Object delegate) throws java.io.IOException {\n        if (delegateCreator == null) {\n            throw new java.lang.IllegalStateException(\"No delegate constructor for \" + getValueTypeDesc());\n        }\n        try {\n            if (delegateArguments == null) {\n                return delegateCreator.call1(delegate);\n            }\n            final int len = delegateArguments.length;\n            java.lang.Object[] args = new java.lang.Object[len];\n            for (int i = 0; i < len; ++i) {\n                com.fasterxml.jackson.databind.deser.SettableBeanProperty prop = delegateArguments[i];\n                if (prop == null) {\n                    args[i] = delegate;\n                } else {\n                    args[i] = ctxt.findInjectableValue(prop.getInjectableValueId(), prop, null);\n                }\n            }\n            return delegateCreator.call(args);\n        } catch (java.lang.Throwable t) {\n            throw rewrapCtorProblem(ctxt, t);\n        }\n    }\n}",
            "src_parent_type": "Class",
            "src_type": "Method"
          }
        }
      ],
      "file_name": "StdValueInstantiator"
    }
  ],
  "id": "JacksonDatabind_90"
}