{
  "files": [
    {
      "features": [
        {
          "FEATURES_METHOD_INVOCATION": {},
          "FEATURES_TYPEACCESS": {},
          "FEATURES_VARS": {},
          "S10_METHOD_CALL_WITH_NULL_GUARD": "false",
          "S11_FAULTY_CLASS_EXCEPTION_TYPE": "false",
          "S12_METHOD_CALL_WITH_TRY_CATCH": "false",
          "S13_TYPE_OF_FAULTY_STATEMENT_AFTER_1": "Return",
          "S13_TYPE_OF_FAULTY_STATEMENT_AFTER_2": "",
          "S13_TYPE_OF_FAULTY_STATEMENT_AFTER_3": "",
          "S13_TYPE_OF_FAULTY_STATEMENT_BEFORE_1": "Invocation",
          "S13_TYPE_OF_FAULTY_STATEMENT_BEFORE_2": "If",
          "S13_TYPE_OF_FAULTY_STATEMENT_BEFORE_3": "",
          "S14_TYPE_OF_FAULTY_STATEMENT_PARENT": "Method",
          "S15_HAS_OBJECTIVE_METHOD_CALL": "false",
          "S16_HAS_Invocations_Prone_Exception": "false",
          "S18_In_Synchronized_Method": "false",
          "S1_LOCAL_VAR_NOT_ASSIGNED": "false",
          "S1_LOCAL_VAR_NOT_USED": "false",
          "S2_SIMILAR_OBJECT_TYPE_WITH_NORMAL_GUARD": "false",
          "S2_SIMILAR_OBJECT_TYPE_WITH_NULL_GUARD": "false",
          "S3_TYPE_OF_FAULTY_STATEMENT": "Invocation",
          "S4_Field_NOT_ASSIGNED": "false",
          "S4_Field_NOT_USED": "false",
          "S5_SIMILAR_PRIMITIVE_TYPE_WITH_NORMAL_GUARD": "false",
          "S5_SIMILAR_PRIMITIVE_TYPE_WITH_NULL_GUARD": "false",
          "S6_METHOD_THROWS_EXCEPTION": "false",
          "S7_OBJECT_USED_IN_ASSIGNMENT": "false",
          "S8_PRIMITIVE_USED_IN_ASSIGNMENT": "false",
          "S9_METHOD_CALL_WITH_NORMAL_GUARD": "false",
          "ast_info": {
            "dst": "tb.currentElement().nodeName()",
            "dst_parent": "tb.processEndTag(tb.currentElement().nodeName())",
            "dst_parent_type": "Invocation",
            "dst_type": "Invocation",
            "operator": "UPD",
            "src": "tb.currentElement().normalName()",
            "src_parent": "tb.processEndTag(tb.currentElement().normalName())",
            "src_parent_type": "Invocation",
            "src_type": "Invocation"
          }
        },
        {
          "FEATURES_METHOD_INVOCATION": {},
          "FEATURES_TYPEACCESS": {},
          "FEATURES_VARS": {},
          "S10_METHOD_CALL_WITH_NULL_GUARD": "false",
          "S11_FAULTY_CLASS_EXCEPTION_TYPE": "false",
          "S12_METHOD_CALL_WITH_TRY_CATCH": "false",
          "S13_TYPE_OF_FAULTY_STATEMENT_AFTER_1": "Return",
          "S13_TYPE_OF_FAULTY_STATEMENT_AFTER_2": "",
          "S13_TYPE_OF_FAULTY_STATEMENT_AFTER_3": "",
          "S13_TYPE_OF_FAULTY_STATEMENT_BEFORE_1": "LocalVariable",
          "S13_TYPE_OF_FAULTY_STATEMENT_BEFORE_2": "Invocation",
          "S13_TYPE_OF_FAULTY_STATEMENT_BEFORE_3": "",
          "S14_TYPE_OF_FAULTY_STATEMENT_PARENT": "Method",
          "S15_HAS_OBJECTIVE_METHOD_CALL": "false",
          "S16_HAS_Invocations_Prone_Exception": "false",
          "S18_In_Synchronized_Method": "false",
          "S1_LOCAL_VAR_NOT_ASSIGNED": "false",
          "S1_LOCAL_VAR_NOT_USED": "false",
          "S2_SIMILAR_OBJECT_TYPE_WITH_NORMAL_GUARD": "false",
          "S2_SIMILAR_OBJECT_TYPE_WITH_NULL_GUARD": "false",
          "S3_TYPE_OF_FAULTY_STATEMENT": "If",
          "S4_Field_NOT_ASSIGNED": "false",
          "S4_Field_NOT_USED": "false",
          "S5_SIMILAR_PRIMITIVE_TYPE_WITH_NORMAL_GUARD": "false",
          "S5_SIMILAR_PRIMITIVE_TYPE_WITH_NULL_GUARD": "false",
          "S6_METHOD_THROWS_EXCEPTION": "false",
          "S7_OBJECT_USED_IN_ASSIGNMENT": "false",
          "S8_PRIMITIVE_USED_IN_ASSIGNMENT": "false",
          "S9_METHOD_CALL_WITH_NORMAL_GUARD": "false",
          "ast_info": {
            "dst": "tb.currentElement().nodeName()",
            "dst_parent": "org.jsoup.internal.StringUtil.in(tb.currentElement().nodeName(), \"table\", \"tbody\", \"tfoot\", \"thead\", \"tr\")",
            "dst_parent_type": "Invocation",
            "dst_type": "Invocation",
            "operator": "UPD",
            "src": "tb.currentElement().normalName()",
            "src_parent": "org.jsoup.internal.StringUtil.in(tb.currentElement().normalName(), \"table\", \"tbody\", \"tfoot\", \"thead\", \"tr\")",
            "src_parent_type": "Invocation",
            "src_type": "Invocation"
          }
        },
        {
          "FEATURES_METHOD_INVOCATION": {},
          "FEATURES_TYPEACCESS": {},
          "FEATURES_VARS": {},
          "S10_METHOD_CALL_WITH_NULL_GUARD": "false",
          "S11_FAULTY_CLASS_EXCEPTION_TYPE": "false",
          "S12_METHOD_CALL_WITH_TRY_CATCH": "false",
          "S13_TYPE_OF_FAULTY_STATEMENT_AFTER_1": "",
          "S13_TYPE_OF_FAULTY_STATEMENT_AFTER_2": "",
          "S13_TYPE_OF_FAULTY_STATEMENT_AFTER_3": "",
          "S13_TYPE_OF_FAULTY_STATEMENT_BEFORE_1": "LocalVariable",
          "S13_TYPE_OF_FAULTY_STATEMENT_BEFORE_2": "",
          "S13_TYPE_OF_FAULTY_STATEMENT_BEFORE_3": "",
          "S14_TYPE_OF_FAULTY_STATEMENT_PARENT": "For",
          "S15_HAS_OBJECTIVE_METHOD_CALL": "false",
          "S16_HAS_Invocations_Prone_Exception": "false",
          "S18_In_Synchronized_Method": "false",
          "S1_LOCAL_VAR_NOT_ASSIGNED": "false",
          "S1_LOCAL_VAR_NOT_USED": "false",
          "S2_SIMILAR_OBJECT_TYPE_WITH_NORMAL_GUARD": "false",
          "S2_SIMILAR_OBJECT_TYPE_WITH_NULL_GUARD": "false",
          "S3_TYPE_OF_FAULTY_STATEMENT": "If",
          "S4_Field_NOT_ASSIGNED": "false",
          "S4_Field_NOT_USED": "false",
          "S5_SIMILAR_PRIMITIVE_TYPE_WITH_NORMAL_GUARD": "false",
          "S5_SIMILAR_PRIMITIVE_TYPE_WITH_NULL_GUARD": "false",
          "S6_METHOD_THROWS_EXCEPTION": "false",
          "S7_OBJECT_USED_IN_ASSIGNMENT": "false",
          "S8_PRIMITIVE_USED_IN_ASSIGNMENT": "false",
          "S9_METHOD_CALL_WITH_NORMAL_GUARD": "false",
          "ast_info": {
            "dst": "node.nodeName()",
            "dst_parent": "node.nodeName().equals(name)",
            "dst_parent_type": "Invocation",
            "dst_type": "Invocation",
            "operator": "UPD",
            "src": "node.normalName()",
            "src_parent": "node.normalName().equals(name)",
            "src_parent_type": "Invocation",
            "src_type": "Invocation"
          }
        },
        {
          "FEATURES_METHOD_INVOCATION": {},
          "FEATURES_TYPEACCESS": {},
          "FEATURES_VARS": {},
          "S10_METHOD_CALL_WITH_NULL_GUARD": "false",
          "S11_FAULTY_CLASS_EXCEPTION_TYPE": "false",
          "S12_METHOD_CALL_WITH_TRY_CATCH": "false",
          "S13_TYPE_OF_FAULTY_STATEMENT_AFTER_1": "",
          "S13_TYPE_OF_FAULTY_STATEMENT_AFTER_2": "",
          "S13_TYPE_OF_FAULTY_STATEMENT_AFTER_3": "",
          "S13_TYPE_OF_FAULTY_STATEMENT_BEFORE_1": "",
          "S13_TYPE_OF_FAULTY_STATEMENT_BEFORE_2": "",
          "S13_TYPE_OF_FAULTY_STATEMENT_BEFORE_3": "",
          "S14_TYPE_OF_FAULTY_STATEMENT_PARENT": "Case",
          "S15_HAS_OBJECTIVE_METHOD_CALL": "false",
          "S16_HAS_Invocations_Prone_Exception": "false",
          "S18_In_Synchronized_Method": "false",
          "S1_LOCAL_VAR_NOT_ASSIGNED": "false",
          "S1_LOCAL_VAR_NOT_USED": "false",
          "S2_SIMILAR_OBJECT_TYPE_WITH_NORMAL_GUARD": "false",
          "S2_SIMILAR_OBJECT_TYPE_WITH_NULL_GUARD": "false",
          "S3_TYPE_OF_FAULTY_STATEMENT": "If",
          "S4_Field_NOT_ASSIGNED": "false",
          "S4_Field_NOT_USED": "false",
          "S5_SIMILAR_PRIMITIVE_TYPE_WITH_NORMAL_GUARD": "false",
          "S5_SIMILAR_PRIMITIVE_TYPE_WITH_NULL_GUARD": "false",
          "S6_METHOD_THROWS_EXCEPTION": "false",
          "S7_OBJECT_USED_IN_ASSIGNMENT": "false",
          "S8_PRIMITIVE_USED_IN_ASSIGNMENT": "false",
          "S9_METHOD_CALL_WITH_NORMAL_GUARD": "false",
          "ast_info": {
            "dst": "tb.currentElement().nodeName()",
            "dst_parent": "tb.currentElement().nodeName().equals(\"html\")",
            "dst_parent_type": "Invocation",
            "dst_type": "Invocation",
            "operator": "UPD",
            "src": "tb.currentElement().normalName()",
            "src_parent": "tb.currentElement().normalName().equals(\"html\")",
            "src_parent_type": "Invocation",
            "src_type": "Invocation"
          }
        },
        {
          "FEATURES_METHOD_INVOCATION": {},
          "FEATURES_TYPEACCESS": {},
          "FEATURES_VARS": {},
          "S10_METHOD_CALL_WITH_NULL_GUARD": "false",
          "S11_FAULTY_CLASS_EXCEPTION_TYPE": "false",
          "S12_METHOD_CALL_WITH_TRY_CATCH": "false",
          "S13_TYPE_OF_FAULTY_STATEMENT_AFTER_1": "Break",
          "S13_TYPE_OF_FAULTY_STATEMENT_AFTER_2": "",
          "S13_TYPE_OF_FAULTY_STATEMENT_AFTER_3": "",
          "S13_TYPE_OF_FAULTY_STATEMENT_BEFORE_1": "",
          "S13_TYPE_OF_FAULTY_STATEMENT_BEFORE_2": "",
          "S13_TYPE_OF_FAULTY_STATEMENT_BEFORE_3": "",
          "S14_TYPE_OF_FAULTY_STATEMENT_PARENT": "Case",
          "S15_HAS_OBJECTIVE_METHOD_CALL": "false",
          "S16_HAS_Invocations_Prone_Exception": "false",
          "S18_In_Synchronized_Method": "false",
          "S1_LOCAL_VAR_NOT_ASSIGNED": "false",
          "S1_LOCAL_VAR_NOT_USED": "false",
          "S2_SIMILAR_OBJECT_TYPE_WITH_NORMAL_GUARD": "false",
          "S2_SIMILAR_OBJECT_TYPE_WITH_NULL_GUARD": "false",
          "S3_TYPE_OF_FAULTY_STATEMENT": "If",
          "S4_Field_NOT_ASSIGNED": "false",
          "S4_Field_NOT_USED": "false",
          "S5_SIMILAR_PRIMITIVE_TYPE_WITH_NORMAL_GUARD": "false",
          "S5_SIMILAR_PRIMITIVE_TYPE_WITH_NULL_GUARD": "false",
          "S6_METHOD_THROWS_EXCEPTION": "false",
          "S7_OBJECT_USED_IN_ASSIGNMENT": "false",
          "S8_PRIMITIVE_USED_IN_ASSIGNMENT": "false",
          "S9_METHOD_CALL_WITH_NORMAL_GUARD": "false",
          "ast_info": {
            "dst": "tb.currentElement().nodeName()",
            "dst_parent": "tb.currentElement().nodeName().equals(\"html\")",
            "dst_parent_type": "Invocation",
            "dst_type": "Invocation",
            "operator": "UPD",
            "src": "tb.currentElement().normalName()",
            "src_parent": "tb.currentElement().normalName().equals(\"html\")",
            "src_parent_type": "Invocation",
            "src_type": "Invocation"
          }
        },
        {
          "FEATURES_METHOD_INVOCATION": {},
          "FEATURES_TYPEACCESS": {},
          "FEATURES_VARS": {},
          "S10_METHOD_CALL_WITH_NULL_GUARD": "false",
          "S11_FAULTY_CLASS_EXCEPTION_TYPE": "false",
          "S12_METHOD_CALL_WITH_TRY_CATCH": "false",
          "S13_TYPE_OF_FAULTY_STATEMENT_AFTER_1": "Invocation",
          "S13_TYPE_OF_FAULTY_STATEMENT_AFTER_2": "Break",
          "S13_TYPE_OF_FAULTY_STATEMENT_AFTER_3": "",
          "S13_TYPE_OF_FAULTY_STATEMENT_BEFORE_1": "Invocation",
          "S13_TYPE_OF_FAULTY_STATEMENT_BEFORE_2": "",
          "S13_TYPE_OF_FAULTY_STATEMENT_BEFORE_3": "",
          "S14_TYPE_OF_FAULTY_STATEMENT_PARENT": "If",
          "S15_HAS_OBJECTIVE_METHOD_CALL": "true",
          "S16_HAS_Invocations_Prone_Exception": "false",
          "S18_In_Synchronized_Method": "false",
          "S1_LOCAL_VAR_NOT_ASSIGNED": "false",
          "S1_LOCAL_VAR_NOT_USED": "false",
          "S2_SIMILAR_OBJECT_TYPE_WITH_NORMAL_GUARD": "false",
          "S2_SIMILAR_OBJECT_TYPE_WITH_NULL_GUARD": "false",
          "S3_TYPE_OF_FAULTY_STATEMENT": "If",
          "S4_Field_NOT_ASSIGNED": "false",
          "S4_Field_NOT_USED": "false",
          "S5_SIMILAR_PRIMITIVE_TYPE_WITH_NORMAL_GUARD": "false",
          "S5_SIMILAR_PRIMITIVE_TYPE_WITH_NULL_GUARD": "false",
          "S6_METHOD_THROWS_EXCEPTION": "false",
          "S7_OBJECT_USED_IN_ASSIGNMENT": "false",
          "S8_PRIMITIVE_USED_IN_ASSIGNMENT": "false",
          "S9_METHOD_CALL_WITH_NORMAL_GUARD": "false",
          "ast_info": {
            "dst": "tb.currentElement().nodeName()",
            "dst_parent": "name.equals(tb.currentElement().nodeName())",
            "dst_parent_type": "Invocation",
            "dst_type": "Invocation",
            "operator": "UPD",
            "src": "tb.currentElement().normalName()",
            "src_parent": "name.equals(tb.currentElement().normalName())",
            "src_parent_type": "Invocation",
            "src_type": "Invocation"
          }
        },
        {
          "FEATURES_METHOD_INVOCATION": {},
          "FEATURES_TYPEACCESS": {},
          "FEATURES_VARS": {},
          "S10_METHOD_CALL_WITH_NULL_GUARD": "false",
          "S11_FAULTY_CLASS_EXCEPTION_TYPE": "false",
          "S12_METHOD_CALL_WITH_TRY_CATCH": "false",
          "S13_TYPE_OF_FAULTY_STATEMENT_AFTER_1": "",
          "S13_TYPE_OF_FAULTY_STATEMENT_AFTER_2": "",
          "S13_TYPE_OF_FAULTY_STATEMENT_AFTER_3": "",
          "S13_TYPE_OF_FAULTY_STATEMENT_BEFORE_1": "",
          "S13_TYPE_OF_FAULTY_STATEMENT_BEFORE_2": "",
          "S13_TYPE_OF_FAULTY_STATEMENT_BEFORE_3": "",
          "S14_TYPE_OF_FAULTY_STATEMENT_PARENT": "If",
          "S15_HAS_OBJECTIVE_METHOD_CALL": "false",
          "S16_HAS_Invocations_Prone_Exception": "false",
          "S18_In_Synchronized_Method": "false",
          "S1_LOCAL_VAR_NOT_ASSIGNED": "false",
          "S1_LOCAL_VAR_NOT_USED": "false",
          "S2_SIMILAR_OBJECT_TYPE_WITH_NORMAL_GUARD": "false",
          "S2_SIMILAR_OBJECT_TYPE_WITH_NULL_GUARD": "false",
          "S3_TYPE_OF_FAULTY_STATEMENT": "If",
          "S4_Field_NOT_ASSIGNED": "false",
          "S4_Field_NOT_USED": "false",
          "S5_SIMILAR_PRIMITIVE_TYPE_WITH_NORMAL_GUARD": "false",
          "S5_SIMILAR_PRIMITIVE_TYPE_WITH_NULL_GUARD": "false",
          "S6_METHOD_THROWS_EXCEPTION": "false",
          "S7_OBJECT_USED_IN_ASSIGNMENT": "false",
          "S8_PRIMITIVE_USED_IN_ASSIGNMENT": "false",
          "S9_METHOD_CALL_WITH_NORMAL_GUARD": "false",
          "ast_info": {
            "dst": "tb.currentElement().nodeName()",
            "dst_parent": "tb.currentElement().nodeName().equals(\"html\")",
            "dst_parent_type": "Invocation",
            "dst_type": "Invocation",
            "operator": "UPD",
            "src": "tb.currentElement().normalName()",
            "src_parent": "tb.currentElement().normalName().equals(\"html\")",
            "src_parent_type": "Invocation",
            "src_type": "Invocation"
          }
        },
        {
          "FEATURES_METHOD_INVOCATION": {},
          "FEATURES_TYPEACCESS": {},
          "FEATURES_VARS": {},
          "S10_METHOD_CALL_WITH_NULL_GUARD": "false",
          "S11_FAULTY_CLASS_EXCEPTION_TYPE": "false",
          "S12_METHOD_CALL_WITH_TRY_CATCH": "false",
          "S13_TYPE_OF_FAULTY_STATEMENT_AFTER_1": "Break",
          "S13_TYPE_OF_FAULTY_STATEMENT_AFTER_2": "",
          "S13_TYPE_OF_FAULTY_STATEMENT_AFTER_3": "",
          "S13_TYPE_OF_FAULTY_STATEMENT_BEFORE_1": "If",
          "S13_TYPE_OF_FAULTY_STATEMENT_BEFORE_2": "",
          "S13_TYPE_OF_FAULTY_STATEMENT_BEFORE_3": "",
          "S14_TYPE_OF_FAULTY_STATEMENT_PARENT": "Case",
          "S15_HAS_OBJECTIVE_METHOD_CALL": "false",
          "S16_HAS_Invocations_Prone_Exception": "false",
          "S18_In_Synchronized_Method": "false",
          "S1_LOCAL_VAR_NOT_ASSIGNED": "false",
          "S1_LOCAL_VAR_NOT_USED": "false",
          "S2_SIMILAR_OBJECT_TYPE_WITH_NORMAL_GUARD": "false",
          "S2_SIMILAR_OBJECT_TYPE_WITH_NULL_GUARD": "false",
          "S3_TYPE_OF_FAULTY_STATEMENT": "If",
          "S4_Field_NOT_ASSIGNED": "false",
          "S4_Field_NOT_USED": "false",
          "S5_SIMILAR_PRIMITIVE_TYPE_WITH_NORMAL_GUARD": "false",
          "S5_SIMILAR_PRIMITIVE_TYPE_WITH_NULL_GUARD": "false",
          "S6_METHOD_THROWS_EXCEPTION": "false",
          "S7_OBJECT_USED_IN_ASSIGNMENT": "false",
          "S8_PRIMITIVE_USED_IN_ASSIGNMENT": "false",
          "S9_METHOD_CALL_WITH_NORMAL_GUARD": "false",
          "ast_info": {
            "dst": "tb.currentElement().nodeName()",
            "dst_parent": "tb.currentElement().nodeName().equals(\"optgroup\")",
            "dst_parent_type": "Invocation",
            "dst_type": "Invocation",
            "operator": "UPD",
            "src": "tb.currentElement().normalName()",
            "src_parent": "tb.currentElement().normalName().equals(\"optgroup\")",
            "src_parent_type": "Invocation",
            "src_type": "Invocation"
          }
        },
        {
          "FEATURES_METHOD_INVOCATION": {},
          "FEATURES_TYPEACCESS": {},
          "FEATURES_VARS": {},
          "S10_METHOD_CALL_WITH_NULL_GUARD": "false",
          "S11_FAULTY_CLASS_EXCEPTION_TYPE": "false",
          "S12_METHOD_CALL_WITH_TRY_CATCH": "false",
          "S13_TYPE_OF_FAULTY_STATEMENT_AFTER_1": "Break",
          "S13_TYPE_OF_FAULTY_STATEMENT_AFTER_2": "",
          "S13_TYPE_OF_FAULTY_STATEMENT_AFTER_3": "",
          "S13_TYPE_OF_FAULTY_STATEMENT_BEFORE_1": "",
          "S13_TYPE_OF_FAULTY_STATEMENT_BEFORE_2": "",
          "S13_TYPE_OF_FAULTY_STATEMENT_BEFORE_3": "",
          "S14_TYPE_OF_FAULTY_STATEMENT_PARENT": "Case",
          "S15_HAS_OBJECTIVE_METHOD_CALL": "false",
          "S16_HAS_Invocations_Prone_Exception": "false",
          "S18_In_Synchronized_Method": "false",
          "S1_LOCAL_VAR_NOT_ASSIGNED": "false",
          "S1_LOCAL_VAR_NOT_USED": "false",
          "S2_SIMILAR_OBJECT_TYPE_WITH_NORMAL_GUARD": "false",
          "S2_SIMILAR_OBJECT_TYPE_WITH_NULL_GUARD": "false",
          "S3_TYPE_OF_FAULTY_STATEMENT": "If",
          "S4_Field_NOT_ASSIGNED": "false",
          "S4_Field_NOT_USED": "false",
          "S5_SIMILAR_PRIMITIVE_TYPE_WITH_NORMAL_GUARD": "false",
          "S5_SIMILAR_PRIMITIVE_TYPE_WITH_NULL_GUARD": "false",
          "S6_METHOD_THROWS_EXCEPTION": "false",
          "S7_OBJECT_USED_IN_ASSIGNMENT": "false",
          "S8_PRIMITIVE_USED_IN_ASSIGNMENT": "false",
          "S9_METHOD_CALL_WITH_NORMAL_GUARD": "false",
          "ast_info": {
            "dst": "tb.currentElement().nodeName()",
            "dst_parent": "tb.currentElement().nodeName().equals(\"option\")",
            "dst_parent_type": "Invocation",
            "dst_type": "Invocation",
            "operator": "UPD",
            "src": "tb.currentElement().normalName()",
            "src_parent": "tb.currentElement().normalName().equals(\"option\")",
            "src_parent_type": "Invocation",
            "src_type": "Invocation"
          }
        },
        {
          "FEATURES_METHOD_INVOCATION": {},
          "FEATURES_TYPEACCESS": {},
          "FEATURES_VARS": {},
          "S10_METHOD_CALL_WITH_NULL_GUARD": "false",
          "S11_FAULTY_CLASS_EXCEPTION_TYPE": "false",
          "S12_METHOD_CALL_WITH_TRY_CATCH": "false",
          "S13_TYPE_OF_FAULTY_STATEMENT_AFTER_1": "LocalVariable",
          "S13_TYPE_OF_FAULTY_STATEMENT_AFTER_2": "Invocation",
          "S13_TYPE_OF_FAULTY_STATEMENT_AFTER_3": "LocalVariable",
          "S13_TYPE_OF_FAULTY_STATEMENT_BEFORE_1": "For",
          "S13_TYPE_OF_FAULTY_STATEMENT_BEFORE_2": "LocalVariable",
          "S13_TYPE_OF_FAULTY_STATEMENT_BEFORE_3": "LocalVariable",
          "S14_TYPE_OF_FAULTY_STATEMENT_PARENT": "For",
          "S15_HAS_OBJECTIVE_METHOD_CALL": "false",
          "S16_HAS_Invocations_Prone_Exception": "false",
          "S18_In_Synchronized_Method": "false",
          "S1_LOCAL_VAR_NOT_ASSIGNED": "false",
          "S1_LOCAL_VAR_NOT_USED": "false",
          "S2_SIMILAR_OBJECT_TYPE_WITH_NORMAL_GUARD": "false",
          "S2_SIMILAR_OBJECT_TYPE_WITH_NULL_GUARD": "false",
          "S3_TYPE_OF_FAULTY_STATEMENT": "If",
          "S4_Field_NOT_ASSIGNED": "false",
          "S4_Field_NOT_USED": "false",
          "S5_SIMILAR_PRIMITIVE_TYPE_WITH_NORMAL_GUARD": "false",
          "S5_SIMILAR_PRIMITIVE_TYPE_WITH_NULL_GUARD": "false",
          "S6_METHOD_THROWS_EXCEPTION": "false",
          "S7_OBJECT_USED_IN_ASSIGNMENT": "false",
          "S8_PRIMITIVE_USED_IN_ASSIGNMENT": "false",
          "S9_METHOD_CALL_WITH_NORMAL_GUARD": "false",
          "ast_info": {
            "dst": "commonAncestor.nodeName()",
            "dst_parent": "org.jsoup.internal.StringUtil.inSorted(commonAncestor.nodeName(), org.jsoup.parser.HtmlTreeBuilderState.Constants.InBodyEndTableFosters)",
            "dst_parent_type": "Invocation",
            "dst_type": "Invocation",
            "operator": "UPD",
            "src": "commonAncestor.normalName()",
            "src_parent": "org.jsoup.internal.StringUtil.inSorted(commonAncestor.normalName(), org.jsoup.parser.HtmlTreeBuilderState.Constants.InBodyEndTableFosters)",
            "src_parent_type": "Invocation",
            "src_type": "Invocation"
          }
        },
        {
          "FEATURES_METHOD_INVOCATION": {},
          "FEATURES_TYPEACCESS": {},
          "FEATURES_VARS": {},
          "S10_METHOD_CALL_WITH_NULL_GUARD": "false",
          "S11_FAULTY_CLASS_EXCEPTION_TYPE": "false",
          "S12_METHOD_CALL_WITH_TRY_CATCH": "false",
          "S13_TYPE_OF_FAULTY_STATEMENT_AFTER_1": "Invocation",
          "S13_TYPE_OF_FAULTY_STATEMENT_AFTER_2": "Invocation",
          "S13_TYPE_OF_FAULTY_STATEMENT_AFTER_3": "Invocation",
          "S13_TYPE_OF_FAULTY_STATEMENT_BEFORE_1": "Invocation",
          "S13_TYPE_OF_FAULTY_STATEMENT_BEFORE_2": "",
          "S13_TYPE_OF_FAULTY_STATEMENT_BEFORE_3": "",
          "S14_TYPE_OF_FAULTY_STATEMENT_PARENT": "If",
          "S15_HAS_OBJECTIVE_METHOD_CALL": "false",
          "S16_HAS_Invocations_Prone_Exception": "false",
          "S18_In_Synchronized_Method": "false",
          "S1_LOCAL_VAR_NOT_ASSIGNED": "false",
          "S1_LOCAL_VAR_NOT_USED": "false",
          "S2_SIMILAR_OBJECT_TYPE_WITH_NORMAL_GUARD": "false",
          "S2_SIMILAR_OBJECT_TYPE_WITH_NULL_GUARD": "false",
          "S3_TYPE_OF_FAULTY_STATEMENT": "If",
          "S4_Field_NOT_ASSIGNED": "false",
          "S4_Field_NOT_USED": "false",
          "S5_SIMILAR_PRIMITIVE_TYPE_WITH_NORMAL_GUARD": "false",
          "S5_SIMILAR_PRIMITIVE_TYPE_WITH_NULL_GUARD": "false",
          "S6_METHOD_THROWS_EXCEPTION": "false",
          "S7_OBJECT_USED_IN_ASSIGNMENT": "false",
          "S8_PRIMITIVE_USED_IN_ASSIGNMENT": "false",
          "S9_METHOD_CALL_WITH_NORMAL_GUARD": "false",
          "ast_info": {
            "dst": "tb.currentElement().nodeName()",
            "dst_parent": "tb.currentElement().nodeName().equals(\"caption\")",
            "dst_parent_type": "Invocation",
            "dst_type": "Invocation",
            "operator": "UPD",
            "src": "tb.currentElement().normalName()",
            "src_parent": "tb.currentElement().normalName().equals(\"caption\")",
            "src_parent_type": "Invocation",
            "src_type": "Invocation"
          }
        },
        {
          "FEATURES_METHOD_INVOCATION": {},
          "FEATURES_TYPEACCESS": {},
          "FEATURES_VARS": {},
          "S10_METHOD_CALL_WITH_NULL_GUARD": "false",
          "S11_FAULTY_CLASS_EXCEPTION_TYPE": "false",
          "S12_METHOD_CALL_WITH_TRY_CATCH": "false",
          "S13_TYPE_OF_FAULTY_STATEMENT_AFTER_1": "Invocation",
          "S13_TYPE_OF_FAULTY_STATEMENT_AFTER_2": "Invocation",
          "S13_TYPE_OF_FAULTY_STATEMENT_AFTER_3": "Invocation",
          "S13_TYPE_OF_FAULTY_STATEMENT_BEFORE_1": "Invocation",
          "S13_TYPE_OF_FAULTY_STATEMENT_BEFORE_2": "If",
          "S13_TYPE_OF_FAULTY_STATEMENT_BEFORE_3": "",
          "S14_TYPE_OF_FAULTY_STATEMENT_PARENT": "If",
          "S15_HAS_OBJECTIVE_METHOD_CALL": "false",
          "S16_HAS_Invocations_Prone_Exception": "false",
          "S18_In_Synchronized_Method": "false",
          "S1_LOCAL_VAR_NOT_ASSIGNED": "false",
          "S1_LOCAL_VAR_NOT_USED": "false",
          "S2_SIMILAR_OBJECT_TYPE_WITH_NORMAL_GUARD": "false",
          "S2_SIMILAR_OBJECT_TYPE_WITH_NULL_GUARD": "false",
          "S3_TYPE_OF_FAULTY_STATEMENT": "If",
          "S4_Field_NOT_ASSIGNED": "false",
          "S4_Field_NOT_USED": "false",
          "S5_SIMILAR_PRIMITIVE_TYPE_WITH_NORMAL_GUARD": "false",
          "S5_SIMILAR_PRIMITIVE_TYPE_WITH_NULL_GUARD": "false",
          "S6_METHOD_THROWS_EXCEPTION": "false",
          "S7_OBJECT_USED_IN_ASSIGNMENT": "false",
          "S8_PRIMITIVE_USED_IN_ASSIGNMENT": "false",
          "S9_METHOD_CALL_WITH_NORMAL_GUARD": "false",
          "ast_info": {
            "dst": "tb.currentElement().nodeName()",
            "dst_parent": "tb.currentElement().nodeName().equals(name)",
            "dst_parent_type": "Invocation",
            "dst_type": "Invocation",
            "operator": "UPD",
            "src": "tb.currentElement().normalName()",
            "src_parent": "tb.currentElement().normalName().equals(name)",
            "src_parent_type": "Invocation",
            "src_type": "Invocation"
          }
        },
        {
          "FEATURES_METHOD_INVOCATION": {},
          "FEATURES_TYPEACCESS": {},
          "FEATURES_VARS": {},
          "S10_METHOD_CALL_WITH_NULL_GUARD": "false",
          "S11_FAULTY_CLASS_EXCEPTION_TYPE": "false",
          "S12_METHOD_CALL_WITH_TRY_CATCH": "false",
          "S13_TYPE_OF_FAULTY_STATEMENT_AFTER_1": "If",
          "S13_TYPE_OF_FAULTY_STATEMENT_AFTER_2": "Break",
          "S13_TYPE_OF_FAULTY_STATEMENT_AFTER_3": "",
          "S13_TYPE_OF_FAULTY_STATEMENT_BEFORE_1": "",
          "S13_TYPE_OF_FAULTY_STATEMENT_BEFORE_2": "",
          "S13_TYPE_OF_FAULTY_STATEMENT_BEFORE_3": "",
          "S14_TYPE_OF_FAULTY_STATEMENT_PARENT": "Case",
          "S15_HAS_OBJECTIVE_METHOD_CALL": "true",
          "S16_HAS_Invocations_Prone_Exception": "false",
          "S18_In_Synchronized_Method": "false",
          "S1_LOCAL_VAR_NOT_ASSIGNED": "false",
          "S1_LOCAL_VAR_NOT_USED": "false",
          "S2_SIMILAR_OBJECT_TYPE_WITH_NORMAL_GUARD": "false",
          "S2_SIMILAR_OBJECT_TYPE_WITH_NULL_GUARD": "false",
          "S3_TYPE_OF_FAULTY_STATEMENT": "If",
          "S4_Field_NOT_ASSIGNED": "false",
          "S4_Field_NOT_USED": "false",
          "S5_SIMILAR_PRIMITIVE_TYPE_WITH_NORMAL_GUARD": "false",
          "S5_SIMILAR_PRIMITIVE_TYPE_WITH_NULL_GUARD": "false",
          "S6_METHOD_THROWS_EXCEPTION": "false",
          "S7_OBJECT_USED_IN_ASSIGNMENT": "false",
          "S8_PRIMITIVE_USED_IN_ASSIGNMENT": "false",
          "S9_METHOD_CALL_WITH_NORMAL_GUARD": "false",
          "ast_info": {
            "dst": "tb.aboveOnStack(tb.currentElement()).nodeName()",
            "dst_parent": "tb.aboveOnStack(tb.currentElement()).nodeName().equals(\"optgroup\")",
            "dst_parent_type": "Invocation",
            "dst_type": "Invocation",
            "operator": "UPD",
            "src": "tb.aboveOnStack(tb.currentElement()).normalName()",
            "src_parent": "tb.aboveOnStack(tb.currentElement()).normalName().equals(\"optgroup\")",
            "src_parent_type": "Invocation",
            "src_type": "Invocation"
          }
        },
        {
          "FEATURES_METHOD_INVOCATION": {},
          "FEATURES_TYPEACCESS": {},
          "FEATURES_VARS": {},
          "S10_METHOD_CALL_WITH_NULL_GUARD": "false",
          "S11_FAULTY_CLASS_EXCEPTION_TYPE": "false",
          "S12_METHOD_CALL_WITH_TRY_CATCH": "false",
          "S13_TYPE_OF_FAULTY_STATEMENT_AFTER_1": "Invocation",
          "S13_TYPE_OF_FAULTY_STATEMENT_AFTER_2": "Return",
          "S13_TYPE_OF_FAULTY_STATEMENT_AFTER_3": "",
          "S13_TYPE_OF_FAULTY_STATEMENT_BEFORE_1": "",
          "S13_TYPE_OF_FAULTY_STATEMENT_BEFORE_2": "",
          "S13_TYPE_OF_FAULTY_STATEMENT_BEFORE_3": "",
          "S14_TYPE_OF_FAULTY_STATEMENT_PARENT": "If",
          "S15_HAS_OBJECTIVE_METHOD_CALL": "false",
          "S16_HAS_Invocations_Prone_Exception": "true",
          "S18_In_Synchronized_Method": "false",
          "S1_LOCAL_VAR_NOT_ASSIGNED": "false",
          "S1_LOCAL_VAR_NOT_USED": "false",
          "S2_SIMILAR_OBJECT_TYPE_WITH_NORMAL_GUARD": "false",
          "S2_SIMILAR_OBJECT_TYPE_WITH_NULL_GUARD": "false",
          "S3_TYPE_OF_FAULTY_STATEMENT": "Invocation",
          "S4_Field_NOT_ASSIGNED": "false",
          "S4_Field_NOT_USED": "false",
          "S5_SIMILAR_PRIMITIVE_TYPE_WITH_NORMAL_GUARD": "false",
          "S5_SIMILAR_PRIMITIVE_TYPE_WITH_NULL_GUARD": "false",
          "S6_METHOD_THROWS_EXCEPTION": "false",
          "S7_OBJECT_USED_IN_ASSIGNMENT": "false",
          "S8_PRIMITIVE_USED_IN_ASSIGNMENT": "false",
          "S9_METHOD_CALL_WITH_NORMAL_GUARD": "false",
          "ast_info": {
            "dst": "formatEl.nodeName()",
            "dst_parent": "tb.popStackToClose(formatEl.nodeName())",
            "dst_parent_type": "Invocation",
            "dst_type": "Invocation",
            "operator": "UPD",
            "src": "formatEl.normalName()",
            "src_parent": "tb.popStackToClose(formatEl.normalName())",
            "src_parent_type": "Invocation",
            "src_type": "Invocation"
          }
        },
        {
          "FEATURES_METHOD_INVOCATION": {},
          "FEATURES_TYPEACCESS": {},
          "FEATURES_VARS": {},
          "S10_METHOD_CALL_WITH_NULL_GUARD": "false",
          "S11_FAULTY_CLASS_EXCEPTION_TYPE": "false",
          "S12_METHOD_CALL_WITH_TRY_CATCH": "false",
          "S13_TYPE_OF_FAULTY_STATEMENT_AFTER_1": "Invocation",
          "S13_TYPE_OF_FAULTY_STATEMENT_AFTER_2": "",
          "S13_TYPE_OF_FAULTY_STATEMENT_AFTER_3": "",
          "S13_TYPE_OF_FAULTY_STATEMENT_BEFORE_1": "",
          "S13_TYPE_OF_FAULTY_STATEMENT_BEFORE_2": "",
          "S13_TYPE_OF_FAULTY_STATEMENT_BEFORE_3": "",
          "S14_TYPE_OF_FAULTY_STATEMENT_PARENT": "If",
          "S15_HAS_OBJECTIVE_METHOD_CALL": "false",
          "S16_HAS_Invocations_Prone_Exception": "false",
          "S18_In_Synchronized_Method": "false",
          "S1_LOCAL_VAR_NOT_ASSIGNED": "false",
          "S1_LOCAL_VAR_NOT_USED": "false",
          "S2_SIMILAR_OBJECT_TYPE_WITH_NORMAL_GUARD": "false",
          "S2_SIMILAR_OBJECT_TYPE_WITH_NULL_GUARD": "false",
          "S3_TYPE_OF_FAULTY_STATEMENT": "If",
          "S4_Field_NOT_ASSIGNED": "false",
          "S4_Field_NOT_USED": "false",
          "S5_SIMILAR_PRIMITIVE_TYPE_WITH_NORMAL_GUARD": "false",
          "S5_SIMILAR_PRIMITIVE_TYPE_WITH_NULL_GUARD": "false",
          "S6_METHOD_THROWS_EXCEPTION": "false",
          "S7_OBJECT_USED_IN_ASSIGNMENT": "false",
          "S8_PRIMITIVE_USED_IN_ASSIGNMENT": "false",
          "S9_METHOD_CALL_WITH_NORMAL_GUARD": "false",
          "ast_info": {
            "dst": "tb.currentElement().nodeName()",
            "dst_parent": "tb.currentElement().nodeName().equals(\"option\")",
            "dst_parent_type": "Invocation",
            "dst_type": "Invocation",
            "operator": "UPD",
            "src": "tb.currentElement().normalName()",
            "src_parent": "tb.currentElement().normalName().equals(\"option\")",
            "src_parent_type": "Invocation",
            "src_type": "Invocation"
          }
        },
        {
          "FEATURES_METHOD_INVOCATION": {},
          "FEATURES_TYPEACCESS": {},
          "FEATURES_VARS": {},
          "S10_METHOD_CALL_WITH_NULL_GUARD": "false",
          "S11_FAULTY_CLASS_EXCEPTION_TYPE": "false",
          "S12_METHOD_CALL_WITH_TRY_CATCH": "false",
          "S13_TYPE_OF_FAULTY_STATEMENT_AFTER_1": "If",
          "S13_TYPE_OF_FAULTY_STATEMENT_AFTER_2": "Break",
          "S13_TYPE_OF_FAULTY_STATEMENT_AFTER_3": "",
          "S13_TYPE_OF_FAULTY_STATEMENT_BEFORE_1": "",
          "S13_TYPE_OF_FAULTY_STATEMENT_BEFORE_2": "",
          "S13_TYPE_OF_FAULTY_STATEMENT_BEFORE_3": "",
          "S14_TYPE_OF_FAULTY_STATEMENT_PARENT": "Case",
          "S15_HAS_OBJECTIVE_METHOD_CALL": "true",
          "S16_HAS_Invocations_Prone_Exception": "false",
          "S18_In_Synchronized_Method": "false",
          "S1_LOCAL_VAR_NOT_ASSIGNED": "false",
          "S1_LOCAL_VAR_NOT_USED": "false",
          "S2_SIMILAR_OBJECT_TYPE_WITH_NORMAL_GUARD": "false",
          "S2_SIMILAR_OBJECT_TYPE_WITH_NULL_GUARD": "false",
          "S3_TYPE_OF_FAULTY_STATEMENT": "If",
          "S4_Field_NOT_ASSIGNED": "false",
          "S4_Field_NOT_USED": "false",
          "S5_SIMILAR_PRIMITIVE_TYPE_WITH_NORMAL_GUARD": "false",
          "S5_SIMILAR_PRIMITIVE_TYPE_WITH_NULL_GUARD": "false",
          "S6_METHOD_THROWS_EXCEPTION": "false",
          "S7_OBJECT_USED_IN_ASSIGNMENT": "false",
          "S8_PRIMITIVE_USED_IN_ASSIGNMENT": "false",
          "S9_METHOD_CALL_WITH_NORMAL_GUARD": "false",
          "ast_info": {
            "dst": "tb.currentElement().nodeName()",
            "dst_parent": "tb.currentElement().nodeName().equals(\"option\")",
            "dst_parent_type": "Invocation",
            "dst_type": "Invocation",
            "operator": "UPD",
            "src": "tb.currentElement().normalName()",
            "src_parent": "tb.currentElement().normalName().equals(\"option\")",
            "src_parent_type": "Invocation",
            "src_type": "Invocation"
          }
        },
        {
          "FEATURES_METHOD_INVOCATION": {},
          "FEATURES_TYPEACCESS": {},
          "FEATURES_VARS": {},
          "S10_METHOD_CALL_WITH_NULL_GUARD": "false",
          "S11_FAULTY_CLASS_EXCEPTION_TYPE": "false",
          "S12_METHOD_CALL_WITH_TRY_CATCH": "false",
          "S13_TYPE_OF_FAULTY_STATEMENT_AFTER_1": "",
          "S13_TYPE_OF_FAULTY_STATEMENT_AFTER_2": "",
          "S13_TYPE_OF_FAULTY_STATEMENT_AFTER_3": "",
          "S13_TYPE_OF_FAULTY_STATEMENT_BEFORE_1": "Invocation",
          "S13_TYPE_OF_FAULTY_STATEMENT_BEFORE_2": "",
          "S13_TYPE_OF_FAULTY_STATEMENT_BEFORE_3": "",
          "S14_TYPE_OF_FAULTY_STATEMENT_PARENT": "If",
          "S15_HAS_OBJECTIVE_METHOD_CALL": "false",
          "S16_HAS_Invocations_Prone_Exception": "false",
          "S18_In_Synchronized_Method": "false",
          "S1_LOCAL_VAR_NOT_ASSIGNED": "false",
          "S1_LOCAL_VAR_NOT_USED": "false",
          "S2_SIMILAR_OBJECT_TYPE_WITH_NORMAL_GUARD": "false",
          "S2_SIMILAR_OBJECT_TYPE_WITH_NULL_GUARD": "false",
          "S3_TYPE_OF_FAULTY_STATEMENT": "If",
          "S4_Field_NOT_ASSIGNED": "false",
          "S4_Field_NOT_USED": "false",
          "S5_SIMILAR_PRIMITIVE_TYPE_WITH_NORMAL_GUARD": "false",
          "S5_SIMILAR_PRIMITIVE_TYPE_WITH_NULL_GUARD": "false",
          "S6_METHOD_THROWS_EXCEPTION": "false",
          "S7_OBJECT_USED_IN_ASSIGNMENT": "false",
          "S8_PRIMITIVE_USED_IN_ASSIGNMENT": "false",
          "S9_METHOD_CALL_WITH_NORMAL_GUARD": "false",
          "ast_info": {
            "dst": "tb.currentElement().nodeName()",
            "dst_parent": "org.jsoup.internal.StringUtil.in(tb.currentElement().nodeName(), \"table\", \"tbody\", \"tfoot\", \"thead\", \"tr\")",
            "dst_parent_type": "Invocation",
            "dst_type": "Invocation",
            "operator": "UPD",
            "src": "tb.currentElement().normalName()",
            "src_parent": "org.jsoup.internal.StringUtil.in(tb.currentElement().normalName(), \"table\", \"tbody\", \"tfoot\", \"thead\", \"tr\")",
            "src_parent_type": "Invocation",
            "src_type": "Invocation"
          }
        },
        {
          "FEATURES_METHOD_INVOCATION": {},
          "FEATURES_TYPEACCESS": {},
          "FEATURES_VARS": {},
          "S10_METHOD_CALL_WITH_NULL_GUARD": "false",
          "S11_FAULTY_CLASS_EXCEPTION_TYPE": "false",
          "S12_METHOD_CALL_WITH_TRY_CATCH": "false",
          "S13_TYPE_OF_FAULTY_STATEMENT_AFTER_1": "Invocation",
          "S13_TYPE_OF_FAULTY_STATEMENT_AFTER_2": "",
          "S13_TYPE_OF_FAULTY_STATEMENT_AFTER_3": "",
          "S13_TYPE_OF_FAULTY_STATEMENT_BEFORE_1": "",
          "S13_TYPE_OF_FAULTY_STATEMENT_BEFORE_2": "",
          "S13_TYPE_OF_FAULTY_STATEMENT_BEFORE_3": "",
          "S14_TYPE_OF_FAULTY_STATEMENT_PARENT": "If",
          "S15_HAS_OBJECTIVE_METHOD_CALL": "false",
          "S16_HAS_Invocations_Prone_Exception": "false",
          "S18_In_Synchronized_Method": "false",
          "S1_LOCAL_VAR_NOT_ASSIGNED": "false",
          "S1_LOCAL_VAR_NOT_USED": "false",
          "S2_SIMILAR_OBJECT_TYPE_WITH_NORMAL_GUARD": "false",
          "S2_SIMILAR_OBJECT_TYPE_WITH_NULL_GUARD": "false",
          "S3_TYPE_OF_FAULTY_STATEMENT": "If",
          "S4_Field_NOT_ASSIGNED": "false",
          "S4_Field_NOT_USED": "false",
          "S5_SIMILAR_PRIMITIVE_TYPE_WITH_NORMAL_GUARD": "false",
          "S5_SIMILAR_PRIMITIVE_TYPE_WITH_NULL_GUARD": "false",
          "S6_METHOD_THROWS_EXCEPTION": "false",
          "S7_OBJECT_USED_IN_ASSIGNMENT": "false",
          "S8_PRIMITIVE_USED_IN_ASSIGNMENT": "false",
          "S9_METHOD_CALL_WITH_NORMAL_GUARD": "false",
          "ast_info": {
            "dst": "tb.currentElement().nodeName()",
            "dst_parent": "tb.currentElement().nodeName().equals(\"option\")",
            "dst_parent_type": "Invocation",
            "dst_type": "Invocation",
            "operator": "UPD",
            "src": "tb.currentElement().normalName()",
            "src_parent": "tb.currentElement().normalName().equals(\"option\")",
            "src_parent_type": "Invocation",
            "src_type": "Invocation"
          }
        },
        {
          "FEATURES_METHOD_INVOCATION": {},
          "FEATURES_TYPEACCESS": {},
          "FEATURES_VARS": {},
          "S10_METHOD_CALL_WITH_NULL_GUARD": "false",
          "S11_FAULTY_CLASS_EXCEPTION_TYPE": "false",
          "S12_METHOD_CALL_WITH_TRY_CATCH": "false",
          "S13_TYPE_OF_FAULTY_STATEMENT_AFTER_1": "Invocation",
          "S13_TYPE_OF_FAULTY_STATEMENT_AFTER_2": "",
          "S13_TYPE_OF_FAULTY_STATEMENT_AFTER_3": "",
          "S13_TYPE_OF_FAULTY_STATEMENT_BEFORE_1": "Invocation",
          "S13_TYPE_OF_FAULTY_STATEMENT_BEFORE_2": "",
          "S13_TYPE_OF_FAULTY_STATEMENT_BEFORE_3": "",
          "S14_TYPE_OF_FAULTY_STATEMENT_PARENT": "If",
          "S15_HAS_OBJECTIVE_METHOD_CALL": "true",
          "S16_HAS_Invocations_Prone_Exception": "false",
          "S18_In_Synchronized_Method": "false",
          "S1_LOCAL_VAR_NOT_ASSIGNED": "false",
          "S1_LOCAL_VAR_NOT_USED": "false",
          "S2_SIMILAR_OBJECT_TYPE_WITH_NORMAL_GUARD": "false",
          "S2_SIMILAR_OBJECT_TYPE_WITH_NULL_GUARD": "false",
          "S3_TYPE_OF_FAULTY_STATEMENT": "If",
          "S4_Field_NOT_ASSIGNED": "false",
          "S4_Field_NOT_USED": "false",
          "S5_SIMILAR_PRIMITIVE_TYPE_WITH_NORMAL_GUARD": "false",
          "S5_SIMILAR_PRIMITIVE_TYPE_WITH_NULL_GUARD": "false",
          "S6_METHOD_THROWS_EXCEPTION": "false",
          "S7_OBJECT_USED_IN_ASSIGNMENT": "false",
          "S8_PRIMITIVE_USED_IN_ASSIGNMENT": "false",
          "S9_METHOD_CALL_WITH_NORMAL_GUARD": "false",
          "ast_info": {
            "dst": "tb.currentElement().nodeName()",
            "dst_parent": "tb.currentElement().nodeName().equals(name)",
            "dst_parent_type": "Invocation",
            "dst_type": "Invocation",
            "operator": "UPD",
            "src": "tb.currentElement().normalName()",
            "src_parent": "tb.currentElement().normalName().equals(name)",
            "src_parent_type": "Invocation",
            "src_type": "Invocation"
          }
        },
        {
          "FEATURES_METHOD_INVOCATION": {},
          "FEATURES_TYPEACCESS": {},
          "FEATURES_VARS": {},
          "S10_METHOD_CALL_WITH_NULL_GUARD": "false",
          "S11_FAULTY_CLASS_EXCEPTION_TYPE": "false",
          "S12_METHOD_CALL_WITH_TRY_CATCH": "false",
          "S13_TYPE_OF_FAULTY_STATEMENT_AFTER_1": "",
          "S13_TYPE_OF_FAULTY_STATEMENT_AFTER_2": "",
          "S13_TYPE_OF_FAULTY_STATEMENT_AFTER_3": "",
          "S13_TYPE_OF_FAULTY_STATEMENT_BEFORE_1": "",
          "S13_TYPE_OF_FAULTY_STATEMENT_BEFORE_2": "",
          "S13_TYPE_OF_FAULTY_STATEMENT_BEFORE_3": "",
          "S14_TYPE_OF_FAULTY_STATEMENT_PARENT": "If",
          "S15_HAS_OBJECTIVE_METHOD_CALL": "false",
          "S16_HAS_Invocations_Prone_Exception": "false",
          "S18_In_Synchronized_Method": "false",
          "S1_LOCAL_VAR_NOT_ASSIGNED": "false",
          "S1_LOCAL_VAR_NOT_USED": "false",
          "S2_SIMILAR_OBJECT_TYPE_WITH_NORMAL_GUARD": "false",
          "S2_SIMILAR_OBJECT_TYPE_WITH_NULL_GUARD": "false",
          "S3_TYPE_OF_FAULTY_STATEMENT": "If",
          "S4_Field_NOT_ASSIGNED": "false",
          "S4_Field_NOT_USED": "false",
          "S5_SIMILAR_PRIMITIVE_TYPE_WITH_NORMAL_GUARD": "false",
          "S5_SIMILAR_PRIMITIVE_TYPE_WITH_NULL_GUARD": "false",
          "S6_METHOD_THROWS_EXCEPTION": "false",
          "S7_OBJECT_USED_IN_ASSIGNMENT": "false",
          "S8_PRIMITIVE_USED_IN_ASSIGNMENT": "false",
          "S9_METHOD_CALL_WITH_NORMAL_GUARD": "false",
          "ast_info": {
            "dst": "formatEl.nodeName()",
            "dst_parent": "tb.inScope(formatEl.nodeName())",
            "dst_parent_type": "Invocation",
            "dst_type": "Invocation",
            "operator": "UPD",
            "src": "formatEl.normalName()",
            "src_parent": "tb.inScope(formatEl.normalName())",
            "src_parent_type": "Invocation",
            "src_type": "Invocation"
          }
        },
        {
          "FEATURES_METHOD_INVOCATION": {},
          "FEATURES_TYPEACCESS": {},
          "FEATURES_VARS": {},
          "S10_METHOD_CALL_WITH_NULL_GUARD": "false",
          "S11_FAULTY_CLASS_EXCEPTION_TYPE": "false",
          "S12_METHOD_CALL_WITH_TRY_CATCH": "false",
          "S13_TYPE_OF_FAULTY_STATEMENT_AFTER_1": "",
          "S13_TYPE_OF_FAULTY_STATEMENT_AFTER_2": "",
          "S13_TYPE_OF_FAULTY_STATEMENT_AFTER_3": "",
          "S13_TYPE_OF_FAULTY_STATEMENT_BEFORE_1": "",
          "S13_TYPE_OF_FAULTY_STATEMENT_BEFORE_2": "",
          "S13_TYPE_OF_FAULTY_STATEMENT_BEFORE_3": "",
          "S14_TYPE_OF_FAULTY_STATEMENT_PARENT": "If",
          "S15_HAS_OBJECTIVE_METHOD_CALL": "false",
          "S16_HAS_Invocations_Prone_Exception": "false",
          "S18_In_Synchronized_Method": "false",
          "S1_LOCAL_VAR_NOT_ASSIGNED": "false",
          "S1_LOCAL_VAR_NOT_USED": "false",
          "S2_SIMILAR_OBJECT_TYPE_WITH_NORMAL_GUARD": "false",
          "S2_SIMILAR_OBJECT_TYPE_WITH_NULL_GUARD": "false",
          "S3_TYPE_OF_FAULTY_STATEMENT": "If",
          "S4_Field_NOT_ASSIGNED": "false",
          "S4_Field_NOT_USED": "false",
          "S5_SIMILAR_PRIMITIVE_TYPE_WITH_NORMAL_GUARD": "false",
          "S5_SIMILAR_PRIMITIVE_TYPE_WITH_NULL_GUARD": "false",
          "S6_METHOD_THROWS_EXCEPTION": "false",
          "S7_OBJECT_USED_IN_ASSIGNMENT": "false",
          "S8_PRIMITIVE_USED_IN_ASSIGNMENT": "false",
          "S9_METHOD_CALL_WITH_NORMAL_GUARD": "false",
          "ast_info": {
            "dst": "tb.currentElement().nodeName()",
            "dst_parent": "tb.currentElement().nodeName().equals(\"optgroup\")",
            "dst_parent_type": "Invocation",
            "dst_type": "Invocation",
            "operator": "UPD",
            "src": "tb.currentElement().normalName()",
            "src_parent": "tb.currentElement().normalName().equals(\"optgroup\")",
            "src_parent_type": "Invocation",
            "src_type": "Invocation"
          }
        },
        {
          "FEATURES_METHOD_INVOCATION": {},
          "FEATURES_TYPEACCESS": {},
          "FEATURES_VARS": {},
          "S10_METHOD_CALL_WITH_NULL_GUARD": "false",
          "S11_FAULTY_CLASS_EXCEPTION_TYPE": "false",
          "S12_METHOD_CALL_WITH_TRY_CATCH": "false",
          "S13_TYPE_OF_FAULTY_STATEMENT_AFTER_1": "",
          "S13_TYPE_OF_FAULTY_STATEMENT_AFTER_2": "",
          "S13_TYPE_OF_FAULTY_STATEMENT_AFTER_3": "",
          "S13_TYPE_OF_FAULTY_STATEMENT_BEFORE_1": "",
          "S13_TYPE_OF_FAULTY_STATEMENT_BEFORE_2": "",
          "S13_TYPE_OF_FAULTY_STATEMENT_BEFORE_3": "",
          "S14_TYPE_OF_FAULTY_STATEMENT_PARENT": "If",
          "S15_HAS_OBJECTIVE_METHOD_CALL": "false",
          "S16_HAS_Invocations_Prone_Exception": "false",
          "S18_In_Synchronized_Method": "false",
          "S1_LOCAL_VAR_NOT_ASSIGNED": "false",
          "S1_LOCAL_VAR_NOT_USED": "false",
          "S2_SIMILAR_OBJECT_TYPE_WITH_NORMAL_GUARD": "false",
          "S2_SIMILAR_OBJECT_TYPE_WITH_NULL_GUARD": "false",
          "S3_TYPE_OF_FAULTY_STATEMENT": "If",
          "S4_Field_NOT_ASSIGNED": "false",
          "S4_Field_NOT_USED": "false",
          "S5_SIMILAR_PRIMITIVE_TYPE_WITH_NORMAL_GUARD": "false",
          "S5_SIMILAR_PRIMITIVE_TYPE_WITH_NULL_GUARD": "false",
          "S6_METHOD_THROWS_EXCEPTION": "false",
          "S7_OBJECT_USED_IN_ASSIGNMENT": "false",
          "S8_PRIMITIVE_USED_IN_ASSIGNMENT": "false",
          "S9_METHOD_CALL_WITH_NORMAL_GUARD": "false",
          "ast_info": {
            "dst": "tb.currentElement().nodeName()",
            "dst_parent": "tb.currentElement().nodeName().equals(\"html\")",
            "dst_parent_type": "Invocation",
            "dst_type": "Invocation",
            "operator": "UPD",
            "src": "tb.currentElement().normalName()",
            "src_parent": "tb.currentElement().normalName().equals(\"html\")",
            "src_parent_type": "Invocation",
            "src_type": "Invocation"
          }
        },
        {
          "FEATURES_METHOD_INVOCATION": {},
          "FEATURES_TYPEACCESS": {},
          "FEATURES_VARS": {},
          "S10_METHOD_CALL_WITH_NULL_GUARD": "false",
          "S11_FAULTY_CLASS_EXCEPTION_TYPE": "false",
          "S12_METHOD_CALL_WITH_TRY_CATCH": "false",
          "S13_TYPE_OF_FAULTY_STATEMENT_AFTER_1": "Return",
          "S13_TYPE_OF_FAULTY_STATEMENT_AFTER_2": "",
          "S13_TYPE_OF_FAULTY_STATEMENT_AFTER_3": "",
          "S13_TYPE_OF_FAULTY_STATEMENT_BEFORE_1": "",
          "S13_TYPE_OF_FAULTY_STATEMENT_BEFORE_2": "",
          "S13_TYPE_OF_FAULTY_STATEMENT_BEFORE_3": "",
          "S14_TYPE_OF_FAULTY_STATEMENT_PARENT": "If",
          "S15_HAS_OBJECTIVE_METHOD_CALL": "false",
          "S16_HAS_Invocations_Prone_Exception": "false",
          "S18_In_Synchronized_Method": "false",
          "S1_LOCAL_VAR_NOT_ASSIGNED": "false",
          "S1_LOCAL_VAR_NOT_USED": "false",
          "S2_SIMILAR_OBJECT_TYPE_WITH_NORMAL_GUARD": "false",
          "S2_SIMILAR_OBJECT_TYPE_WITH_NULL_GUARD": "false",
          "S3_TYPE_OF_FAULTY_STATEMENT": "If",
          "S4_Field_NOT_ASSIGNED": "false",
          "S4_Field_NOT_USED": "false",
          "S5_SIMILAR_PRIMITIVE_TYPE_WITH_NORMAL_GUARD": "false",
          "S5_SIMILAR_PRIMITIVE_TYPE_WITH_NULL_GUARD": "false",
          "S6_METHOD_THROWS_EXCEPTION": "false",
          "S7_OBJECT_USED_IN_ASSIGNMENT": "false",
          "S8_PRIMITIVE_USED_IN_ASSIGNMENT": "false",
          "S9_METHOD_CALL_WITH_NORMAL_GUARD": "false",
          "ast_info": {
            "dst": "tb.currentElement().nodeName()",
            "dst_parent": "tb.currentElement().nodeName().equals(\"html\")",
            "dst_parent_type": "Invocation",
            "dst_type": "Invocation",
            "operator": "UPD",
            "src": "tb.currentElement().normalName()",
            "src_parent": "tb.currentElement().normalName().equals(\"html\")",
            "src_parent_type": "Invocation",
            "src_type": "Invocation"
          }
        },
        {
          "FEATURES_METHOD_INVOCATION": {},
          "FEATURES_TYPEACCESS": {},
          "FEATURES_VARS": {},
          "S10_METHOD_CALL_WITH_NULL_GUARD": "false",
          "S11_FAULTY_CLASS_EXCEPTION_TYPE": "false",
          "S12_METHOD_CALL_WITH_TRY_CATCH": "false",
          "S13_TYPE_OF_FAULTY_STATEMENT_AFTER_1": "If",
          "S13_TYPE_OF_FAULTY_STATEMENT_AFTER_2": "",
          "S13_TYPE_OF_FAULTY_STATEMENT_AFTER_3": "",
          "S13_TYPE_OF_FAULTY_STATEMENT_BEFORE_1": "LocalVariable",
          "S13_TYPE_OF_FAULTY_STATEMENT_BEFORE_2": "",
          "S13_TYPE_OF_FAULTY_STATEMENT_BEFORE_3": "",
          "S14_TYPE_OF_FAULTY_STATEMENT_PARENT": "For",
          "S15_HAS_OBJECTIVE_METHOD_CALL": "false",
          "S16_HAS_Invocations_Prone_Exception": "false",
          "S18_In_Synchronized_Method": "false",
          "S1_LOCAL_VAR_NOT_ASSIGNED": "false",
          "S1_LOCAL_VAR_NOT_USED": "false",
          "S2_SIMILAR_OBJECT_TYPE_WITH_NORMAL_GUARD": "false",
          "S2_SIMILAR_OBJECT_TYPE_WITH_NULL_GUARD": "false",
          "S3_TYPE_OF_FAULTY_STATEMENT": "If",
          "S4_Field_NOT_ASSIGNED": "false",
          "S4_Field_NOT_USED": "false",
          "S5_SIMILAR_PRIMITIVE_TYPE_WITH_NORMAL_GUARD": "false",
          "S5_SIMILAR_PRIMITIVE_TYPE_WITH_NULL_GUARD": "false",
          "S6_METHOD_THROWS_EXCEPTION": "false",
          "S7_OBJECT_USED_IN_ASSIGNMENT": "false",
          "S8_PRIMITIVE_USED_IN_ASSIGNMENT": "false",
          "S9_METHOD_CALL_WITH_NORMAL_GUARD": "false",
          "ast_info": {
            "dst": "el.nodeName()",
            "dst_parent": "el.nodeName().equals(\"li\")",
            "dst_parent_type": "Invocation",
            "dst_type": "Invocation",
            "operator": "UPD",
            "src": "el.normalName()",
            "src_parent": "el.normalName().equals(\"li\")",
            "src_parent_type": "Invocation",
            "src_type": "Invocation"
          }
        },
        {
          "FEATURES_METHOD_INVOCATION": {},
          "FEATURES_TYPEACCESS": {},
          "FEATURES_VARS": {},
          "S10_METHOD_CALL_WITH_NULL_GUARD": "false",
          "S11_FAULTY_CLASS_EXCEPTION_TYPE": "false",
          "S12_METHOD_CALL_WITH_TRY_CATCH": "false",
          "S13_TYPE_OF_FAULTY_STATEMENT_AFTER_1": "Invocation",
          "S13_TYPE_OF_FAULTY_STATEMENT_AFTER_2": "",
          "S13_TYPE_OF_FAULTY_STATEMENT_AFTER_3": "",
          "S13_TYPE_OF_FAULTY_STATEMENT_BEFORE_1": "Invocation",
          "S13_TYPE_OF_FAULTY_STATEMENT_BEFORE_2": "",
          "S13_TYPE_OF_FAULTY_STATEMENT_BEFORE_3": "",
          "S14_TYPE_OF_FAULTY_STATEMENT_PARENT": "If",
          "S15_HAS_OBJECTIVE_METHOD_CALL": "true",
          "S16_HAS_Invocations_Prone_Exception": "false",
          "S18_In_Synchronized_Method": "false",
          "S1_LOCAL_VAR_NOT_ASSIGNED": "false",
          "S1_LOCAL_VAR_NOT_USED": "false",
          "S2_SIMILAR_OBJECT_TYPE_WITH_NORMAL_GUARD": "false",
          "S2_SIMILAR_OBJECT_TYPE_WITH_NULL_GUARD": "false",
          "S3_TYPE_OF_FAULTY_STATEMENT": "If",
          "S4_Field_NOT_ASSIGNED": "false",
          "S4_Field_NOT_USED": "false",
          "S5_SIMILAR_PRIMITIVE_TYPE_WITH_NORMAL_GUARD": "false",
          "S5_SIMILAR_PRIMITIVE_TYPE_WITH_NULL_GUARD": "false",
          "S6_METHOD_THROWS_EXCEPTION": "false",
          "S7_OBJECT_USED_IN_ASSIGNMENT": "false",
          "S8_PRIMITIVE_USED_IN_ASSIGNMENT": "false",
          "S9_METHOD_CALL_WITH_NORMAL_GUARD": "false",
          "ast_info": {
            "dst": "tb.currentElement().nodeName()",
            "dst_parent": "tb.currentElement().nodeName().equals(name)",
            "dst_parent_type": "Invocation",
            "dst_type": "Invocation",
            "operator": "UPD",
            "src": "tb.currentElement().normalName()",
            "src_parent": "tb.currentElement().normalName().equals(name)",
            "src_parent_type": "Invocation",
            "src_type": "Invocation"
          }
        },
        {
          "FEATURES_METHOD_INVOCATION": {},
          "FEATURES_TYPEACCESS": {},
          "FEATURES_VARS": {},
          "S10_METHOD_CALL_WITH_NULL_GUARD": "false",
          "S11_FAULTY_CLASS_EXCEPTION_TYPE": "false",
          "S12_METHOD_CALL_WITH_TRY_CATCH": "false",
          "S13_TYPE_OF_FAULTY_STATEMENT_AFTER_1": "",
          "S13_TYPE_OF_FAULTY_STATEMENT_AFTER_2": "",
          "S13_TYPE_OF_FAULTY_STATEMENT_AFTER_3": "",
          "S13_TYPE_OF_FAULTY_STATEMENT_BEFORE_1": "",
          "S13_TYPE_OF_FAULTY_STATEMENT_BEFORE_2": "",
          "S13_TYPE_OF_FAULTY_STATEMENT_BEFORE_3": "",
          "S14_TYPE_OF_FAULTY_STATEMENT_PARENT": "If",
          "S15_HAS_OBJECTIVE_METHOD_CALL": "false",
          "S16_HAS_Invocations_Prone_Exception": "false",
          "S18_In_Synchronized_Method": "false",
          "S1_LOCAL_VAR_NOT_ASSIGNED": "false",
          "S1_LOCAL_VAR_NOT_USED": "false",
          "S2_SIMILAR_OBJECT_TYPE_WITH_NORMAL_GUARD": "false",
          "S2_SIMILAR_OBJECT_TYPE_WITH_NULL_GUARD": "false",
          "S3_TYPE_OF_FAULTY_STATEMENT": "If",
          "S4_Field_NOT_ASSIGNED": "false",
          "S4_Field_NOT_USED": "false",
          "S5_SIMILAR_PRIMITIVE_TYPE_WITH_NORMAL_GUARD": "false",
          "S5_SIMILAR_PRIMITIVE_TYPE_WITH_NULL_GUARD": "false",
          "S6_METHOD_THROWS_EXCEPTION": "false",
          "S7_OBJECT_USED_IN_ASSIGNMENT": "false",
          "S8_PRIMITIVE_USED_IN_ASSIGNMENT": "false",
          "S9_METHOD_CALL_WITH_NORMAL_GUARD": "false",
          "ast_info": {
            "dst": "tb.currentElement().nodeName()",
            "dst_parent": "tb.currentElement().nodeName().equals(\"html\")",
            "dst_parent_type": "Invocation",
            "dst_type": "Invocation",
            "operator": "UPD",
            "src": "tb.currentElement().normalName()",
            "src_parent": "tb.currentElement().normalName().equals(\"html\")",
            "src_parent_type": "Invocation",
            "src_type": "Invocation"
          }
        },
        {
          "FEATURES_METHOD_INVOCATION": {},
          "FEATURES_TYPEACCESS": {},
          "FEATURES_VARS": {},
          "S10_METHOD_CALL_WITH_NULL_GUARD": "false",
          "S11_FAULTY_CLASS_EXCEPTION_TYPE": "false",
          "S12_METHOD_CALL_WITH_TRY_CATCH": "false",
          "S13_TYPE_OF_FAULTY_STATEMENT_AFTER_1": "",
          "S13_TYPE_OF_FAULTY_STATEMENT_AFTER_2": "",
          "S13_TYPE_OF_FAULTY_STATEMENT_AFTER_3": "",
          "S13_TYPE_OF_FAULTY_STATEMENT_BEFORE_1": "Invocation",
          "S13_TYPE_OF_FAULTY_STATEMENT_BEFORE_2": "",
          "S13_TYPE_OF_FAULTY_STATEMENT_BEFORE_3": "",
          "S14_TYPE_OF_FAULTY_STATEMENT_PARENT": "If",
          "S15_HAS_OBJECTIVE_METHOD_CALL": "false",
          "S16_HAS_Invocations_Prone_Exception": "false",
          "S18_In_Synchronized_Method": "false",
          "S1_LOCAL_VAR_NOT_ASSIGNED": "false",
          "S1_LOCAL_VAR_NOT_USED": "false",
          "S2_SIMILAR_OBJECT_TYPE_WITH_NORMAL_GUARD": "false",
          "S2_SIMILAR_OBJECT_TYPE_WITH_NULL_GUARD": "false",
          "S3_TYPE_OF_FAULTY_STATEMENT": "If",
          "S4_Field_NOT_ASSIGNED": "false",
          "S4_Field_NOT_USED": "false",
          "S5_SIMILAR_PRIMITIVE_TYPE_WITH_NORMAL_GUARD": "false",
          "S5_SIMILAR_PRIMITIVE_TYPE_WITH_NULL_GUARD": "false",
          "S6_METHOD_THROWS_EXCEPTION": "false",
          "S7_OBJECT_USED_IN_ASSIGNMENT": "false",
          "S8_PRIMITIVE_USED_IN_ASSIGNMENT": "false",
          "S9_METHOD_CALL_WITH_NORMAL_GUARD": "false",
          "ast_info": {
            "dst": "tb.currentElement().nodeName()",
            "dst_parent": "tb.currentElement().nodeName().equals(\"frameset\")",
            "dst_parent_type": "Invocation",
            "dst_type": "Invocation",
            "operator": "UPD",
            "src": "tb.currentElement().normalName()",
            "src_parent": "tb.currentElement().normalName().equals(\"frameset\")",
            "src_parent_type": "Invocation",
            "src_type": "Invocation"
          }
        },
        {
          "FEATURES_METHOD_INVOCATION": {},
          "FEATURES_TYPEACCESS": {},
          "FEATURES_VARS": {},
          "S10_METHOD_CALL_WITH_NULL_GUARD": "false",
          "S11_FAULTY_CLASS_EXCEPTION_TYPE": "false",
          "S12_METHOD_CALL_WITH_TRY_CATCH": "false",
          "S13_TYPE_OF_FAULTY_STATEMENT_AFTER_1": "",
          "S13_TYPE_OF_FAULTY_STATEMENT_AFTER_2": "",
          "S13_TYPE_OF_FAULTY_STATEMENT_AFTER_3": "",
          "S13_TYPE_OF_FAULTY_STATEMENT_BEFORE_1": "If",
          "S13_TYPE_OF_FAULTY_STATEMENT_BEFORE_2": "LocalVariable",
          "S13_TYPE_OF_FAULTY_STATEMENT_BEFORE_3": "",
          "S14_TYPE_OF_FAULTY_STATEMENT_PARENT": "For",
          "S15_HAS_OBJECTIVE_METHOD_CALL": "false",
          "S16_HAS_Invocations_Prone_Exception": "false",
          "S18_In_Synchronized_Method": "false",
          "S1_LOCAL_VAR_NOT_ASSIGNED": "false",
          "S1_LOCAL_VAR_NOT_USED": "false",
          "S2_SIMILAR_OBJECT_TYPE_WITH_NORMAL_GUARD": "false",
          "S2_SIMILAR_OBJECT_TYPE_WITH_NULL_GUARD": "false",
          "S3_TYPE_OF_FAULTY_STATEMENT": "If",
          "S4_Field_NOT_ASSIGNED": "false",
          "S4_Field_NOT_USED": "false",
          "S5_SIMILAR_PRIMITIVE_TYPE_WITH_NORMAL_GUARD": "false",
          "S5_SIMILAR_PRIMITIVE_TYPE_WITH_NULL_GUARD": "false",
          "S6_METHOD_THROWS_EXCEPTION": "false",
          "S7_OBJECT_USED_IN_ASSIGNMENT": "false",
          "S8_PRIMITIVE_USED_IN_ASSIGNMENT": "false",
          "S9_METHOD_CALL_WITH_NORMAL_GUARD": "false",
          "ast_info": {
            "dst": "el.nodeName()",
            "dst_parent": "org.jsoup.internal.StringUtil.inSorted(el.nodeName(), org.jsoup.parser.HtmlTreeBuilderState.Constants.InBodyStartLiBreakers)",
            "dst_parent_type": "Invocation",
            "dst_type": "Invocation",
            "operator": "UPD",
            "src": "el.normalName()",
            "src_parent": "org.jsoup.internal.StringUtil.inSorted(el.normalName(), org.jsoup.parser.HtmlTreeBuilderState.Constants.InBodyStartLiBreakers)",
            "src_parent_type": "Invocation",
            "src_type": "Invocation"
          }
        },
        {
          "FEATURES_METHOD_INVOCATION": {},
          "FEATURES_TYPEACCESS": {},
          "FEATURES_VARS": {},
          "S10_METHOD_CALL_WITH_NULL_GUARD": "false",
          "S11_FAULTY_CLASS_EXCEPTION_TYPE": "false",
          "S12_METHOD_CALL_WITH_TRY_CATCH": "false",
          "S13_TYPE_OF_FAULTY_STATEMENT_AFTER_1": "Invocation",
          "S13_TYPE_OF_FAULTY_STATEMENT_AFTER_2": "",
          "S13_TYPE_OF_FAULTY_STATEMENT_AFTER_3": "",
          "S13_TYPE_OF_FAULTY_STATEMENT_BEFORE_1": "Invocation",
          "S13_TYPE_OF_FAULTY_STATEMENT_BEFORE_2": "",
          "S13_TYPE_OF_FAULTY_STATEMENT_BEFORE_3": "",
          "S14_TYPE_OF_FAULTY_STATEMENT_PARENT": "If",
          "S15_HAS_OBJECTIVE_METHOD_CALL": "true",
          "S16_HAS_Invocations_Prone_Exception": "false",
          "S18_In_Synchronized_Method": "false",
          "S1_LOCAL_VAR_NOT_ASSIGNED": "false",
          "S1_LOCAL_VAR_NOT_USED": "false",
          "S2_SIMILAR_OBJECT_TYPE_WITH_NORMAL_GUARD": "false",
          "S2_SIMILAR_OBJECT_TYPE_WITH_NULL_GUARD": "false",
          "S3_TYPE_OF_FAULTY_STATEMENT": "If",
          "S4_Field_NOT_ASSIGNED": "false",
          "S4_Field_NOT_USED": "false",
          "S5_SIMILAR_PRIMITIVE_TYPE_WITH_NORMAL_GUARD": "false",
          "S5_SIMILAR_PRIMITIVE_TYPE_WITH_NULL_GUARD": "false",
          "S6_METHOD_THROWS_EXCEPTION": "false",
          "S7_OBJECT_USED_IN_ASSIGNMENT": "false",
          "S8_PRIMITIVE_USED_IN_ASSIGNMENT": "false",
          "S9_METHOD_CALL_WITH_NORMAL_GUARD": "false",
          "ast_info": {
            "dst": "tb.currentElement().nodeName()",
            "dst_parent": "tb.currentElement().nodeName().equals(name)",
            "dst_parent_type": "Invocation",
            "dst_type": "Invocation",
            "operator": "UPD",
            "src": "tb.currentElement().normalName()",
            "src_parent": "tb.currentElement().normalName().equals(name)",
            "src_parent_type": "Invocation",
            "src_type": "Invocation"
          }
        },
        {
          "FEATURES_METHOD_INVOCATION": {},
          "FEATURES_TYPEACCESS": {},
          "FEATURES_VARS": {},
          "S10_METHOD_CALL_WITH_NULL_GUARD": "false",
          "S11_FAULTY_CLASS_EXCEPTION_TYPE": "false",
          "S12_METHOD_CALL_WITH_TRY_CATCH": "false",
          "S13_TYPE_OF_FAULTY_STATEMENT_AFTER_1": "",
          "S13_TYPE_OF_FAULTY_STATEMENT_AFTER_2": "",
          "S13_TYPE_OF_FAULTY_STATEMENT_AFTER_3": "",
          "S13_TYPE_OF_FAULTY_STATEMENT_BEFORE_1": "LocalVariable",
          "S13_TYPE_OF_FAULTY_STATEMENT_BEFORE_2": "Invocation",
          "S13_TYPE_OF_FAULTY_STATEMENT_BEFORE_3": "",
          "S14_TYPE_OF_FAULTY_STATEMENT_PARENT": "If",
          "S15_HAS_OBJECTIVE_METHOD_CALL": "false",
          "S16_HAS_Invocations_Prone_Exception": "false",
          "S18_In_Synchronized_Method": "false",
          "S1_LOCAL_VAR_NOT_ASSIGNED": "false",
          "S1_LOCAL_VAR_NOT_USED": "false",
          "S2_SIMILAR_OBJECT_TYPE_WITH_NORMAL_GUARD": "false",
          "S2_SIMILAR_OBJECT_TYPE_WITH_NULL_GUARD": "false",
          "S3_TYPE_OF_FAULTY_STATEMENT": "If",
          "S4_Field_NOT_ASSIGNED": "false",
          "S4_Field_NOT_USED": "false",
          "S5_SIMILAR_PRIMITIVE_TYPE_WITH_NORMAL_GUARD": "false",
          "S5_SIMILAR_PRIMITIVE_TYPE_WITH_NULL_GUARD": "false",
          "S6_METHOD_THROWS_EXCEPTION": "false",
          "S7_OBJECT_USED_IN_ASSIGNMENT": "false",
          "S8_PRIMITIVE_USED_IN_ASSIGNMENT": "false",
          "S9_METHOD_CALL_WITH_NORMAL_GUARD": "false",
          "ast_info": {
            "dst": "stack.get(1).nodeName()",
            "dst_parent": "stack.get(1).nodeName().equals(\"body\")",
            "dst_parent_type": "Invocation",
            "dst_type": "Invocation",
            "operator": "UPD",
            "src": "stack.get(1).normalName()",
            "src_parent": "stack.get(1).normalName().equals(\"body\")",
            "src_parent_type": "Invocation",
            "src_type": "Invocation"
          }
        },
        {
          "FEATURES_METHOD_INVOCATION": {},
          "FEATURES_TYPEACCESS": {},
          "FEATURES_VARS": {},
          "S10_METHOD_CALL_WITH_NULL_GUARD": "false",
          "S11_FAULTY_CLASS_EXCEPTION_TYPE": "false",
          "S12_METHOD_CALL_WITH_TRY_CATCH": "false",
          "S13_TYPE_OF_FAULTY_STATEMENT_AFTER_1": "Invocation",
          "S13_TYPE_OF_FAULTY_STATEMENT_AFTER_2": "",
          "S13_TYPE_OF_FAULTY_STATEMENT_AFTER_3": "",
          "S13_TYPE_OF_FAULTY_STATEMENT_BEFORE_1": "Invocation",
          "S13_TYPE_OF_FAULTY_STATEMENT_BEFORE_2": "",
          "S13_TYPE_OF_FAULTY_STATEMENT_BEFORE_3": "",
          "S14_TYPE_OF_FAULTY_STATEMENT_PARENT": "If",
          "S15_HAS_OBJECTIVE_METHOD_CALL": "true",
          "S16_HAS_Invocations_Prone_Exception": "false",
          "S18_In_Synchronized_Method": "false",
          "S1_LOCAL_VAR_NOT_ASSIGNED": "false",
          "S1_LOCAL_VAR_NOT_USED": "false",
          "S2_SIMILAR_OBJECT_TYPE_WITH_NORMAL_GUARD": "false",
          "S2_SIMILAR_OBJECT_TYPE_WITH_NULL_GUARD": "false",
          "S3_TYPE_OF_FAULTY_STATEMENT": "If",
          "S4_Field_NOT_ASSIGNED": "false",
          "S4_Field_NOT_USED": "false",
          "S5_SIMILAR_PRIMITIVE_TYPE_WITH_NORMAL_GUARD": "false",
          "S5_SIMILAR_PRIMITIVE_TYPE_WITH_NULL_GUARD": "false",
          "S6_METHOD_THROWS_EXCEPTION": "false",
          "S7_OBJECT_USED_IN_ASSIGNMENT": "false",
          "S8_PRIMITIVE_USED_IN_ASSIGNMENT": "false",
          "S9_METHOD_CALL_WITH_NORMAL_GUARD": "false",
          "ast_info": {
            "dst": "tb.currentElement().nodeName()",
            "dst_parent": "tb.currentElement().nodeName().equals(name)",
            "dst_parent_type": "Invocation",
            "dst_type": "Invocation",
            "operator": "UPD",
            "src": "tb.currentElement().normalName()",
            "src_parent": "tb.currentElement().normalName().equals(name)",
            "src_parent_type": "Invocation",
            "src_type": "Invocation"
          }
        },
        {
          "FEATURES_METHOD_INVOCATION": {},
          "FEATURES_TYPEACCESS": {},
          "FEATURES_VARS": {},
          "S10_METHOD_CALL_WITH_NULL_GUARD": "false",
          "S11_FAULTY_CLASS_EXCEPTION_TYPE": "false",
          "S12_METHOD_CALL_WITH_TRY_CATCH": "false",
          "S13_TYPE_OF_FAULTY_STATEMENT_AFTER_1": "Invocation",
          "S13_TYPE_OF_FAULTY_STATEMENT_AFTER_2": "",
          "S13_TYPE_OF_FAULTY_STATEMENT_AFTER_3": "",
          "S13_TYPE_OF_FAULTY_STATEMENT_BEFORE_1": "If",
          "S13_TYPE_OF_FAULTY_STATEMENT_BEFORE_2": "",
          "S13_TYPE_OF_FAULTY_STATEMENT_BEFORE_3": "",
          "S14_TYPE_OF_FAULTY_STATEMENT_PARENT": "If",
          "S15_HAS_OBJECTIVE_METHOD_CALL": "true",
          "S16_HAS_Invocations_Prone_Exception": "false",
          "S18_In_Synchronized_Method": "false",
          "S1_LOCAL_VAR_NOT_ASSIGNED": "false",
          "S1_LOCAL_VAR_NOT_USED": "false",
          "S2_SIMILAR_OBJECT_TYPE_WITH_NORMAL_GUARD": "false",
          "S2_SIMILAR_OBJECT_TYPE_WITH_NULL_GUARD": "false",
          "S3_TYPE_OF_FAULTY_STATEMENT": "If",
          "S4_Field_NOT_ASSIGNED": "false",
          "S4_Field_NOT_USED": "false",
          "S5_SIMILAR_PRIMITIVE_TYPE_WITH_NORMAL_GUARD": "false",
          "S5_SIMILAR_PRIMITIVE_TYPE_WITH_NULL_GUARD": "false",
          "S6_METHOD_THROWS_EXCEPTION": "false",
          "S7_OBJECT_USED_IN_ASSIGNMENT": "false",
          "S8_PRIMITIVE_USED_IN_ASSIGNMENT": "false",
          "S9_METHOD_CALL_WITH_NORMAL_GUARD": "false",
          "ast_info": {
            "dst": "tb.currentElement().nodeName()",
            "dst_parent": "org.jsoup.internal.StringUtil.inSorted(tb.currentElement().nodeName(), org.jsoup.parser.HtmlTreeBuilderState.Constants.Headings)",
            "dst_parent_type": "Invocation",
            "dst_type": "Invocation",
            "operator": "UPD",
            "src": "tb.currentElement().normalName()",
            "src_parent": "org.jsoup.internal.StringUtil.inSorted(tb.currentElement().normalName(), org.jsoup.parser.HtmlTreeBuilderState.Constants.Headings)",
            "src_parent_type": "Invocation",
            "src_type": "Invocation"
          }
        },
        {
          "FEATURES_METHOD_INVOCATION": {},
          "FEATURES_TYPEACCESS": {},
          "FEATURES_VARS": {},
          "S10_METHOD_CALL_WITH_NULL_GUARD": "false",
          "S11_FAULTY_CLASS_EXCEPTION_TYPE": "false",
          "S12_METHOD_CALL_WITH_TRY_CATCH": "false",
          "S13_TYPE_OF_FAULTY_STATEMENT_AFTER_1": "",
          "S13_TYPE_OF_FAULTY_STATEMENT_AFTER_2": "",
          "S13_TYPE_OF_FAULTY_STATEMENT_AFTER_3": "",
          "S13_TYPE_OF_FAULTY_STATEMENT_BEFORE_1": "LocalVariable",
          "S13_TYPE_OF_FAULTY_STATEMENT_BEFORE_2": "Invocation",
          "S13_TYPE_OF_FAULTY_STATEMENT_BEFORE_3": "",
          "S14_TYPE_OF_FAULTY_STATEMENT_PARENT": "If",
          "S15_HAS_OBJECTIVE_METHOD_CALL": "false",
          "S16_HAS_Invocations_Prone_Exception": "false",
          "S18_In_Synchronized_Method": "false",
          "S1_LOCAL_VAR_NOT_ASSIGNED": "false",
          "S1_LOCAL_VAR_NOT_USED": "false",
          "S2_SIMILAR_OBJECT_TYPE_WITH_NORMAL_GUARD": "false",
          "S2_SIMILAR_OBJECT_TYPE_WITH_NULL_GUARD": "false",
          "S3_TYPE_OF_FAULTY_STATEMENT": "If",
          "S4_Field_NOT_ASSIGNED": "false",
          "S4_Field_NOT_USED": "false",
          "S5_SIMILAR_PRIMITIVE_TYPE_WITH_NORMAL_GUARD": "false",
          "S5_SIMILAR_PRIMITIVE_TYPE_WITH_NULL_GUARD": "false",
          "S6_METHOD_THROWS_EXCEPTION": "false",
          "S7_OBJECT_USED_IN_ASSIGNMENT": "false",
          "S8_PRIMITIVE_USED_IN_ASSIGNMENT": "false",
          "S9_METHOD_CALL_WITH_NORMAL_GUARD": "false",
          "ast_info": {
            "dst": "stack.get(1).nodeName()",
            "dst_parent": "stack.get(1).nodeName().equals(\"body\")",
            "dst_parent_type": "Invocation",
            "dst_type": "Invocation",
            "operator": "UPD",
            "src": "stack.get(1).normalName()",
            "src_parent": "stack.get(1).normalName().equals(\"body\")",
            "src_parent_type": "Invocation",
            "src_type": "Invocation"
          }
        },
        {
          "FEATURES_METHOD_INVOCATION": {},
          "FEATURES_TYPEACCESS": {},
          "FEATURES_VARS": {},
          "S10_METHOD_CALL_WITH_NULL_GUARD": "false",
          "S11_FAULTY_CLASS_EXCEPTION_TYPE": "false",
          "S12_METHOD_CALL_WITH_TRY_CATCH": "false",
          "S13_TYPE_OF_FAULTY_STATEMENT_AFTER_1": "Invocation",
          "S13_TYPE_OF_FAULTY_STATEMENT_AFTER_2": "",
          "S13_TYPE_OF_FAULTY_STATEMENT_AFTER_3": "",
          "S13_TYPE_OF_FAULTY_STATEMENT_BEFORE_1": "Invocation",
          "S13_TYPE_OF_FAULTY_STATEMENT_BEFORE_2": "",
          "S13_TYPE_OF_FAULTY_STATEMENT_BEFORE_3": "",
          "S14_TYPE_OF_FAULTY_STATEMENT_PARENT": "If",
          "S15_HAS_OBJECTIVE_METHOD_CALL": "true",
          "S16_HAS_Invocations_Prone_Exception": "false",
          "S18_In_Synchronized_Method": "false",
          "S1_LOCAL_VAR_NOT_ASSIGNED": "false",
          "S1_LOCAL_VAR_NOT_USED": "false",
          "S2_SIMILAR_OBJECT_TYPE_WITH_NORMAL_GUARD": "false",
          "S2_SIMILAR_OBJECT_TYPE_WITH_NULL_GUARD": "false",
          "S3_TYPE_OF_FAULTY_STATEMENT": "If",
          "S4_Field_NOT_ASSIGNED": "false",
          "S4_Field_NOT_USED": "false",
          "S5_SIMILAR_PRIMITIVE_TYPE_WITH_NORMAL_GUARD": "false",
          "S5_SIMILAR_PRIMITIVE_TYPE_WITH_NULL_GUARD": "false",
          "S6_METHOD_THROWS_EXCEPTION": "false",
          "S7_OBJECT_USED_IN_ASSIGNMENT": "false",
          "S8_PRIMITIVE_USED_IN_ASSIGNMENT": "false",
          "S9_METHOD_CALL_WITH_NORMAL_GUARD": "false",
          "ast_info": {
            "dst": "tb.currentElement().nodeName()",
            "dst_parent": "tb.currentElement().nodeName().equals(name)",
            "dst_parent_type": "Invocation",
            "dst_type": "Invocation",
            "operator": "UPD",
            "src": "tb.currentElement().normalName()",
            "src_parent": "tb.currentElement().normalName().equals(name)",
            "src_parent_type": "Invocation",
            "src_type": "Invocation"
          }
        },
        {
          "FEATURES_METHOD_INVOCATION": {},
          "FEATURES_TYPEACCESS": {},
          "FEATURES_VARS": {},
          "S10_METHOD_CALL_WITH_NULL_GUARD": "false",
          "S11_FAULTY_CLASS_EXCEPTION_TYPE": "false",
          "S12_METHOD_CALL_WITH_TRY_CATCH": "false",
          "S13_TYPE_OF_FAULTY_STATEMENT_AFTER_1": "Invocation",
          "S13_TYPE_OF_FAULTY_STATEMENT_AFTER_2": "",
          "S13_TYPE_OF_FAULTY_STATEMENT_AFTER_3": "",
          "S13_TYPE_OF_FAULTY_STATEMENT_BEFORE_1": "Invocation",
          "S13_TYPE_OF_FAULTY_STATEMENT_BEFORE_2": "",
          "S13_TYPE_OF_FAULTY_STATEMENT_BEFORE_3": "",
          "S14_TYPE_OF_FAULTY_STATEMENT_PARENT": "If",
          "S15_HAS_OBJECTIVE_METHOD_CALL": "true",
          "S16_HAS_Invocations_Prone_Exception": "false",
          "S18_In_Synchronized_Method": "false",
          "S1_LOCAL_VAR_NOT_ASSIGNED": "false",
          "S1_LOCAL_VAR_NOT_USED": "false",
          "S2_SIMILAR_OBJECT_TYPE_WITH_NORMAL_GUARD": "false",
          "S2_SIMILAR_OBJECT_TYPE_WITH_NULL_GUARD": "false",
          "S3_TYPE_OF_FAULTY_STATEMENT": "If",
          "S4_Field_NOT_ASSIGNED": "false",
          "S4_Field_NOT_USED": "false",
          "S5_SIMILAR_PRIMITIVE_TYPE_WITH_NORMAL_GUARD": "false",
          "S5_SIMILAR_PRIMITIVE_TYPE_WITH_NULL_GUARD": "false",
          "S6_METHOD_THROWS_EXCEPTION": "false",
          "S7_OBJECT_USED_IN_ASSIGNMENT": "false",
          "S8_PRIMITIVE_USED_IN_ASSIGNMENT": "false",
          "S9_METHOD_CALL_WITH_NORMAL_GUARD": "false",
          "ast_info": {
            "dst": "tb.currentElement().nodeName()",
            "dst_parent": "tb.currentElement().nodeName().equals(name)",
            "dst_parent_type": "Invocation",
            "dst_type": "Invocation",
            "operator": "UPD",
            "src": "tb.currentElement().normalName()",
            "src_parent": "tb.currentElement().normalName().equals(name)",
            "src_parent_type": "Invocation",
            "src_type": "Invocation"
          }
        },
        {
          "FEATURES_METHOD_INVOCATION": {},
          "FEATURES_TYPEACCESS": {},
          "FEATURES_VARS": {},
          "S10_METHOD_CALL_WITH_NULL_GUARD": "false",
          "S11_FAULTY_CLASS_EXCEPTION_TYPE": "false",
          "S12_METHOD_CALL_WITH_TRY_CATCH": "false",
          "S13_TYPE_OF_FAULTY_STATEMENT_AFTER_1": "If",
          "S13_TYPE_OF_FAULTY_STATEMENT_AFTER_2": "",
          "S13_TYPE_OF_FAULTY_STATEMENT_AFTER_3": "",
          "S13_TYPE_OF_FAULTY_STATEMENT_BEFORE_1": "LocalVariable",
          "S13_TYPE_OF_FAULTY_STATEMENT_BEFORE_2": "",
          "S13_TYPE_OF_FAULTY_STATEMENT_BEFORE_3": "",
          "S14_TYPE_OF_FAULTY_STATEMENT_PARENT": "For",
          "S15_HAS_OBJECTIVE_METHOD_CALL": "false",
          "S16_HAS_Invocations_Prone_Exception": "false",
          "S18_In_Synchronized_Method": "false",
          "S1_LOCAL_VAR_NOT_ASSIGNED": "false",
          "S1_LOCAL_VAR_NOT_USED": "false",
          "S2_SIMILAR_OBJECT_TYPE_WITH_NORMAL_GUARD": "false",
          "S2_SIMILAR_OBJECT_TYPE_WITH_NULL_GUARD": "false",
          "S3_TYPE_OF_FAULTY_STATEMENT": "If",
          "S4_Field_NOT_ASSIGNED": "false",
          "S4_Field_NOT_USED": "false",
          "S5_SIMILAR_PRIMITIVE_TYPE_WITH_NORMAL_GUARD": "false",
          "S5_SIMILAR_PRIMITIVE_TYPE_WITH_NULL_GUARD": "false",
          "S6_METHOD_THROWS_EXCEPTION": "false",
          "S7_OBJECT_USED_IN_ASSIGNMENT": "false",
          "S8_PRIMITIVE_USED_IN_ASSIGNMENT": "false",
          "S9_METHOD_CALL_WITH_NORMAL_GUARD": "false",
          "ast_info": {
            "dst": "el.nodeName()",
            "dst_parent": "org.jsoup.internal.StringUtil.inSorted(el.nodeName(), org.jsoup.parser.HtmlTreeBuilderState.Constants.DdDt)",
            "dst_parent_type": "Invocation",
            "dst_type": "Invocation",
            "operator": "UPD",
            "src": "el.normalName()",
            "src_parent": "org.jsoup.internal.StringUtil.inSorted(el.normalName(), org.jsoup.parser.HtmlTreeBuilderState.Constants.DdDt)",
            "src_parent_type": "Invocation",
            "src_type": "Invocation"
          }
        },
        {
          "FEATURES_METHOD_INVOCATION": {},
          "FEATURES_TYPEACCESS": {},
          "FEATURES_VARS": {},
          "S10_METHOD_CALL_WITH_NULL_GUARD": "false",
          "S11_FAULTY_CLASS_EXCEPTION_TYPE": "false",
          "S12_METHOD_CALL_WITH_TRY_CATCH": "false",
          "S13_TYPE_OF_FAULTY_STATEMENT_AFTER_1": "Invocation",
          "S13_TYPE_OF_FAULTY_STATEMENT_AFTER_2": "Invocation",
          "S13_TYPE_OF_FAULTY_STATEMENT_AFTER_3": "",
          "S13_TYPE_OF_FAULTY_STATEMENT_BEFORE_1": "Invocation",
          "S13_TYPE_OF_FAULTY_STATEMENT_BEFORE_2": "If",
          "S13_TYPE_OF_FAULTY_STATEMENT_BEFORE_3": "",
          "S14_TYPE_OF_FAULTY_STATEMENT_PARENT": "If",
          "S15_HAS_OBJECTIVE_METHOD_CALL": "true",
          "S16_HAS_Invocations_Prone_Exception": "false",
          "S18_In_Synchronized_Method": "false",
          "S1_LOCAL_VAR_NOT_ASSIGNED": "false",
          "S1_LOCAL_VAR_NOT_USED": "false",
          "S2_SIMILAR_OBJECT_TYPE_WITH_NORMAL_GUARD": "false",
          "S2_SIMILAR_OBJECT_TYPE_WITH_NULL_GUARD": "false",
          "S3_TYPE_OF_FAULTY_STATEMENT": "If",
          "S4_Field_NOT_ASSIGNED": "false",
          "S4_Field_NOT_USED": "false",
          "S5_SIMILAR_PRIMITIVE_TYPE_WITH_NORMAL_GUARD": "false",
          "S5_SIMILAR_PRIMITIVE_TYPE_WITH_NULL_GUARD": "false",
          "S6_METHOD_THROWS_EXCEPTION": "false",
          "S7_OBJECT_USED_IN_ASSIGNMENT": "false",
          "S8_PRIMITIVE_USED_IN_ASSIGNMENT": "false",
          "S9_METHOD_CALL_WITH_NORMAL_GUARD": "false",
          "ast_info": {
            "dst": "tb.currentElement().nodeName()",
            "dst_parent": "tb.currentElement().nodeName().equals(name)",
            "dst_parent_type": "Invocation",
            "dst_type": "Invocation",
            "operator": "UPD",
            "src": "tb.currentElement().normalName()",
            "src_parent": "tb.currentElement().normalName().equals(name)",
            "src_parent_type": "Invocation",
            "src_type": "Invocation"
          }
        },
        {
          "FEATURES_METHOD_INVOCATION": {},
          "FEATURES_TYPEACCESS": {},
          "FEATURES_VARS": {},
          "S10_METHOD_CALL_WITH_NULL_GUARD": "false",
          "S11_FAULTY_CLASS_EXCEPTION_TYPE": "false",
          "S12_METHOD_CALL_WITH_TRY_CATCH": "false",
          "S13_TYPE_OF_FAULTY_STATEMENT_AFTER_1": "Break",
          "S13_TYPE_OF_FAULTY_STATEMENT_AFTER_2": "",
          "S13_TYPE_OF_FAULTY_STATEMENT_AFTER_3": "",
          "S13_TYPE_OF_FAULTY_STATEMENT_BEFORE_1": "",
          "S13_TYPE_OF_FAULTY_STATEMENT_BEFORE_2": "",
          "S13_TYPE_OF_FAULTY_STATEMENT_BEFORE_3": "",
          "S14_TYPE_OF_FAULTY_STATEMENT_PARENT": "If",
          "S15_HAS_OBJECTIVE_METHOD_CALL": "false",
          "S16_HAS_Invocations_Prone_Exception": "false",
          "S18_In_Synchronized_Method": "false",
          "S1_LOCAL_VAR_NOT_ASSIGNED": "false",
          "S1_LOCAL_VAR_NOT_USED": "false",
          "S2_SIMILAR_OBJECT_TYPE_WITH_NORMAL_GUARD": "false",
          "S2_SIMILAR_OBJECT_TYPE_WITH_NULL_GUARD": "false",
          "S3_TYPE_OF_FAULTY_STATEMENT": "Invocation",
          "S4_Field_NOT_ASSIGNED": "false",
          "S4_Field_NOT_USED": "false",
          "S5_SIMILAR_PRIMITIVE_TYPE_WITH_NORMAL_GUARD": "false",
          "S5_SIMILAR_PRIMITIVE_TYPE_WITH_NULL_GUARD": "false",
          "S6_METHOD_THROWS_EXCEPTION": "false",
          "S7_OBJECT_USED_IN_ASSIGNMENT": "false",
          "S8_PRIMITIVE_USED_IN_ASSIGNMENT": "false",
          "S9_METHOD_CALL_WITH_NORMAL_GUARD": "false",
          "ast_info": {
            "dst": "el.nodeName()",
            "dst_parent": "tb.processEndTag(el.nodeName())",
            "dst_parent_type": "Invocation",
            "dst_type": "Invocation",
            "operator": "UPD",
            "src": "el.normalName()",
            "src_parent": "tb.processEndTag(el.normalName())",
            "src_parent_type": "Invocation",
            "src_type": "Invocation"
          }
        },
        {
          "FEATURES_METHOD_INVOCATION": {},
          "FEATURES_TYPEACCESS": {},
          "FEATURES_VARS": {},
          "S10_METHOD_CALL_WITH_NULL_GUARD": "false",
          "S11_FAULTY_CLASS_EXCEPTION_TYPE": "false",
          "S12_METHOD_CALL_WITH_TRY_CATCH": "false",
          "S13_TYPE_OF_FAULTY_STATEMENT_AFTER_1": "",
          "S13_TYPE_OF_FAULTY_STATEMENT_AFTER_2": "",
          "S13_TYPE_OF_FAULTY_STATEMENT_AFTER_3": "",
          "S13_TYPE_OF_FAULTY_STATEMENT_BEFORE_1": "If",
          "S13_TYPE_OF_FAULTY_STATEMENT_BEFORE_2": "LocalVariable",
          "S13_TYPE_OF_FAULTY_STATEMENT_BEFORE_3": "",
          "S14_TYPE_OF_FAULTY_STATEMENT_PARENT": "For",
          "S15_HAS_OBJECTIVE_METHOD_CALL": "false",
          "S16_HAS_Invocations_Prone_Exception": "false",
          "S18_In_Synchronized_Method": "false",
          "S1_LOCAL_VAR_NOT_ASSIGNED": "false",
          "S1_LOCAL_VAR_NOT_USED": "false",
          "S2_SIMILAR_OBJECT_TYPE_WITH_NORMAL_GUARD": "false",
          "S2_SIMILAR_OBJECT_TYPE_WITH_NULL_GUARD": "false",
          "S3_TYPE_OF_FAULTY_STATEMENT": "If",
          "S4_Field_NOT_ASSIGNED": "false",
          "S4_Field_NOT_USED": "false",
          "S5_SIMILAR_PRIMITIVE_TYPE_WITH_NORMAL_GUARD": "false",
          "S5_SIMILAR_PRIMITIVE_TYPE_WITH_NULL_GUARD": "false",
          "S6_METHOD_THROWS_EXCEPTION": "false",
          "S7_OBJECT_USED_IN_ASSIGNMENT": "false",
          "S8_PRIMITIVE_USED_IN_ASSIGNMENT": "false",
          "S9_METHOD_CALL_WITH_NORMAL_GUARD": "false",
          "ast_info": {
            "dst": "el.nodeName()",
            "dst_parent": "org.jsoup.internal.StringUtil.inSorted(el.nodeName(), org.jsoup.parser.HtmlTreeBuilderState.Constants.InBodyStartLiBreakers)",
            "dst_parent_type": "Invocation",
            "dst_type": "Invocation",
            "operator": "UPD",
            "src": "el.normalName()",
            "src_parent": "org.jsoup.internal.StringUtil.inSorted(el.normalName(), org.jsoup.parser.HtmlTreeBuilderState.Constants.InBodyStartLiBreakers)",
            "src_parent_type": "Invocation",
            "src_type": "Invocation"
          }
        },
        {
          "FEATURES_METHOD_INVOCATION": {},
          "FEATURES_TYPEACCESS": {},
          "FEATURES_VARS": {},
          "S10_METHOD_CALL_WITH_NULL_GUARD": "false",
          "S11_FAULTY_CLASS_EXCEPTION_TYPE": "false",
          "S12_METHOD_CALL_WITH_TRY_CATCH": "false",
          "S13_TYPE_OF_FAULTY_STATEMENT_AFTER_1": "Invocation",
          "S13_TYPE_OF_FAULTY_STATEMENT_AFTER_2": "Invocation",
          "S13_TYPE_OF_FAULTY_STATEMENT_AFTER_3": "",
          "S13_TYPE_OF_FAULTY_STATEMENT_BEFORE_1": "",
          "S13_TYPE_OF_FAULTY_STATEMENT_BEFORE_2": "",
          "S13_TYPE_OF_FAULTY_STATEMENT_BEFORE_3": "",
          "S14_TYPE_OF_FAULTY_STATEMENT_PARENT": "If",
          "S15_HAS_OBJECTIVE_METHOD_CALL": "false",
          "S16_HAS_Invocations_Prone_Exception": "false",
          "S18_In_Synchronized_Method": "false",
          "S1_LOCAL_VAR_NOT_ASSIGNED": "false",
          "S1_LOCAL_VAR_NOT_USED": "false",
          "S2_SIMILAR_OBJECT_TYPE_WITH_NORMAL_GUARD": "false",
          "S2_SIMILAR_OBJECT_TYPE_WITH_NULL_GUARD": "false",
          "S3_TYPE_OF_FAULTY_STATEMENT": "If",
          "S4_Field_NOT_ASSIGNED": "false",
          "S4_Field_NOT_USED": "false",
          "S5_SIMILAR_PRIMITIVE_TYPE_WITH_NORMAL_GUARD": "false",
          "S5_SIMILAR_PRIMITIVE_TYPE_WITH_NULL_GUARD": "false",
          "S6_METHOD_THROWS_EXCEPTION": "false",
          "S7_OBJECT_USED_IN_ASSIGNMENT": "false",
          "S8_PRIMITIVE_USED_IN_ASSIGNMENT": "false",
          "S9_METHOD_CALL_WITH_NORMAL_GUARD": "false",
          "ast_info": {
            "dst": "tb.currentElement().nodeName()",
            "dst_parent": "tb.currentElement().nodeName().equals(\"option\")",
            "dst_parent_type": "Invocation",
            "dst_type": "Invocation",
            "operator": "UPD",
            "src": "tb.currentElement().normalName()",
            "src_parent": "tb.currentElement().normalName().equals(\"option\")",
            "src_parent_type": "Invocation",
            "src_type": "Invocation"
          }
        },
        {
          "FEATURES_METHOD_INVOCATION": {},
          "FEATURES_TYPEACCESS": {},
          "FEATURES_VARS": {},
          "S10_METHOD_CALL_WITH_NULL_GUARD": "false",
          "S11_FAULTY_CLASS_EXCEPTION_TYPE": "false",
          "S12_METHOD_CALL_WITH_TRY_CATCH": "false",
          "S13_TYPE_OF_FAULTY_STATEMENT_AFTER_1": "Invocation",
          "S13_TYPE_OF_FAULTY_STATEMENT_AFTER_2": "",
          "S13_TYPE_OF_FAULTY_STATEMENT_AFTER_3": "",
          "S13_TYPE_OF_FAULTY_STATEMENT_BEFORE_1": "Invocation",
          "S13_TYPE_OF_FAULTY_STATEMENT_BEFORE_2": "",
          "S13_TYPE_OF_FAULTY_STATEMENT_BEFORE_3": "",
          "S14_TYPE_OF_FAULTY_STATEMENT_PARENT": "If",
          "S15_HAS_OBJECTIVE_METHOD_CALL": "true",
          "S16_HAS_Invocations_Prone_Exception": "false",
          "S18_In_Synchronized_Method": "false",
          "S1_LOCAL_VAR_NOT_ASSIGNED": "false",
          "S1_LOCAL_VAR_NOT_USED": "false",
          "S2_SIMILAR_OBJECT_TYPE_WITH_NORMAL_GUARD": "false",
          "S2_SIMILAR_OBJECT_TYPE_WITH_NULL_GUARD": "false",
          "S3_TYPE_OF_FAULTY_STATEMENT": "If",
          "S4_Field_NOT_ASSIGNED": "false",
          "S4_Field_NOT_USED": "false",
          "S5_SIMILAR_PRIMITIVE_TYPE_WITH_NORMAL_GUARD": "false",
          "S5_SIMILAR_PRIMITIVE_TYPE_WITH_NULL_GUARD": "false",
          "S6_METHOD_THROWS_EXCEPTION": "false",
          "S7_OBJECT_USED_IN_ASSIGNMENT": "false",
          "S8_PRIMITIVE_USED_IN_ASSIGNMENT": "false",
          "S9_METHOD_CALL_WITH_NORMAL_GUARD": "false",
          "ast_info": {
            "dst": "tb.currentElement().nodeName()",
            "dst_parent": "tb.currentElement().nodeName().equals(\"ruby\")",
            "dst_parent_type": "Invocation",
            "dst_type": "Invocation",
            "operator": "UPD",
            "src": "tb.currentElement().normalName()",
            "src_parent": "tb.currentElement().normalName().equals(\"ruby\")",
            "src_parent_type": "Invocation",
            "src_type": "Invocation"
          }
        },
        {
          "FEATURES_METHOD_INVOCATION": {},
          "FEATURES_TYPEACCESS": {},
          "FEATURES_VARS": {},
          "S10_METHOD_CALL_WITH_NULL_GUARD": "false",
          "S11_FAULTY_CLASS_EXCEPTION_TYPE": "false",
          "S12_METHOD_CALL_WITH_TRY_CATCH": "false",
          "S13_TYPE_OF_FAULTY_STATEMENT_AFTER_1": "LocalVariable",
          "S13_TYPE_OF_FAULTY_STATEMENT_AFTER_2": "For",
          "S13_TYPE_OF_FAULTY_STATEMENT_AFTER_3": "Return",
          "S13_TYPE_OF_FAULTY_STATEMENT_BEFORE_1": "",
          "S13_TYPE_OF_FAULTY_STATEMENT_BEFORE_2": "",
          "S13_TYPE_OF_FAULTY_STATEMENT_BEFORE_3": "",
          "S14_TYPE_OF_FAULTY_STATEMENT_PARENT": "Method",
          "S15_HAS_OBJECTIVE_METHOD_CALL": "false",
          "S16_HAS_Invocations_Prone_Exception": "false",
          "S18_In_Synchronized_Method": "false",
          "S1_LOCAL_VAR_NOT_ASSIGNED": "false",
          "S1_LOCAL_VAR_NOT_USED": "false",
          "S2_SIMILAR_OBJECT_TYPE_WITH_NORMAL_GUARD": "false",
          "S2_SIMILAR_OBJECT_TYPE_WITH_NULL_GUARD": "false",
          "S3_TYPE_OF_FAULTY_STATEMENT": "LocalVariable",
          "S4_Field_NOT_ASSIGNED": "false",
          "S4_Field_NOT_USED": "false",
          "S5_SIMILAR_PRIMITIVE_TYPE_WITH_NORMAL_GUARD": "false",
          "S5_SIMILAR_PRIMITIVE_TYPE_WITH_NULL_GUARD": "false",
          "S6_METHOD_THROWS_EXCEPTION": "false",
          "S7_OBJECT_USED_IN_ASSIGNMENT": "false",
          "S8_PRIMITIVE_USED_IN_ASSIGNMENT": "false",
          "S9_METHOD_CALL_WITH_NORMAL_GUARD": "false",
          "ast_info": {
            "dst": "null",
            "dst_parent": "null",
            "dst_parent_type": "null",
            "dst_type": "null",
            "operator": "DEL",
            "src": "t.asEndTag().normalName",
            "src_parent": "java.lang.String name = t.asEndTag().normalName",
            "src_parent_type": "LocalVariable",
            "src_type": "FieldRead"
          }
        },
        {
          "FEATURES_METHOD_INVOCATION": {},
          "FEATURES_TYPEACCESS": {},
          "FEATURES_VARS": {},
          "S10_METHOD_CALL_WITH_NULL_GUARD": "false",
          "S11_FAULTY_CLASS_EXCEPTION_TYPE": "false",
          "S12_METHOD_CALL_WITH_TRY_CATCH": "false",
          "S13_TYPE_OF_FAULTY_STATEMENT_AFTER_1": "LocalVariable",
          "S13_TYPE_OF_FAULTY_STATEMENT_AFTER_2": "For",
          "S13_TYPE_OF_FAULTY_STATEMENT_AFTER_3": "Return",
          "S13_TYPE_OF_FAULTY_STATEMENT_BEFORE_1": "",
          "S13_TYPE_OF_FAULTY_STATEMENT_BEFORE_2": "",
          "S13_TYPE_OF_FAULTY_STATEMENT_BEFORE_3": "",
          "S14_TYPE_OF_FAULTY_STATEMENT_PARENT": "Method",
          "S15_HAS_OBJECTIVE_METHOD_CALL": "false",
          "S16_HAS_Invocations_Prone_Exception": "false",
          "S18_In_Synchronized_Method": "false",
          "S1_LOCAL_VAR_NOT_ASSIGNED": "false",
          "S1_LOCAL_VAR_NOT_USED": "false",
          "S2_SIMILAR_OBJECT_TYPE_WITH_NORMAL_GUARD": "false",
          "S2_SIMILAR_OBJECT_TYPE_WITH_NULL_GUARD": "false",
          "S3_TYPE_OF_FAULTY_STATEMENT": "LocalVariable",
          "S4_Field_NOT_ASSIGNED": "false",
          "S4_Field_NOT_USED": "false",
          "S5_SIMILAR_PRIMITIVE_TYPE_WITH_NORMAL_GUARD": "false",
          "S5_SIMILAR_PRIMITIVE_TYPE_WITH_NULL_GUARD": "false",
          "S6_METHOD_THROWS_EXCEPTION": "false",
          "S7_OBJECT_USED_IN_ASSIGNMENT": "false",
          "S8_PRIMITIVE_USED_IN_ASSIGNMENT": "false",
          "S9_METHOD_CALL_WITH_NORMAL_GUARD": "false",
          "ast_info": {
            "dst": "null",
            "dst_parent": "null",
            "dst_parent_type": "null",
            "dst_type": "null",
            "operator": "INS",
            "src": "tb.settings.normalizeTag(t.asEndTag().name())",
            "src_parent": "java.lang.String name = tb.settings.normalizeTag(t.asEndTag().name())",
            "src_parent_type": "LocalVariable",
            "src_type": "Invocation"
          }
        },
        {
          "FEATURES_METHOD_INVOCATION": {},
          "FEATURES_TYPEACCESS": {},
          "FEATURES_VARS": {},
          "S10_METHOD_CALL_WITH_NULL_GUARD": "false",
          "S11_FAULTY_CLASS_EXCEPTION_TYPE": "false",
          "S12_METHOD_CALL_WITH_TRY_CATCH": "false",
          "S13_TYPE_OF_FAULTY_STATEMENT_AFTER_1": "LocalVariable",
          "S13_TYPE_OF_FAULTY_STATEMENT_AFTER_2": "For",
          "S13_TYPE_OF_FAULTY_STATEMENT_AFTER_3": "Return",
          "S13_TYPE_OF_FAULTY_STATEMENT_BEFORE_1": "",
          "S13_TYPE_OF_FAULTY_STATEMENT_BEFORE_2": "",
          "S13_TYPE_OF_FAULTY_STATEMENT_BEFORE_3": "",
          "S14_TYPE_OF_FAULTY_STATEMENT_PARENT": "Method",
          "S15_HAS_OBJECTIVE_METHOD_CALL": "false",
          "S16_HAS_Invocations_Prone_Exception": "false",
          "S18_In_Synchronized_Method": "false",
          "S1_LOCAL_VAR_NOT_ASSIGNED": "false",
          "S1_LOCAL_VAR_NOT_USED": "false",
          "S2_SIMILAR_OBJECT_TYPE_WITH_NORMAL_GUARD": "false",
          "S2_SIMILAR_OBJECT_TYPE_WITH_NULL_GUARD": "false",
          "S3_TYPE_OF_FAULTY_STATEMENT": "LocalVariable",
          "S4_Field_NOT_ASSIGNED": "false",
          "S4_Field_NOT_USED": "false",
          "S5_SIMILAR_PRIMITIVE_TYPE_WITH_NORMAL_GUARD": "false",
          "S5_SIMILAR_PRIMITIVE_TYPE_WITH_NULL_GUARD": "false",
          "S6_METHOD_THROWS_EXCEPTION": "false",
          "S7_OBJECT_USED_IN_ASSIGNMENT": "false",
          "S8_PRIMITIVE_USED_IN_ASSIGNMENT": "false",
          "S9_METHOD_CALL_WITH_NORMAL_GUARD": "false",
          "ast_info": {
            "dst": "t.asEndTag()",
            "dst_parent": "t.asEndTag().name()",
            "dst_parent_type": "Invocation",
            "dst_type": "Invocation",
            "operator": "MOV",
            "src": "t.asEndTag()",
            "src_parent": "t.asEndTag().normalName",
            "src_parent_type": "FieldRead",
            "src_type": "Invocation"
          }
        }
      ],
      "file_name": "HtmlTreeBuilderState"
    },
    {
      "features": [
        {
          "FEATURES_METHOD_INVOCATION": {},
          "FEATURES_TYPEACCESS": {},
          "FEATURES_VARS": {},
          "S10_METHOD_CALL_WITH_NULL_GUARD": "false",
          "S11_FAULTY_CLASS_EXCEPTION_TYPE": "false",
          "S12_METHOD_CALL_WITH_TRY_CATCH": "false",
          "S13_TYPE_OF_FAULTY_STATEMENT_AFTER_1": "Return",
          "S13_TYPE_OF_FAULTY_STATEMENT_AFTER_2": "",
          "S13_TYPE_OF_FAULTY_STATEMENT_AFTER_3": "",
          "S13_TYPE_OF_FAULTY_STATEMENT_BEFORE_1": "",
          "S13_TYPE_OF_FAULTY_STATEMENT_BEFORE_2": "",
          "S13_TYPE_OF_FAULTY_STATEMENT_BEFORE_3": "",
          "S14_TYPE_OF_FAULTY_STATEMENT_PARENT": "Method",
          "S15_HAS_OBJECTIVE_METHOD_CALL": "true",
          "S16_HAS_Invocations_Prone_Exception": "false",
          "S18_In_Synchronized_Method": "false",
          "S1_LOCAL_VAR_NOT_ASSIGNED": "false",
          "S1_LOCAL_VAR_NOT_USED": "false",
          "S2_SIMILAR_OBJECT_TYPE_WITH_NORMAL_GUARD": "false",
          "S2_SIMILAR_OBJECT_TYPE_WITH_NULL_GUARD": "false",
          "S3_TYPE_OF_FAULTY_STATEMENT": "LocalVariable",
          "S4_Field_NOT_ASSIGNED": "false",
          "S4_Field_NOT_USED": "false",
          "S5_SIMILAR_PRIMITIVE_TYPE_WITH_NORMAL_GUARD": "false",
          "S5_SIMILAR_PRIMITIVE_TYPE_WITH_NULL_GUARD": "false",
          "S6_METHOD_THROWS_EXCEPTION": "false",
          "S7_OBJECT_USED_IN_ASSIGNMENT": "false",
          "S8_PRIMITIVE_USED_IN_ASSIGNMENT": "false",
          "S9_METHOD_CALL_WITH_NORMAL_GUARD": "false",
          "ast_info": {
            "dst": "el.nodeName()",
            "dst_parent": "java.lang.String name = el.nodeName()",
            "dst_parent_type": "LocalVariable",
            "dst_type": "Invocation",
            "operator": "UPD",
            "src": "el.normalName()",
            "src_parent": "java.lang.String name = el.normalName()",
            "src_parent_type": "LocalVariable",
            "src_type": "Invocation"
          }
        },
        {
          "FEATURES_METHOD_INVOCATION": {},
          "FEATURES_TYPEACCESS": {},
          "FEATURES_VARS": {},
          "S10_METHOD_CALL_WITH_NULL_GUARD": "false",
          "S11_FAULTY_CLASS_EXCEPTION_TYPE": "false",
          "S12_METHOD_CALL_WITH_TRY_CATCH": "false",
          "S13_TYPE_OF_FAULTY_STATEMENT_AFTER_1": "If",
          "S13_TYPE_OF_FAULTY_STATEMENT_AFTER_2": "",
          "S13_TYPE_OF_FAULTY_STATEMENT_AFTER_3": "",
          "S13_TYPE_OF_FAULTY_STATEMENT_BEFORE_1": "If",
          "S13_TYPE_OF_FAULTY_STATEMENT_BEFORE_2": "LocalVariable",
          "S13_TYPE_OF_FAULTY_STATEMENT_BEFORE_3": "",
          "S14_TYPE_OF_FAULTY_STATEMENT_PARENT": "For",
          "S15_HAS_OBJECTIVE_METHOD_CALL": "true",
          "S16_HAS_Invocations_Prone_Exception": "false",
          "S18_In_Synchronized_Method": "false",
          "S1_LOCAL_VAR_NOT_ASSIGNED": "false",
          "S1_LOCAL_VAR_NOT_USED": "false",
          "S2_SIMILAR_OBJECT_TYPE_WITH_NORMAL_GUARD": "false",
          "S2_SIMILAR_OBJECT_TYPE_WITH_NULL_GUARD": "false",
          "S3_TYPE_OF_FAULTY_STATEMENT": "LocalVariable",
          "S4_Field_NOT_ASSIGNED": "false",
          "S4_Field_NOT_USED": "false",
          "S5_SIMILAR_PRIMITIVE_TYPE_WITH_NORMAL_GUARD": "false",
          "S5_SIMILAR_PRIMITIVE_TYPE_WITH_NULL_GUARD": "false",
          "S6_METHOD_THROWS_EXCEPTION": "false",
          "S7_OBJECT_USED_IN_ASSIGNMENT": "false",
          "S8_PRIMITIVE_USED_IN_ASSIGNMENT": "false",
          "S9_METHOD_CALL_WITH_NORMAL_GUARD": "false",
          "ast_info": {
            "dst": "node.nodeName()",
            "dst_parent": "java.lang.String name = node.nodeName()",
            "dst_parent_type": "LocalVariable",
            "dst_type": "Invocation",
            "operator": "UPD",
            "src": "node.normalName()",
            "src_parent": "java.lang.String name = node.normalName()",
            "src_parent_type": "LocalVariable",
            "src_type": "Invocation"
          }
        },
        {
          "FEATURES_METHOD_INVOCATION": {},
          "FEATURES_TYPEACCESS": {},
          "FEATURES_VARS": {},
          "S10_METHOD_CALL_WITH_NULL_GUARD": "false",
          "S11_FAULTY_CLASS_EXCEPTION_TYPE": "false",
          "S12_METHOD_CALL_WITH_TRY_CATCH": "false",
          "S13_TYPE_OF_FAULTY_STATEMENT_AFTER_1": "If",
          "S13_TYPE_OF_FAULTY_STATEMENT_AFTER_2": "If",
          "S13_TYPE_OF_FAULTY_STATEMENT_AFTER_3": "If",
          "S13_TYPE_OF_FAULTY_STATEMENT_BEFORE_1": "",
          "S13_TYPE_OF_FAULTY_STATEMENT_BEFORE_2": "",
          "S13_TYPE_OF_FAULTY_STATEMENT_BEFORE_3": "",
          "S14_TYPE_OF_FAULTY_STATEMENT_PARENT": "For",
          "S15_HAS_OBJECTIVE_METHOD_CALL": "true",
          "S16_HAS_Invocations_Prone_Exception": "false",
          "S18_In_Synchronized_Method": "false",
          "S1_LOCAL_VAR_NOT_ASSIGNED": "false",
          "S1_LOCAL_VAR_NOT_USED": "false",
          "S2_SIMILAR_OBJECT_TYPE_WITH_NORMAL_GUARD": "false",
          "S2_SIMILAR_OBJECT_TYPE_WITH_NULL_GUARD": "false",
          "S3_TYPE_OF_FAULTY_STATEMENT": "LocalVariable",
          "S4_Field_NOT_ASSIGNED": "false",
          "S4_Field_NOT_USED": "false",
          "S5_SIMILAR_PRIMITIVE_TYPE_WITH_NORMAL_GUARD": "false",
          "S5_SIMILAR_PRIMITIVE_TYPE_WITH_NULL_GUARD": "false",
          "S6_METHOD_THROWS_EXCEPTION": "false",
          "S7_OBJECT_USED_IN_ASSIGNMENT": "false",
          "S8_PRIMITIVE_USED_IN_ASSIGNMENT": "false",
          "S9_METHOD_CALL_WITH_NORMAL_GUARD": "false",
          "ast_info": {
            "dst": "stack.get(pos).nodeName()",
            "dst_parent": "final java.lang.String elName = stack.get(pos).nodeName()",
            "dst_parent_type": "LocalVariable",
            "dst_type": "Invocation",
            "operator": "UPD",
            "src": "stack.get(pos).normalName()",
            "src_parent": "final java.lang.String elName = stack.get(pos).normalName()",
            "src_parent_type": "LocalVariable",
            "src_type": "Invocation"
          }
        },
        {
          "FEATURES_METHOD_INVOCATION": {},
          "FEATURES_TYPEACCESS": {},
          "FEATURES_VARS": {},
          "S10_METHOD_CALL_WITH_NULL_GUARD": "false",
          "S11_FAULTY_CLASS_EXCEPTION_TYPE": "false",
          "S12_METHOD_CALL_WITH_TRY_CATCH": "false",
          "S13_TYPE_OF_FAULTY_STATEMENT_AFTER_1": "If",
          "S13_TYPE_OF_FAULTY_STATEMENT_AFTER_2": "If",
          "S13_TYPE_OF_FAULTY_STATEMENT_AFTER_3": "",
          "S13_TYPE_OF_FAULTY_STATEMENT_BEFORE_1": "LocalVariable",
          "S13_TYPE_OF_FAULTY_STATEMENT_BEFORE_2": "",
          "S13_TYPE_OF_FAULTY_STATEMENT_BEFORE_3": "",
          "S14_TYPE_OF_FAULTY_STATEMENT_PARENT": "For",
          "S15_HAS_OBJECTIVE_METHOD_CALL": "true",
          "S16_HAS_Invocations_Prone_Exception": "false",
          "S18_In_Synchronized_Method": "false",
          "S1_LOCAL_VAR_NOT_ASSIGNED": "false",
          "S1_LOCAL_VAR_NOT_USED": "false",
          "S2_SIMILAR_OBJECT_TYPE_WITH_NORMAL_GUARD": "false",
          "S2_SIMILAR_OBJECT_TYPE_WITH_NULL_GUARD": "false",
          "S3_TYPE_OF_FAULTY_STATEMENT": "LocalVariable",
          "S4_Field_NOT_ASSIGNED": "false",
          "S4_Field_NOT_USED": "false",
          "S5_SIMILAR_PRIMITIVE_TYPE_WITH_NORMAL_GUARD": "false",
          "S5_SIMILAR_PRIMITIVE_TYPE_WITH_NULL_GUARD": "false",
          "S6_METHOD_THROWS_EXCEPTION": "false",
          "S7_OBJECT_USED_IN_ASSIGNMENT": "false",
          "S8_PRIMITIVE_USED_IN_ASSIGNMENT": "false",
          "S9_METHOD_CALL_WITH_NORMAL_GUARD": "false",
          "ast_info": {
            "dst": "el.nodeName()",
            "dst_parent": "java.lang.String elName = el.nodeName()",
            "dst_parent_type": "LocalVariable",
            "dst_type": "Invocation",
            "operator": "UPD",
            "src": "el.normalName()",
            "src_parent": "java.lang.String elName = el.normalName()",
            "src_parent_type": "LocalVariable",
            "src_type": "Invocation"
          }
        },
        {
          "FEATURES_METHOD_INVOCATION": {},
          "FEATURES_TYPEACCESS": {},
          "FEATURES_VARS": {},
          "S10_METHOD_CALL_WITH_NULL_GUARD": "false",
          "S11_FAULTY_CLASS_EXCEPTION_TYPE": "false",
          "S12_METHOD_CALL_WITH_TRY_CATCH": "false",
          "S13_TYPE_OF_FAULTY_STATEMENT_AFTER_1": "",
          "S13_TYPE_OF_FAULTY_STATEMENT_AFTER_2": "",
          "S13_TYPE_OF_FAULTY_STATEMENT_AFTER_3": "",
          "S13_TYPE_OF_FAULTY_STATEMENT_BEFORE_1": "LocalVariable",
          "S13_TYPE_OF_FAULTY_STATEMENT_BEFORE_2": "",
          "S13_TYPE_OF_FAULTY_STATEMENT_BEFORE_3": "",
          "S14_TYPE_OF_FAULTY_STATEMENT_PARENT": "For",
          "S15_HAS_OBJECTIVE_METHOD_CALL": "false",
          "S16_HAS_Invocations_Prone_Exception": "false",
          "S18_In_Synchronized_Method": "false",
          "S1_LOCAL_VAR_NOT_ASSIGNED": "false",
          "S1_LOCAL_VAR_NOT_USED": "false",
          "S2_SIMILAR_OBJECT_TYPE_WITH_NORMAL_GUARD": "false",
          "S2_SIMILAR_OBJECT_TYPE_WITH_NULL_GUARD": "false",
          "S3_TYPE_OF_FAULTY_STATEMENT": "If",
          "S4_Field_NOT_ASSIGNED": "false",
          "S4_Field_NOT_USED": "false",
          "S5_SIMILAR_PRIMITIVE_TYPE_WITH_NORMAL_GUARD": "false",
          "S5_SIMILAR_PRIMITIVE_TYPE_WITH_NULL_GUARD": "false",
          "S6_METHOD_THROWS_EXCEPTION": "false",
          "S7_OBJECT_USED_IN_ASSIGNMENT": "false",
          "S8_PRIMITIVE_USED_IN_ASSIGNMENT": "false",
          "S9_METHOD_CALL_WITH_NORMAL_GUARD": "false",
          "ast_info": {
            "dst": "next.nodeName()",
            "dst_parent": "next.nodeName().equals(elName)",
            "dst_parent_type": "Invocation",
            "dst_type": "Invocation",
            "operator": "UPD",
            "src": "next.normalName()",
            "src_parent": "next.normalName().equals(elName)",
            "src_parent_type": "Invocation",
            "src_type": "Invocation"
          }
        },
        {
          "FEATURES_METHOD_INVOCATION": {},
          "FEATURES_TYPEACCESS": {},
          "FEATURES_VARS": {},
          "S10_METHOD_CALL_WITH_NULL_GUARD": "false",
          "S11_FAULTY_CLASS_EXCEPTION_TYPE": "false",
          "S12_METHOD_CALL_WITH_TRY_CATCH": "false",
          "S13_TYPE_OF_FAULTY_STATEMENT_AFTER_1": "",
          "S13_TYPE_OF_FAULTY_STATEMENT_AFTER_2": "",
          "S13_TYPE_OF_FAULTY_STATEMENT_AFTER_3": "",
          "S13_TYPE_OF_FAULTY_STATEMENT_BEFORE_1": "Invocation",
          "S13_TYPE_OF_FAULTY_STATEMENT_BEFORE_2": "LocalVariable",
          "S13_TYPE_OF_FAULTY_STATEMENT_BEFORE_3": "",
          "S14_TYPE_OF_FAULTY_STATEMENT_PARENT": "For",
          "S15_HAS_OBJECTIVE_METHOD_CALL": "false",
          "S16_HAS_Invocations_Prone_Exception": "false",
          "S18_In_Synchronized_Method": "false",
          "S1_LOCAL_VAR_NOT_ASSIGNED": "false",
          "S1_LOCAL_VAR_NOT_USED": "false",
          "S2_SIMILAR_OBJECT_TYPE_WITH_NORMAL_GUARD": "false",
          "S2_SIMILAR_OBJECT_TYPE_WITH_NULL_GUARD": "false",
          "S3_TYPE_OF_FAULTY_STATEMENT": "If",
          "S4_Field_NOT_ASSIGNED": "false",
          "S4_Field_NOT_USED": "false",
          "S5_SIMILAR_PRIMITIVE_TYPE_WITH_NORMAL_GUARD": "false",
          "S5_SIMILAR_PRIMITIVE_TYPE_WITH_NULL_GUARD": "false",
          "S6_METHOD_THROWS_EXCEPTION": "false",
          "S7_OBJECT_USED_IN_ASSIGNMENT": "false",
          "S8_PRIMITIVE_USED_IN_ASSIGNMENT": "false",
          "S9_METHOD_CALL_WITH_NORMAL_GUARD": "false",
          "ast_info": {
            "dst": "next.nodeName()",
            "dst_parent": "next.nodeName().equals(elName)",
            "dst_parent_type": "Invocation",
            "dst_type": "Invocation",
            "operator": "UPD",
            "src": "next.normalName()",
            "src_parent": "next.normalName().equals(elName)",
            "src_parent_type": "Invocation",
            "src_type": "Invocation"
          }
        },
        {
          "FEATURES_METHOD_INVOCATION": {},
          "FEATURES_TYPEACCESS": {},
          "FEATURES_VARS": {},
          "S10_METHOD_CALL_WITH_NULL_GUARD": "false",
          "S11_FAULTY_CLASS_EXCEPTION_TYPE": "false",
          "S12_METHOD_CALL_WITH_TRY_CATCH": "false",
          "S13_TYPE_OF_FAULTY_STATEMENT_AFTER_1": "",
          "S13_TYPE_OF_FAULTY_STATEMENT_AFTER_2": "",
          "S13_TYPE_OF_FAULTY_STATEMENT_AFTER_3": "",
          "S13_TYPE_OF_FAULTY_STATEMENT_BEFORE_1": "Invocation",
          "S13_TYPE_OF_FAULTY_STATEMENT_BEFORE_2": "LocalVariable",
          "S13_TYPE_OF_FAULTY_STATEMENT_BEFORE_3": "",
          "S14_TYPE_OF_FAULTY_STATEMENT_PARENT": "For",
          "S15_HAS_OBJECTIVE_METHOD_CALL": "false",
          "S16_HAS_Invocations_Prone_Exception": "false",
          "S18_In_Synchronized_Method": "false",
          "S1_LOCAL_VAR_NOT_ASSIGNED": "false",
          "S1_LOCAL_VAR_NOT_USED": "false",
          "S2_SIMILAR_OBJECT_TYPE_WITH_NORMAL_GUARD": "false",
          "S2_SIMILAR_OBJECT_TYPE_WITH_NULL_GUARD": "false",
          "S3_TYPE_OF_FAULTY_STATEMENT": "If",
          "S4_Field_NOT_ASSIGNED": "false",
          "S4_Field_NOT_USED": "false",
          "S5_SIMILAR_PRIMITIVE_TYPE_WITH_NORMAL_GUARD": "false",
          "S5_SIMILAR_PRIMITIVE_TYPE_WITH_NULL_GUARD": "false",
          "S6_METHOD_THROWS_EXCEPTION": "false",
          "S7_OBJECT_USED_IN_ASSIGNMENT": "false",
          "S8_PRIMITIVE_USED_IN_ASSIGNMENT": "false",
          "S9_METHOD_CALL_WITH_NORMAL_GUARD": "false",
          "ast_info": {
            "dst": "next.nodeName()",
            "dst_parent": "inSorted(next.nodeName(), elNames)",
            "dst_parent_type": "Invocation",
            "dst_type": "Invocation",
            "operator": "UPD",
            "src": "next.normalName()",
            "src_parent": "inSorted(next.normalName(), elNames)",
            "src_parent_type": "Invocation",
            "src_type": "Invocation"
          }
        },
        {
          "FEATURES_METHOD_INVOCATION": {},
          "FEATURES_TYPEACCESS": {},
          "FEATURES_VARS": {},
          "S10_METHOD_CALL_WITH_NULL_GUARD": "false",
          "S11_FAULTY_CLASS_EXCEPTION_TYPE": "false",
          "S12_METHOD_CALL_WITH_TRY_CATCH": "false",
          "S13_TYPE_OF_FAULTY_STATEMENT_AFTER_1": "",
          "S13_TYPE_OF_FAULTY_STATEMENT_AFTER_2": "",
          "S13_TYPE_OF_FAULTY_STATEMENT_AFTER_3": "",
          "S13_TYPE_OF_FAULTY_STATEMENT_BEFORE_1": "LocalVariable",
          "S13_TYPE_OF_FAULTY_STATEMENT_BEFORE_2": "",
          "S13_TYPE_OF_FAULTY_STATEMENT_BEFORE_3": "",
          "S14_TYPE_OF_FAULTY_STATEMENT_PARENT": "For",
          "S15_HAS_OBJECTIVE_METHOD_CALL": "false",
          "S16_HAS_Invocations_Prone_Exception": "false",
          "S18_In_Synchronized_Method": "false",
          "S1_LOCAL_VAR_NOT_ASSIGNED": "false",
          "S1_LOCAL_VAR_NOT_USED": "false",
          "S2_SIMILAR_OBJECT_TYPE_WITH_NORMAL_GUARD": "false",
          "S2_SIMILAR_OBJECT_TYPE_WITH_NULL_GUARD": "false",
          "S3_TYPE_OF_FAULTY_STATEMENT": "If",
          "S4_Field_NOT_ASSIGNED": "false",
          "S4_Field_NOT_USED": "false",
          "S5_SIMILAR_PRIMITIVE_TYPE_WITH_NORMAL_GUARD": "false",
          "S5_SIMILAR_PRIMITIVE_TYPE_WITH_NULL_GUARD": "false",
          "S6_METHOD_THROWS_EXCEPTION": "false",
          "S7_OBJECT_USED_IN_ASSIGNMENT": "false",
          "S8_PRIMITIVE_USED_IN_ASSIGNMENT": "false",
          "S9_METHOD_CALL_WITH_NORMAL_GUARD": "false",
          "ast_info": {
            "dst": "next.nodeName()",
            "dst_parent": "next.nodeName().equals(elName)",
            "dst_parent_type": "Invocation",
            "dst_type": "Invocation",
            "operator": "UPD",
            "src": "next.normalName()",
            "src_parent": "next.normalName().equals(elName)",
            "src_parent_type": "Invocation",
            "src_type": "Invocation"
          }
        },
        {
          "FEATURES_METHOD_INVOCATION": {},
          "FEATURES_TYPEACCESS": {},
          "FEATURES_VARS": {},
          "S10_METHOD_CALL_WITH_NULL_GUARD": "false",
          "S11_FAULTY_CLASS_EXCEPTION_TYPE": "false",
          "S12_METHOD_CALL_WITH_TRY_CATCH": "false",
          "S13_TYPE_OF_FAULTY_STATEMENT_AFTER_1": "",
          "S13_TYPE_OF_FAULTY_STATEMENT_AFTER_2": "",
          "S13_TYPE_OF_FAULTY_STATEMENT_AFTER_3": "",
          "S13_TYPE_OF_FAULTY_STATEMENT_BEFORE_1": "",
          "S13_TYPE_OF_FAULTY_STATEMENT_BEFORE_2": "",
          "S13_TYPE_OF_FAULTY_STATEMENT_BEFORE_3": "",
          "S14_TYPE_OF_FAULTY_STATEMENT_PARENT": "Method",
          "S15_HAS_OBJECTIVE_METHOD_CALL": "false",
          "S16_HAS_Invocations_Prone_Exception": "false",
          "S18_In_Synchronized_Method": "false",
          "S1_LOCAL_VAR_NOT_ASSIGNED": "false",
          "S1_LOCAL_VAR_NOT_USED": "false",
          "S2_SIMILAR_OBJECT_TYPE_WITH_NORMAL_GUARD": "false",
          "S2_SIMILAR_OBJECT_TYPE_WITH_NULL_GUARD": "false",
          "S3_TYPE_OF_FAULTY_STATEMENT": "While",
          "S4_Field_NOT_ASSIGNED": "false",
          "S4_Field_NOT_USED": "false",
          "S5_SIMILAR_PRIMITIVE_TYPE_WITH_NORMAL_GUARD": "false",
          "S5_SIMILAR_PRIMITIVE_TYPE_WITH_NULL_GUARD": "false",
          "S6_METHOD_THROWS_EXCEPTION": "false",
          "S7_OBJECT_USED_IN_ASSIGNMENT": "false",
          "S8_PRIMITIVE_USED_IN_ASSIGNMENT": "false",
          "S9_METHOD_CALL_WITH_NORMAL_GUARD": "false",
          "ast_info": {
            "dst": "currentElement().nodeName()",
            "dst_parent": "inSorted(currentElement().nodeName(), org.jsoup.parser.HtmlTreeBuilder.TagSearchEndTags)",
            "dst_parent_type": "Invocation",
            "dst_type": "Invocation",
            "operator": "UPD",
            "src": "currentElement().normalName()",
            "src_parent": "inSorted(currentElement().normalName(), org.jsoup.parser.HtmlTreeBuilder.TagSearchEndTags)",
            "src_parent_type": "Invocation",
            "src_type": "Invocation"
          }
        },
        {
          "FEATURES_METHOD_INVOCATION": {},
          "FEATURES_TYPEACCESS": {},
          "FEATURES_VARS": {},
          "S10_METHOD_CALL_WITH_NULL_GUARD": "false",
          "S11_FAULTY_CLASS_EXCEPTION_TYPE": "false",
          "S12_METHOD_CALL_WITH_TRY_CATCH": "false",
          "S13_TYPE_OF_FAULTY_STATEMENT_AFTER_1": "",
          "S13_TYPE_OF_FAULTY_STATEMENT_AFTER_2": "",
          "S13_TYPE_OF_FAULTY_STATEMENT_AFTER_3": "",
          "S13_TYPE_OF_FAULTY_STATEMENT_BEFORE_1": "",
          "S13_TYPE_OF_FAULTY_STATEMENT_BEFORE_2": "",
          "S13_TYPE_OF_FAULTY_STATEMENT_BEFORE_3": "",
          "S14_TYPE_OF_FAULTY_STATEMENT_PARENT": "Method",
          "S15_HAS_OBJECTIVE_METHOD_CALL": "false",
          "S16_HAS_Invocations_Prone_Exception": "false",
          "S18_In_Synchronized_Method": "false",
          "S1_LOCAL_VAR_NOT_ASSIGNED": "false",
          "S1_LOCAL_VAR_NOT_USED": "false",
          "S2_SIMILAR_OBJECT_TYPE_WITH_NORMAL_GUARD": "false",
          "S2_SIMILAR_OBJECT_TYPE_WITH_NULL_GUARD": "false",
          "S3_TYPE_OF_FAULTY_STATEMENT": "Return",
          "S4_Field_NOT_ASSIGNED": "false",
          "S4_Field_NOT_USED": "false",
          "S5_SIMILAR_PRIMITIVE_TYPE_WITH_NORMAL_GUARD": "false",
          "S5_SIMILAR_PRIMITIVE_TYPE_WITH_NULL_GUARD": "false",
          "S6_METHOD_THROWS_EXCEPTION": "false",
          "S7_OBJECT_USED_IN_ASSIGNMENT": "false",
          "S8_PRIMITIVE_USED_IN_ASSIGNMENT": "false",
          "S9_METHOD_CALL_WITH_NORMAL_GUARD": "false",
          "ast_info": {
            "dst": "a.nodeName()",
            "dst_parent": "a.nodeName().equals(b.nodeName())",
            "dst_parent_type": "Invocation",
            "dst_type": "Invocation",
            "operator": "UPD",
            "src": "a.normalName()",
            "src_parent": "a.normalName().equals(b.normalName())",
            "src_parent_type": "Invocation",
            "src_type": "Invocation"
          }
        },
        {
          "FEATURES_METHOD_INVOCATION": {},
          "FEATURES_TYPEACCESS": {},
          "FEATURES_VARS": {},
          "S10_METHOD_CALL_WITH_NULL_GUARD": "false",
          "S11_FAULTY_CLASS_EXCEPTION_TYPE": "false",
          "S12_METHOD_CALL_WITH_TRY_CATCH": "false",
          "S13_TYPE_OF_FAULTY_STATEMENT_AFTER_1": "",
          "S13_TYPE_OF_FAULTY_STATEMENT_AFTER_2": "",
          "S13_TYPE_OF_FAULTY_STATEMENT_AFTER_3": "",
          "S13_TYPE_OF_FAULTY_STATEMENT_BEFORE_1": "",
          "S13_TYPE_OF_FAULTY_STATEMENT_BEFORE_2": "",
          "S13_TYPE_OF_FAULTY_STATEMENT_BEFORE_3": "",
          "S14_TYPE_OF_FAULTY_STATEMENT_PARENT": "Method",
          "S15_HAS_OBJECTIVE_METHOD_CALL": "false",
          "S16_HAS_Invocations_Prone_Exception": "false",
          "S18_In_Synchronized_Method": "false",
          "S1_LOCAL_VAR_NOT_ASSIGNED": "false",
          "S1_LOCAL_VAR_NOT_USED": "false",
          "S2_SIMILAR_OBJECT_TYPE_WITH_NORMAL_GUARD": "false",
          "S2_SIMILAR_OBJECT_TYPE_WITH_NULL_GUARD": "false",
          "S3_TYPE_OF_FAULTY_STATEMENT": "Return",
          "S4_Field_NOT_ASSIGNED": "false",
          "S4_Field_NOT_USED": "false",
          "S5_SIMILAR_PRIMITIVE_TYPE_WITH_NORMAL_GUARD": "false",
          "S5_SIMILAR_PRIMITIVE_TYPE_WITH_NULL_GUARD": "false",
          "S6_METHOD_THROWS_EXCEPTION": "false",
          "S7_OBJECT_USED_IN_ASSIGNMENT": "false",
          "S8_PRIMITIVE_USED_IN_ASSIGNMENT": "false",
          "S9_METHOD_CALL_WITH_NORMAL_GUARD": "false",
          "ast_info": {
            "dst": "b.nodeName()",
            "dst_parent": "a.nodeName().equals(b.nodeName())",
            "dst_parent_type": "Invocation",
            "dst_type": "Invocation",
            "operator": "UPD",
            "src": "b.normalName()",
            "src_parent": "a.normalName().equals(b.normalName())",
            "src_parent_type": "Invocation",
            "src_type": "Invocation"
          }
        },
        {
          "FEATURES_METHOD_INVOCATION": {},
          "FEATURES_TYPEACCESS": {},
          "FEATURES_VARS": {},
          "S10_METHOD_CALL_WITH_NULL_GUARD": "false",
          "S11_FAULTY_CLASS_EXCEPTION_TYPE": "false",
          "S12_METHOD_CALL_WITH_TRY_CATCH": "false",
          "S13_TYPE_OF_FAULTY_STATEMENT_AFTER_1": "Invocation",
          "S13_TYPE_OF_FAULTY_STATEMENT_AFTER_2": "Invocation",
          "S13_TYPE_OF_FAULTY_STATEMENT_AFTER_3": "If",
          "S13_TYPE_OF_FAULTY_STATEMENT_BEFORE_1": "Assignment",
          "S13_TYPE_OF_FAULTY_STATEMENT_BEFORE_2": "Invocation",
          "S13_TYPE_OF_FAULTY_STATEMENT_BEFORE_3": "If",
          "S14_TYPE_OF_FAULTY_STATEMENT_PARENT": "While",
          "S15_HAS_OBJECTIVE_METHOD_CALL": "true",
          "S16_HAS_Invocations_Prone_Exception": "false",
          "S18_In_Synchronized_Method": "false",
          "S1_LOCAL_VAR_NOT_ASSIGNED": "false",
          "S1_LOCAL_VAR_NOT_USED": "false",
          "S2_SIMILAR_OBJECT_TYPE_WITH_NORMAL_GUARD": "false",
          "S2_SIMILAR_OBJECT_TYPE_WITH_NULL_GUARD": "false",
          "S3_TYPE_OF_FAULTY_STATEMENT": "LocalVariable",
          "S4_Field_NOT_ASSIGNED": "false",
          "S4_Field_NOT_USED": "false",
          "S5_SIMILAR_PRIMITIVE_TYPE_WITH_NORMAL_GUARD": "false",
          "S5_SIMILAR_PRIMITIVE_TYPE_WITH_NULL_GUARD": "false",
          "S6_METHOD_THROWS_EXCEPTION": "false",
          "S7_OBJECT_USED_IN_ASSIGNMENT": "false",
          "S8_PRIMITIVE_USED_IN_ASSIGNMENT": "false",
          "S9_METHOD_CALL_WITH_NORMAL_GUARD": "false",
          "ast_info": {
            "dst": "entry.nodeName()",
            "dst_parent": "insertStartTag(entry.nodeName())",
            "dst_parent_type": "Invocation",
            "dst_type": "Invocation",
            "operator": "UPD",
            "src": "entry.normalName()",
            "src_parent": "insertStartTag(entry.normalName())",
            "src_parent_type": "Invocation",
            "src_type": "Invocation"
          }
        },
        {
          "FEATURES_METHOD_INVOCATION": {},
          "FEATURES_TYPEACCESS": {},
          "FEATURES_VARS": {},
          "S10_METHOD_CALL_WITH_NULL_GUARD": "false",
          "S11_FAULTY_CLASS_EXCEPTION_TYPE": "false",
          "S12_METHOD_CALL_WITH_TRY_CATCH": "false",
          "S13_TYPE_OF_FAULTY_STATEMENT_AFTER_1": "",
          "S13_TYPE_OF_FAULTY_STATEMENT_AFTER_2": "",
          "S13_TYPE_OF_FAULTY_STATEMENT_AFTER_3": "",
          "S13_TYPE_OF_FAULTY_STATEMENT_BEFORE_1": "LocalVariable",
          "S13_TYPE_OF_FAULTY_STATEMENT_BEFORE_2": "",
          "S13_TYPE_OF_FAULTY_STATEMENT_BEFORE_3": "",
          "S14_TYPE_OF_FAULTY_STATEMENT_PARENT": "For",
          "S15_HAS_OBJECTIVE_METHOD_CALL": "false",
          "S16_HAS_Invocations_Prone_Exception": "false",
          "S18_In_Synchronized_Method": "false",
          "S1_LOCAL_VAR_NOT_ASSIGNED": "false",
          "S1_LOCAL_VAR_NOT_USED": "false",
          "S2_SIMILAR_OBJECT_TYPE_WITH_NORMAL_GUARD": "false",
          "S2_SIMILAR_OBJECT_TYPE_WITH_NULL_GUARD": "false",
          "S3_TYPE_OF_FAULTY_STATEMENT": "If",
          "S4_Field_NOT_ASSIGNED": "false",
          "S4_Field_NOT_USED": "false",
          "S5_SIMILAR_PRIMITIVE_TYPE_WITH_NORMAL_GUARD": "false",
          "S5_SIMILAR_PRIMITIVE_TYPE_WITH_NULL_GUARD": "false",
          "S6_METHOD_THROWS_EXCEPTION": "false",
          "S7_OBJECT_USED_IN_ASSIGNMENT": "false",
          "S8_PRIMITIVE_USED_IN_ASSIGNMENT": "false",
          "S9_METHOD_CALL_WITH_NORMAL_GUARD": "false",
          "ast_info": {
            "dst": "next.nodeName()",
            "dst_parent": "org.jsoup.internal.StringUtil.in(next.nodeName(), nodeNames)",
            "dst_parent_type": "Invocation",
            "dst_type": "Invocation",
            "operator": "UPD",
            "src": "next.normalName()",
            "src_parent": "org.jsoup.internal.StringUtil.in(next.normalName(), nodeNames)",
            "src_parent_type": "Invocation",
            "src_type": "Invocation"
          }
        },
        {
          "FEATURES_METHOD_INVOCATION": {},
          "FEATURES_TYPEACCESS": {},
          "FEATURES_VARS": {},
          "S10_METHOD_CALL_WITH_NULL_GUARD": "false",
          "S11_FAULTY_CLASS_EXCEPTION_TYPE": "false",
          "S12_METHOD_CALL_WITH_TRY_CATCH": "false",
          "S13_TYPE_OF_FAULTY_STATEMENT_AFTER_1": "",
          "S13_TYPE_OF_FAULTY_STATEMENT_AFTER_2": "",
          "S13_TYPE_OF_FAULTY_STATEMENT_AFTER_3": "",
          "S13_TYPE_OF_FAULTY_STATEMENT_BEFORE_1": "LocalVariable",
          "S13_TYPE_OF_FAULTY_STATEMENT_BEFORE_2": "",
          "S13_TYPE_OF_FAULTY_STATEMENT_BEFORE_3": "",
          "S14_TYPE_OF_FAULTY_STATEMENT_PARENT": "For",
          "S15_HAS_OBJECTIVE_METHOD_CALL": "false",
          "S16_HAS_Invocations_Prone_Exception": "false",
          "S18_In_Synchronized_Method": "false",
          "S1_LOCAL_VAR_NOT_ASSIGNED": "false",
          "S1_LOCAL_VAR_NOT_USED": "false",
          "S2_SIMILAR_OBJECT_TYPE_WITH_NORMAL_GUARD": "false",
          "S2_SIMILAR_OBJECT_TYPE_WITH_NULL_GUARD": "false",
          "S3_TYPE_OF_FAULTY_STATEMENT": "If",
          "S4_Field_NOT_ASSIGNED": "false",
          "S4_Field_NOT_USED": "false",
          "S5_SIMILAR_PRIMITIVE_TYPE_WITH_NORMAL_GUARD": "false",
          "S5_SIMILAR_PRIMITIVE_TYPE_WITH_NULL_GUARD": "false",
          "S6_METHOD_THROWS_EXCEPTION": "false",
          "S7_OBJECT_USED_IN_ASSIGNMENT": "false",
          "S8_PRIMITIVE_USED_IN_ASSIGNMENT": "false",
          "S9_METHOD_CALL_WITH_NORMAL_GUARD": "false",
          "ast_info": {
            "dst": "next.nodeName()",
            "dst_parent": "next.nodeName().equals(\"html\")",
            "dst_parent_type": "Invocation",
            "dst_type": "Invocation",
            "operator": "UPD",
            "src": "next.normalName()",
            "src_parent": "next.normalName().equals(\"html\")",
            "src_parent_type": "Invocation",
            "src_type": "Invocation"
          }
        },
        {
          "FEATURES_METHOD_INVOCATION": {},
          "FEATURES_TYPEACCESS": {},
          "FEATURES_VARS": {},
          "S10_METHOD_CALL_WITH_NULL_GUARD": "false",
          "S11_FAULTY_CLASS_EXCEPTION_TYPE": "false",
          "S12_METHOD_CALL_WITH_TRY_CATCH": "false",
          "S13_TYPE_OF_FAULTY_STATEMENT_AFTER_1": "",
          "S13_TYPE_OF_FAULTY_STATEMENT_AFTER_2": "",
          "S13_TYPE_OF_FAULTY_STATEMENT_AFTER_3": "",
          "S13_TYPE_OF_FAULTY_STATEMENT_BEFORE_1": "",
          "S13_TYPE_OF_FAULTY_STATEMENT_BEFORE_2": "",
          "S13_TYPE_OF_FAULTY_STATEMENT_BEFORE_3": "",
          "S14_TYPE_OF_FAULTY_STATEMENT_PARENT": "Method",
          "S15_HAS_OBJECTIVE_METHOD_CALL": "false",
          "S16_HAS_Invocations_Prone_Exception": "false",
          "S18_In_Synchronized_Method": "false",
          "S1_LOCAL_VAR_NOT_ASSIGNED": "false",
          "S1_LOCAL_VAR_NOT_USED": "false",
          "S2_SIMILAR_OBJECT_TYPE_WITH_NORMAL_GUARD": "false",
          "S2_SIMILAR_OBJECT_TYPE_WITH_NULL_GUARD": "false",
          "S3_TYPE_OF_FAULTY_STATEMENT": "While",
          "S4_Field_NOT_ASSIGNED": "false",
          "S4_Field_NOT_USED": "false",
          "S5_SIMILAR_PRIMITIVE_TYPE_WITH_NORMAL_GUARD": "false",
          "S5_SIMILAR_PRIMITIVE_TYPE_WITH_NULL_GUARD": "false",
          "S6_METHOD_THROWS_EXCEPTION": "false",
          "S7_OBJECT_USED_IN_ASSIGNMENT": "false",
          "S8_PRIMITIVE_USED_IN_ASSIGNMENT": "false",
          "S9_METHOD_CALL_WITH_NORMAL_GUARD": "false",
          "ast_info": {
            "dst": "currentElement().nodeName()",
            "dst_parent": "currentElement().nodeName().equals(excludeTag)",
            "dst_parent_type": "Invocation",
            "dst_type": "Invocation",
            "operator": "UPD",
            "src": "currentElement().normalName()",
            "src_parent": "currentElement().normalName().equals(excludeTag)",
            "src_parent_type": "Invocation",
            "src_type": "Invocation"
          }
        },
        {
          "FEATURES_METHOD_INVOCATION": {},
          "FEATURES_TYPEACCESS": {},
          "FEATURES_VARS": {},
          "S10_METHOD_CALL_WITH_NULL_GUARD": "false",
          "S11_FAULTY_CLASS_EXCEPTION_TYPE": "false",
          "S12_METHOD_CALL_WITH_TRY_CATCH": "false",
          "S13_TYPE_OF_FAULTY_STATEMENT_AFTER_1": "",
          "S13_TYPE_OF_FAULTY_STATEMENT_AFTER_2": "",
          "S13_TYPE_OF_FAULTY_STATEMENT_AFTER_3": "",
          "S13_TYPE_OF_FAULTY_STATEMENT_BEFORE_1": "",
          "S13_TYPE_OF_FAULTY_STATEMENT_BEFORE_2": "",
          "S13_TYPE_OF_FAULTY_STATEMENT_BEFORE_3": "",
          "S14_TYPE_OF_FAULTY_STATEMENT_PARENT": "If",
          "S15_HAS_OBJECTIVE_METHOD_CALL": "false",
          "S16_HAS_Invocations_Prone_Exception": "false",
          "S18_In_Synchronized_Method": "false",
          "S1_LOCAL_VAR_NOT_ASSIGNED": "false",
          "S1_LOCAL_VAR_NOT_USED": "false",
          "S2_SIMILAR_OBJECT_TYPE_WITH_NORMAL_GUARD": "false",
          "S2_SIMILAR_OBJECT_TYPE_WITH_NULL_GUARD": "false",
          "S3_TYPE_OF_FAULTY_STATEMENT": "If",
          "S4_Field_NOT_ASSIGNED": "false",
          "S4_Field_NOT_USED": "false",
          "S5_SIMILAR_PRIMITIVE_TYPE_WITH_NORMAL_GUARD": "false",
          "S5_SIMILAR_PRIMITIVE_TYPE_WITH_NULL_GUARD": "false",
          "S6_METHOD_THROWS_EXCEPTION": "false",
          "S7_OBJECT_USED_IN_ASSIGNMENT": "false",
          "S8_PRIMITIVE_USED_IN_ASSIGNMENT": "false",
          "S9_METHOD_CALL_WITH_NORMAL_GUARD": "false",
          "ast_info": {
            "dst": "next.nodeName()",
            "dst_parent": "next.nodeName().equals(nodeName)",
            "dst_parent_type": "Invocation",
            "dst_type": "Invocation",
            "operator": "UPD",
            "src": "next.normalName()",
            "src_parent": "next.normalName().equals(nodeName)",
            "src_parent_type": "Invocation",
            "src_type": "Invocation"
          }
        }
      ],
      "file_name": "HtmlTreeBuilder"
    },
    {
      "features": [
        {
          "FEATURES_METHOD_INVOCATION": {},
          "FEATURES_TYPEACCESS": {},
          "FEATURES_VARS": {},
          "S10_METHOD_CALL_WITH_NULL_GUARD": "false",
          "S11_FAULTY_CLASS_EXCEPTION_TYPE": "false",
          "S12_METHOD_CALL_WITH_TRY_CATCH": "false",
          "S13_TYPE_OF_FAULTY_STATEMENT_AFTER_1": "",
          "S13_TYPE_OF_FAULTY_STATEMENT_AFTER_2": "",
          "S13_TYPE_OF_FAULTY_STATEMENT_AFTER_3": "",
          "S13_TYPE_OF_FAULTY_STATEMENT_BEFORE_1": "",
          "S13_TYPE_OF_FAULTY_STATEMENT_BEFORE_2": "",
          "S13_TYPE_OF_FAULTY_STATEMENT_BEFORE_3": "",
          "S14_TYPE_OF_FAULTY_STATEMENT_PARENT": "Class",
          "S15_HAS_OBJECTIVE_METHOD_CALL": "true",
          "S16_HAS_Invocations_Prone_Exception": "false",
          "S18_In_Synchronized_Method": "false",
          "S1_LOCAL_VAR_NOT_ASSIGNED": "false",
          "S1_LOCAL_VAR_NOT_USED": "false",
          "S2_SIMILAR_OBJECT_TYPE_WITH_NORMAL_GUARD": "false",
          "S2_SIMILAR_OBJECT_TYPE_WITH_NULL_GUARD": "false",
          "S3_TYPE_OF_FAULTY_STATEMENT": "Method",
          "S4_Field_NOT_ASSIGNED": "false",
          "S4_Field_NOT_USED": "false",
          "S5_SIMILAR_PRIMITIVE_TYPE_WITH_NORMAL_GUARD": "false",
          "S5_SIMILAR_PRIMITIVE_TYPE_WITH_NULL_GUARD": "false",
          "S7_OBJECT_USED_IN_ASSIGNMENT": "false",
          "S8_PRIMITIVE_USED_IN_ASSIGNMENT": "false",
          "S9_METHOD_CALL_WITH_NORMAL_GUARD": "false",
          "ast_info": {
            "dst": "null",
            "dst_parent": "null",
            "dst_parent_type": "null",
            "dst_type": "null",
            "operator": "DEL",
            "src": "public java.lang.String normalName() {\n    return tag.normalName();\n}",
            "src_parent": "public class Element extends org.jsoup.nodes.Node {\n    private static final java.util.List<org.jsoup.nodes.Node> EMPTY_NODES = java.util.Collections.emptyList();\n\n    private static final java.util.regex.Pattern classSplit = java.util.regex.Pattern.compile(\"\\\\s+\");\n\n    private org.jsoup.parser.Tag tag;\n\n    private java.lang.ref.WeakReference<java.util.List<org.jsoup.nodes.Element>> shadowChildrenRef;\n\n    java.util.List<org.jsoup.nodes.Node> childNodes;\n\n    private org.jsoup.nodes.Attributes attributes;\n\n    private java.lang.String baseUri;\n\n    public Element(java.lang.String tag) {\n        this(org.jsoup.parser.Tag.valueOf(tag), \"\", new org.jsoup.nodes.Attributes());\n    }\n\n    public Element(org.jsoup.parser.Tag tag, java.lang.String baseUri, org.jsoup.nodes.Attributes attributes) {\n        org.jsoup.helper.Validate.notNull(tag);\n        org.jsoup.helper.Validate.notNull(baseUri);\n        childNodes = org.jsoup.nodes.Element.EMPTY_NODES;\n        this.baseUri = baseUri;\n        this.attributes = attributes;\n        this.tag = tag;\n    }\n\n    public Element(org.jsoup.parser.Tag tag, java.lang.String baseUri) {\n        this(tag, baseUri, null);\n    }\n\n    protected java.util.List<org.jsoup.nodes.Node> ensureChildNodes() {\n        if (childNodes == org.jsoup.nodes.Element.EMPTY_NODES) {\n            childNodes = new org.jsoup.nodes.Element.NodeList(this, 4);\n        }\n        return childNodes;\n    }\n\n    @java.lang.Override\n    protected boolean hasAttributes() {\n        return attributes != null;\n    }\n\n    @java.lang.Override\n    public org.jsoup.nodes.Attributes attributes() {\n        if (!hasAttributes()) {\n            attributes = new org.jsoup.nodes.Attributes();\n        }\n        return attributes;\n    }\n\n    @java.lang.Override\n    public java.lang.String baseUri() {\n        return baseUri;\n    }\n\n    @java.lang.Override\n    protected void doSetBaseUri(java.lang.String baseUri) {\n        this.baseUri = baseUri;\n    }\n\n    @java.lang.Override\n    public int childNodeSize() {\n        return childNodes.size();\n    }\n\n    @java.lang.Override\n    public java.lang.String nodeName() {\n        return tag.getName();\n    }\n\n    public java.lang.String tagName() {\n        return tag.getName();\n    }\n\n    public java.lang.String normalName() {\n        return tag.normalName();\n    }\n\n    public org.jsoup.nodes.Element tagName(java.lang.String tagName) {\n        org.jsoup.helper.Validate.notEmpty(tagName, \"Tag name must not be empty.\");\n        tag = org.jsoup.parser.Tag.valueOf(tagName, org.jsoup.nodes.NodeUtils.parser(this).settings());\n        return this;\n    }\n\n    public org.jsoup.parser.Tag tag() {\n        return tag;\n    }\n\n    public boolean isBlock() {\n        return tag.isBlock();\n    }\n\n    public java.lang.String id() {\n        return attributes().getIgnoreCase(\"id\");\n    }\n\n    public org.jsoup.nodes.Element attr(java.lang.String attributeKey, java.lang.String attributeValue) {\n        super.attr(attributeKey, attributeValue);\n        return this;\n    }\n\n    public org.jsoup.nodes.Element attr(java.lang.String attributeKey, boolean attributeValue) {\n        attributes().put(attributeKey, attributeValue);\n        return this;\n    }\n\n    public java.util.Map<java.lang.String, java.lang.String> dataset() {\n        return attributes().dataset();\n    }\n\n    @java.lang.Override\n    public final org.jsoup.nodes.Element parent() {\n        return ((org.jsoup.nodes.Element) (parentNode));\n    }\n\n    public org.jsoup.select.Elements parents() {\n        org.jsoup.select.Elements parents = new org.jsoup.select.Elements();\n        org.jsoup.nodes.Element.accumulateParents(this, parents);\n        return parents;\n    }\n\n    private static void accumulateParents(org.jsoup.nodes.Element el, org.jsoup.select.Elements parents) {\n        org.jsoup.nodes.Element parent = el.parent();\n        if ((parent != null) && (!parent.tagName().equals(\"#root\"))) {\n            parents.add(parent);\n            org.jsoup.nodes.Element.accumulateParents(parent, parents);\n        }\n    }\n\n    public org.jsoup.nodes.Element child(int index) {\n        return childElementsList().get(index);\n    }\n\n    public org.jsoup.select.Elements children() {\n        return new org.jsoup.select.Elements(childElementsList());\n    }\n\n    private java.util.List<org.jsoup.nodes.Element> childElementsList() {\n        java.util.List<org.jsoup.nodes.Element> children;\n        if ((shadowChildrenRef == null) || ((children = shadowChildrenRef.get()) == null)) {\n            final int size = childNodes.size();\n            children = new java.util.ArrayList<>(size);\n            for (int i = 0; i < size; i++) {\n                final org.jsoup.nodes.Node node = childNodes.get(i);\n                if (node instanceof org.jsoup.nodes.Element) {\n                    children.add(((org.jsoup.nodes.Element) (node)));\n                }\n            }\n            shadowChildrenRef = new java.lang.ref.WeakReference<>(children);\n        }\n        return children;\n    }\n\n    @java.lang.Override\n    void nodelistChanged() {\n        super.nodelistChanged();\n        shadowChildrenRef = null;\n    }\n\n    public java.util.List<org.jsoup.nodes.TextNode> textNodes() {\n        java.util.List<org.jsoup.nodes.TextNode> textNodes = new java.util.ArrayList<>();\n        for (org.jsoup.nodes.Node node : childNodes) {\n            if (node instanceof org.jsoup.nodes.TextNode) {\n                textNodes.add(((org.jsoup.nodes.TextNode) (node)));\n            }\n        }\n        return java.util.Collections.unmodifiableList(textNodes);\n    }\n\n    public java.util.List<org.jsoup.nodes.DataNode> dataNodes() {\n        java.util.List<org.jsoup.nodes.DataNode> dataNodes = new java.util.ArrayList<>();\n        for (org.jsoup.nodes.Node node : childNodes) {\n            if (node instanceof org.jsoup.nodes.DataNode) {\n                dataNodes.add(((org.jsoup.nodes.DataNode) (node)));\n            }\n        }\n        return java.util.Collections.unmodifiableList(dataNodes);\n    }\n\n    public org.jsoup.select.Elements select(java.lang.String cssQuery) {\n        return org.jsoup.select.Selector.select(cssQuery, this);\n    }\n\n    public org.jsoup.nodes.Element selectFirst(java.lang.String cssQuery) {\n        return org.jsoup.select.Selector.selectFirst(cssQuery, this);\n    }\n\n    public boolean is(java.lang.String cssQuery) {\n        return is(org.jsoup.select.QueryParser.parse(cssQuery));\n    }\n\n    public boolean is(org.jsoup.select.Evaluator evaluator) {\n        return evaluator.matches(((org.jsoup.nodes.Element) (this.root())), this);\n    }\n\n    public org.jsoup.nodes.Element appendChild(org.jsoup.nodes.Node child) {\n        org.jsoup.helper.Validate.notNull(child);\n        reparentChild(child);\n        ensureChildNodes();\n        childNodes.add(child);\n        child.setSiblingIndex(childNodes.size() - 1);\n        return this;\n    }\n\n    public org.jsoup.nodes.Element appendTo(org.jsoup.nodes.Element parent) {\n        org.jsoup.helper.Validate.notNull(parent);\n        parent.appendChild(this);\n        return this;\n    }\n\n    public org.jsoup.nodes.Element prependChild(org.jsoup.nodes.Node child) {\n        org.jsoup.helper.Validate.notNull(child);\n        addChildren(0, child);\n        return this;\n    }\n\n    public org.jsoup.nodes.Element insertChildren(int index, java.util.Collection<? extends org.jsoup.nodes.Node> children) {\n        org.jsoup.helper.Validate.notNull(children, \"Children collection to be inserted must not be null.\");\n        int currentSize = childNodeSize();\n        if (index < 0) {\n            index += currentSize + 1;\n        }\n        org.jsoup.helper.Validate.isTrue((index >= 0) && (index <= currentSize), \"Insert position out of bounds.\");\n        java.util.ArrayList<org.jsoup.nodes.Node> nodes = new java.util.ArrayList(children);\n        org.jsoup.nodes.Node[] nodeArray = nodes.toArray(new org.jsoup.nodes.Node[nodes.size()]);\n        addChildren(index, nodeArray);\n        return this;\n    }\n\n    public org.jsoup.nodes.Element insertChildren(int index, org.jsoup.nodes.Node... children) {\n        org.jsoup.helper.Validate.notNull(children, \"Children collection to be inserted must not be null.\");\n        int currentSize = childNodeSize();\n        if (index < 0) {\n            index += currentSize + 1;\n        }\n        org.jsoup.helper.Validate.isTrue((index >= 0) && (index <= currentSize), \"Insert position out of bounds.\");\n        addChildren(index, children);\n        return this;\n    }\n\n    public org.jsoup.nodes.Element appendElement(java.lang.String tagName) {\n        org.jsoup.nodes.Element child = new org.jsoup.nodes.Element(org.jsoup.parser.Tag.valueOf(tagName, org.jsoup.nodes.NodeUtils.parser(this).settings()), baseUri());\n        appendChild(child);\n        return child;\n    }\n\n    public org.jsoup.nodes.Element prependElement(java.lang.String tagName) {\n        org.jsoup.nodes.Element child = new org.jsoup.nodes.Element(org.jsoup.parser.Tag.valueOf(tagName, org.jsoup.nodes.NodeUtils.parser(this).settings()), baseUri());\n        prependChild(child);\n        return child;\n    }\n\n    public org.jsoup.nodes.Element appendText(java.lang.String text) {\n        org.jsoup.helper.Validate.notNull(text);\n        org.jsoup.nodes.TextNode node = new org.jsoup.nodes.TextNode(text);\n        appendChild(node);\n        return this;\n    }\n\n    public org.jsoup.nodes.Element prependText(java.lang.String text) {\n        org.jsoup.helper.Validate.notNull(text);\n        org.jsoup.nodes.TextNode node = new org.jsoup.nodes.TextNode(text);\n        prependChild(node);\n        return this;\n    }\n\n    public org.jsoup.nodes.Element append(java.lang.String html) {\n        org.jsoup.helper.Validate.notNull(html);\n        java.util.List<org.jsoup.nodes.Node> nodes = org.jsoup.nodes.NodeUtils.parser(this).parseFragmentInput(html, this, baseUri());\n        addChildren(nodes.toArray(new org.jsoup.nodes.Node[nodes.size()]));\n        return this;\n    }\n\n    public org.jsoup.nodes.Element prepend(java.lang.String html) {\n        org.jsoup.helper.Validate.notNull(html);\n        java.util.List<org.jsoup.nodes.Node> nodes = org.jsoup.nodes.NodeUtils.parser(this).parseFragmentInput(html, this, baseUri());\n        addChildren(0, nodes.toArray(new org.jsoup.nodes.Node[nodes.size()]));\n        return this;\n    }\n\n    @java.lang.Override\n    public org.jsoup.nodes.Element before(java.lang.String html) {\n        return ((org.jsoup.nodes.Element) (super.before(html)));\n    }\n\n    @java.lang.Override\n    public org.jsoup.nodes.Element before(org.jsoup.nodes.Node node) {\n        return ((org.jsoup.nodes.Element) (super.before(node)));\n    }\n\n    @java.lang.Override\n    public org.jsoup.nodes.Element after(java.lang.String html) {\n        return ((org.jsoup.nodes.Element) (super.after(html)));\n    }\n\n    @java.lang.Override\n    public org.jsoup.nodes.Element after(org.jsoup.nodes.Node node) {\n        return ((org.jsoup.nodes.Element) (super.after(node)));\n    }\n\n    public org.jsoup.nodes.Element empty() {\n        childNodes.clear();\n        return this;\n    }\n\n    @java.lang.Override\n    public org.jsoup.nodes.Element wrap(java.lang.String html) {\n        return ((org.jsoup.nodes.Element) (super.wrap(html)));\n    }\n\n    public java.lang.String cssSelector() {\n        if (id().length() > 0) {\n            return \"#\" + id();\n        }\n        java.lang.String tagName = tagName().replace(':', '|');\n        java.lang.StringBuilder selector = new java.lang.StringBuilder(tagName);\n        java.lang.String classes = org.jsoup.internal.StringUtil.join(classNames(), \".\");\n        if (classes.length() > 0) {\n            selector.append('.').append(classes);\n        }\n        if ((parent() == null) || (parent() instanceof org.jsoup.nodes.Document)) {\n            return selector.toString();\n        }\n        selector.insert(0, \" > \");\n        if (parent().select(selector.toString()).size() > 1) {\n            selector.append(java.lang.String.format(\":nth-child(%d)\", elementSiblingIndex() + 1));\n        }\n        return parent().cssSelector() + selector.toString();\n    }\n\n    public org.jsoup.select.Elements siblingElements() {\n        if (parentNode == null) {\n            return new org.jsoup.select.Elements(0);\n        }\n        java.util.List<org.jsoup.nodes.Element> elements = parent().childElementsList();\n        org.jsoup.select.Elements siblings = new org.jsoup.select.Elements(elements.size() - 1);\n        for (org.jsoup.nodes.Element el : elements) {\n            if (el != this) {\n                siblings.add(el);\n            }\n        }\n        return siblings;\n    }\n\n    public org.jsoup.nodes.Element nextElementSibling() {\n        if (parentNode == null) {\n            return null;\n        }\n        java.util.List<org.jsoup.nodes.Element> siblings = parent().childElementsList();\n        java.lang.Integer index = org.jsoup.nodes.Element.indexInList(this, siblings);\n        org.jsoup.helper.Validate.notNull(index);\n        if (siblings.size() > (index + 1)) {\n            return siblings.get(index + 1);\n        } else {\n            return null;\n        }\n    }\n\n    public org.jsoup.select.Elements nextElementSiblings() {\n        return nextElementSiblings(true);\n    }\n\n    public org.jsoup.nodes.Element previousElementSibling() {\n        if (parentNode == null) {\n            return null;\n        }\n        java.util.List<org.jsoup.nodes.Element> siblings = parent().childElementsList();\n        java.lang.Integer index = org.jsoup.nodes.Element.indexInList(this, siblings);\n        org.jsoup.helper.Validate.notNull(index);\n        if (index > 0) {\n            return siblings.get(index - 1);\n        } else {\n            return null;\n        }\n    }\n\n    public org.jsoup.select.Elements previousElementSiblings() {\n        return nextElementSiblings(false);\n    }\n\n    private org.jsoup.select.Elements nextElementSiblings(boolean next) {\n        org.jsoup.select.Elements els = new org.jsoup.select.Elements();\n        if (parentNode == null) {\n            return els;\n        }\n        els.add(this);\n        return next ? els.nextAll() : els.prevAll();\n    }\n\n    public org.jsoup.nodes.Element firstElementSibling() {\n        java.util.List<org.jsoup.nodes.Element> siblings = parent().childElementsList();\n        return siblings.size() > 1 ? siblings.get(0) : null;\n    }\n\n    public int elementSiblingIndex() {\n        if (parent() == null) {\n            return 0;\n        }\n        return org.jsoup.nodes.Element.indexInList(this, parent().childElementsList());\n    }\n\n    public org.jsoup.nodes.Element lastElementSibling() {\n        java.util.List<org.jsoup.nodes.Element> siblings = parent().childElementsList();\n        return siblings.size() > 1 ? siblings.get(siblings.size() - 1) : null;\n    }\n\n    private static <E extends org.jsoup.nodes.Element> int indexInList(org.jsoup.nodes.Element search, java.util.List<E> elements) {\n        final int size = elements.size();\n        for (int i = 0; i < size; i++) {\n            if (elements.get(i) == search) {\n                return i;\n            }\n        }\n        return 0;\n    }\n\n    public org.jsoup.select.Elements getElementsByTag(java.lang.String tagName) {\n        org.jsoup.helper.Validate.notEmpty(tagName);\n        tagName = normalize(tagName);\n        return org.jsoup.select.Collector.collect(new org.jsoup.select.Evaluator.Tag(tagName), this);\n    }\n\n    public org.jsoup.nodes.Element getElementById(java.lang.String id) {\n        org.jsoup.helper.Validate.notEmpty(id);\n        org.jsoup.select.Elements elements = org.jsoup.select.Collector.collect(new org.jsoup.select.Evaluator.Id(id), this);\n        if (elements.size() > 0) {\n            return elements.get(0);\n        } else {\n            return null;\n        }\n    }\n\n    public org.jsoup.select.Elements getElementsByClass(java.lang.String className) {\n        org.jsoup.helper.Validate.notEmpty(className);\n        return org.jsoup.select.Collector.collect(new org.jsoup.select.Evaluator.Class(className), this);\n    }\n\n    public org.jsoup.select.Elements getElementsByAttribute(java.lang.String key) {\n        org.jsoup.helper.Validate.notEmpty(key);\n        key = key.trim();\n        return org.jsoup.select.Collector.collect(new org.jsoup.select.Evaluator.Attribute(key), this);\n    }\n\n    public org.jsoup.select.Elements getElementsByAttributeStarting(java.lang.String keyPrefix) {\n        org.jsoup.helper.Validate.notEmpty(keyPrefix);\n        keyPrefix = keyPrefix.trim();\n        return org.jsoup.select.Collector.collect(new org.jsoup.select.Evaluator.AttributeStarting(keyPrefix), this);\n    }\n\n    public org.jsoup.select.Elements getElementsByAttributeValue(java.lang.String key, java.lang.String value) {\n        return org.jsoup.select.Collector.collect(new org.jsoup.select.Evaluator.AttributeWithValue(key, value), this);\n    }\n\n    public org.jsoup.select.Elements getElementsByAttributeValueNot(java.lang.String key, java.lang.String value) {\n        return org.jsoup.select.Collector.collect(new org.jsoup.select.Evaluator.AttributeWithValueNot(key, value), this);\n    }\n\n    public org.jsoup.select.Elements getElementsByAttributeValueStarting(java.lang.String key, java.lang.String valuePrefix) {\n        return org.jsoup.select.Collector.collect(new org.jsoup.select.Evaluator.AttributeWithValueStarting(key, valuePrefix), this);\n    }\n\n    public org.jsoup.select.Elements getElementsByAttributeValueEnding(java.lang.String key, java.lang.String valueSuffix) {\n        return org.jsoup.select.Collector.collect(new org.jsoup.select.Evaluator.AttributeWithValueEnding(key, valueSuffix), this);\n    }\n\n    public org.jsoup.select.Elements getElementsByAttributeValueContaining(java.lang.String key, java.lang.String match) {\n        return org.jsoup.select.Collector.collect(new org.jsoup.select.Evaluator.AttributeWithValueContaining(key, match), this);\n    }\n\n    public org.jsoup.select.Elements getElementsByAttributeValueMatching(java.lang.String key, java.util.regex.Pattern pattern) {\n        return org.jsoup.select.Collector.collect(new org.jsoup.select.Evaluator.AttributeWithValueMatching(key, pattern), this);\n    }\n\n    public org.jsoup.select.Elements getElementsByAttributeValueMatching(java.lang.String key, java.lang.String regex) {\n        java.util.regex.Pattern pattern;\n        try {\n            pattern = java.util.regex.Pattern.compile(regex);\n        } catch (java.util.regex.PatternSyntaxException e) {\n            throw new java.lang.IllegalArgumentException(\"Pattern syntax error: \" + regex, e);\n        }\n        return getElementsByAttributeValueMatching(key, pattern);\n    }\n\n    public org.jsoup.select.Elements getElementsByIndexLessThan(int index) {\n        return org.jsoup.select.Collector.collect(new org.jsoup.select.Evaluator.IndexLessThan(index), this);\n    }\n\n    public org.jsoup.select.Elements getElementsByIndexGreaterThan(int index) {\n        return org.jsoup.select.Collector.collect(new org.jsoup.select.Evaluator.IndexGreaterThan(index), this);\n    }\n\n    public org.jsoup.select.Elements getElementsByIndexEquals(int index) {\n        return org.jsoup.select.Collector.collect(new org.jsoup.select.Evaluator.IndexEquals(index), this);\n    }\n\n    public org.jsoup.select.Elements getElementsContainingText(java.lang.String searchText) {\n        return org.jsoup.select.Collector.collect(new org.jsoup.select.Evaluator.ContainsText(searchText), this);\n    }\n\n    public org.jsoup.select.Elements getElementsContainingOwnText(java.lang.String searchText) {\n        return org.jsoup.select.Collector.collect(new org.jsoup.select.Evaluator.ContainsOwnText(searchText), this);\n    }\n\n    public org.jsoup.select.Elements getElementsMatchingText(java.util.regex.Pattern pattern) {\n        return org.jsoup.select.Collector.collect(new org.jsoup.select.Evaluator.Matches(pattern), this);\n    }\n\n    public org.jsoup.select.Elements getElementsMatchingText(java.lang.String regex) {\n        java.util.regex.Pattern pattern;\n        try {\n            pattern = java.util.regex.Pattern.compile(regex);\n        } catch (java.util.regex.PatternSyntaxException e) {\n            throw new java.lang.IllegalArgumentException(\"Pattern syntax error: \" + regex, e);\n        }\n        return getElementsMatchingText(pattern);\n    }\n\n    public org.jsoup.select.Elements getElementsMatchingOwnText(java.util.regex.Pattern pattern) {\n        return org.jsoup.select.Collector.collect(new org.jsoup.select.Evaluator.MatchesOwn(pattern), this);\n    }\n\n    public org.jsoup.select.Elements getElementsMatchingOwnText(java.lang.String regex) {\n        java.util.regex.Pattern pattern;\n        try {\n            pattern = java.util.regex.Pattern.compile(regex);\n        } catch (java.util.regex.PatternSyntaxException e) {\n            throw new java.lang.IllegalArgumentException(\"Pattern syntax error: \" + regex, e);\n        }\n        return getElementsMatchingOwnText(pattern);\n    }\n\n    public org.jsoup.select.Elements getAllElements() {\n        return org.jsoup.select.Collector.collect(new org.jsoup.select.Evaluator.AllElements(), this);\n    }\n\n    public java.lang.String text() {\n        final java.lang.StringBuilder accum = org.jsoup.internal.StringUtil.borrowBuilder();\n        org.jsoup.select.NodeTraversor.traverse(new org.jsoup.select.NodeVisitor() {\n            public void head(org.jsoup.nodes.Node node, int depth) {\n                if (node instanceof org.jsoup.nodes.TextNode) {\n                    org.jsoup.nodes.TextNode textNode = ((org.jsoup.nodes.TextNode) (node));\n                    org.jsoup.nodes.Element.appendNormalisedText(accum, textNode);\n                } else if (node instanceof org.jsoup.nodes.Element) {\n                    org.jsoup.nodes.Element element = ((org.jsoup.nodes.Element) (node));\n                    if (((accum.length() > 0) && (element.isBlock() || element.tag.getName().equals(\"br\"))) && (!org.jsoup.nodes.TextNode.lastCharIsWhitespace(accum))) {\n                        accum.append(' ');\n                    }\n                }\n            }\n\n            public void tail(org.jsoup.nodes.Node node, int depth) {\n                if (node instanceof org.jsoup.nodes.Element) {\n                    org.jsoup.nodes.Element element = ((org.jsoup.nodes.Element) (node));\n                    if ((element.isBlock() && (node.nextSibling() instanceof org.jsoup.nodes.TextNode)) && (!org.jsoup.nodes.TextNode.lastCharIsWhitespace(accum))) {\n                        accum.append(' ');\n                    }\n                }\n            }\n        }, this);\n        return org.jsoup.internal.StringUtil.releaseBuilder(accum).trim();\n    }\n\n    public java.lang.String wholeText() {\n        final java.lang.StringBuilder accum = org.jsoup.internal.StringUtil.borrowBuilder();\n        org.jsoup.select.NodeTraversor.traverse(new org.jsoup.select.NodeVisitor() {\n            public void head(org.jsoup.nodes.Node node, int depth) {\n                if (node instanceof org.jsoup.nodes.TextNode) {\n                    org.jsoup.nodes.TextNode textNode = ((org.jsoup.nodes.TextNode) (node));\n                    accum.append(textNode.getWholeText());\n                }\n            }\n\n            public void tail(org.jsoup.nodes.Node node, int depth) {\n            }\n        }, this);\n        return org.jsoup.internal.StringUtil.releaseBuilder(accum);\n    }\n\n    public java.lang.String ownText() {\n        java.lang.StringBuilder sb = org.jsoup.internal.StringUtil.borrowBuilder();\n        ownText(sb);\n        return org.jsoup.internal.StringUtil.releaseBuilder(sb).trim();\n    }\n\n    private void ownText(java.lang.StringBuilder accum) {\n        for (org.jsoup.nodes.Node child : childNodes) {\n            if (child instanceof org.jsoup.nodes.TextNode) {\n                org.jsoup.nodes.TextNode textNode = ((org.jsoup.nodes.TextNode) (child));\n                org.jsoup.nodes.Element.appendNormalisedText(accum, textNode);\n            } else if (child instanceof org.jsoup.nodes.Element) {\n                org.jsoup.nodes.Element.appendWhitespaceIfBr(((org.jsoup.nodes.Element) (child)), accum);\n            }\n        }\n    }\n\n    private static void appendNormalisedText(java.lang.StringBuilder accum, org.jsoup.nodes.TextNode textNode) {\n        java.lang.String text = textNode.getWholeText();\n        if (org.jsoup.nodes.Element.preserveWhitespace(textNode.parentNode) || (textNode instanceof org.jsoup.nodes.CDataNode)) {\n            accum.append(text);\n        } else {\n            org.jsoup.internal.StringUtil.appendNormalisedWhitespace(accum, text, org.jsoup.nodes.TextNode.lastCharIsWhitespace(accum));\n        }\n    }\n\n    private static void appendWhitespaceIfBr(org.jsoup.nodes.Element element, java.lang.StringBuilder accum) {\n        if (element.tag.getName().equals(\"br\") && (!org.jsoup.nodes.TextNode.lastCharIsWhitespace(accum))) {\n            accum.append(\" \");\n        }\n    }\n\n    static boolean preserveWhitespace(org.jsoup.nodes.Node node) {\n        if (node instanceof org.jsoup.nodes.Element) {\n            org.jsoup.nodes.Element el = ((org.jsoup.nodes.Element) (node));\n            int i = 0;\n            do {\n                if (el.tag.preserveWhitespace()) {\n                    return true;\n                }\n                el = el.parent();\n                i++;\n            } while ((i < 6) && (el != null) );\n        }\n        return false;\n    }\n\n    public org.jsoup.nodes.Element text(java.lang.String text) {\n        org.jsoup.helper.Validate.notNull(text);\n        empty();\n        org.jsoup.nodes.TextNode textNode = new org.jsoup.nodes.TextNode(text);\n        appendChild(textNode);\n        return this;\n    }\n\n    public boolean hasText() {\n        for (org.jsoup.nodes.Node child : childNodes) {\n            if (child instanceof org.jsoup.nodes.TextNode) {\n                org.jsoup.nodes.TextNode textNode = ((org.jsoup.nodes.TextNode) (child));\n                if (!textNode.isBlank()) {\n                    return true;\n                }\n            } else if (child instanceof org.jsoup.nodes.Element) {\n                org.jsoup.nodes.Element el = ((org.jsoup.nodes.Element) (child));\n                if (el.hasText()) {\n                    return true;\n                }\n            }\n        }\n        return false;\n    }\n\n    public java.lang.String data() {\n        java.lang.StringBuilder sb = org.jsoup.internal.StringUtil.borrowBuilder();\n        for (org.jsoup.nodes.Node childNode : childNodes) {\n            if (childNode instanceof org.jsoup.nodes.DataNode) {\n                org.jsoup.nodes.DataNode data = ((org.jsoup.nodes.DataNode) (childNode));\n                sb.append(data.getWholeData());\n            } else if (childNode instanceof org.jsoup.nodes.Comment) {\n                org.jsoup.nodes.Comment comment = ((org.jsoup.nodes.Comment) (childNode));\n                sb.append(comment.getData());\n            } else if (childNode instanceof org.jsoup.nodes.Element) {\n                org.jsoup.nodes.Element element = ((org.jsoup.nodes.Element) (childNode));\n                java.lang.String elementData = element.data();\n                sb.append(elementData);\n            } else if (childNode instanceof org.jsoup.nodes.CDataNode) {\n                org.jsoup.nodes.CDataNode cDataNode = ((org.jsoup.nodes.CDataNode) (childNode));\n                sb.append(cDataNode.getWholeText());\n            }\n        }\n        return org.jsoup.internal.StringUtil.releaseBuilder(sb);\n    }\n\n    public java.lang.String className() {\n        return attr(\"class\").trim();\n    }\n\n    public java.util.Set<java.lang.String> classNames() {\n        java.lang.String[] names = org.jsoup.nodes.Element.classSplit.split(className());\n        java.util.Set<java.lang.String> classNames = new java.util.LinkedHashSet<>(java.util.Arrays.asList(names));\n        classNames.remove(\"\");\n        return classNames;\n    }\n\n    public org.jsoup.nodes.Element classNames(java.util.Set<java.lang.String> classNames) {\n        org.jsoup.helper.Validate.notNull(classNames);\n        if (classNames.isEmpty()) {\n            attributes().remove(\"class\");\n        } else {\n            attributes().put(\"class\", org.jsoup.internal.StringUtil.join(classNames, \" \"));\n        }\n        return this;\n    }\n\n    public boolean hasClass(java.lang.String className) {\n        final java.lang.String classAttr = attributes().getIgnoreCase(\"class\");\n        final int len = classAttr.length();\n        final int wantLen = className.length();\n        if ((len == 0) || (len < wantLen)) {\n            return false;\n        }\n        if (len == wantLen) {\n            return className.equalsIgnoreCase(classAttr);\n        }\n        boolean inClass = false;\n        int start = 0;\n        for (int i = 0; i < len; i++) {\n            if (java.lang.Character.isWhitespace(classAttr.charAt(i))) {\n                if (inClass) {\n                    if (((i - start) == wantLen) && classAttr.regionMatches(true, start, className, 0, wantLen)) {\n                        return true;\n                    }\n                    inClass = false;\n                }\n            } else if (!inClass) {\n                inClass = true;\n                start = i;\n            }\n        }\n        if (inClass && ((len - start) == wantLen)) {\n            return classAttr.regionMatches(true, start, className, 0, wantLen);\n        }\n        return false;\n    }\n\n    public org.jsoup.nodes.Element addClass(java.lang.String className) {\n        org.jsoup.helper.Validate.notNull(className);\n        java.util.Set<java.lang.String> classes = classNames();\n        classes.add(className);\n        classNames(classes);\n        return this;\n    }\n\n    public org.jsoup.nodes.Element removeClass(java.lang.String className) {\n        org.jsoup.helper.Validate.notNull(className);\n        java.util.Set<java.lang.String> classes = classNames();\n        classes.remove(className);\n        classNames(classes);\n        return this;\n    }\n\n    public org.jsoup.nodes.Element toggleClass(java.lang.String className) {\n        org.jsoup.helper.Validate.notNull(className);\n        java.util.Set<java.lang.String> classes = classNames();\n        if (classes.contains(className)) {\n            classes.remove(className);\n        } else {\n            classes.add(className);\n        }\n        classNames(classes);\n        return this;\n    }\n\n    public java.lang.String val() {\n        if (tagName().equals(\"textarea\")) {\n            return text();\n        } else {\n            return attr(\"value\");\n        }\n    }\n\n    public org.jsoup.nodes.Element val(java.lang.String value) {\n        if (tagName().equals(\"textarea\")) {\n            text(value);\n        } else {\n            attr(\"value\", value);\n        }\n        return this;\n    }\n\n    void outerHtmlHead(final java.lang.Appendable accum, int depth, final org.jsoup.nodes.Document.OutputSettings out) throws java.io.IOException {\n        if (out.prettyPrint() && ((tag.formatAsBlock() || ((parent() != null) && parent().tag().formatAsBlock())) || out.outline())) {\n            if (accum instanceof java.lang.StringBuilder) {\n                if (((java.lang.StringBuilder) (accum)).length() > 0) {\n                    indent(accum, depth, out);\n                }\n            } else {\n                indent(accum, depth, out);\n            }\n        }\n        accum.append('<').append(tagName());\n        if (attributes != null) {\n            attributes.html(accum, out);\n        }\n        if (childNodes.isEmpty() && tag.isSelfClosing()) {\n            if ((out.syntax() == Document.OutputSettings.Syntax.html) && tag.isEmpty()) {\n                accum.append('>');\n            } else {\n                accum.append(\" />\");\n            }\n        } else {\n            accum.append('>');\n        }\n    }\n\n    void outerHtmlTail(java.lang.Appendable accum, int depth, org.jsoup.nodes.Document.OutputSettings out) throws java.io.IOException {\n        if (!(childNodes.isEmpty() && tag.isSelfClosing())) {\n            if (out.prettyPrint() && ((!childNodes.isEmpty()) && (tag.formatAsBlock() || (out.outline() && ((childNodes.size() > 1) || ((childNodes.size() == 1) && (!(childNodes.get(0) instanceof org.jsoup.nodes.TextNode)))))))) {\n                indent(accum, depth, out);\n            }\n            accum.append(\"</\").append(tagName()).append('>');\n        }\n    }\n\n    public java.lang.String html() {\n        java.lang.StringBuilder accum = org.jsoup.internal.StringUtil.borrowBuilder();\n        html(accum);\n        java.lang.String html = org.jsoup.internal.StringUtil.releaseBuilder(accum);\n        return org.jsoup.nodes.NodeUtils.outputSettings(this).prettyPrint() ? html.trim() : html;\n    }\n\n    @java.lang.Override\n    public <T extends java.lang.Appendable> T html(T appendable) {\n        final int size = childNodes.size();\n        for (int i = 0; i < size; i++) {\n            childNodes.get(i).outerHtml(appendable);\n        }\n        return appendable;\n    }\n\n    public org.jsoup.nodes.Element html(java.lang.String html) {\n        empty();\n        append(html);\n        return this;\n    }\n\n    @java.lang.Override\n    public org.jsoup.nodes.Element clone() {\n        return ((org.jsoup.nodes.Element) (super.clone()));\n    }\n\n    @java.lang.Override\n    public org.jsoup.nodes.Element shallowClone() {\n        return new org.jsoup.nodes.Element(tag, baseUri, attributes);\n    }\n\n    @java.lang.Override\n    protected org.jsoup.nodes.Element doClone(org.jsoup.nodes.Node parent) {\n        org.jsoup.nodes.Element clone = ((org.jsoup.nodes.Element) (super.doClone(parent)));\n        clone.attributes = (attributes != null) ? attributes.clone() : null;\n        clone.baseUri = baseUri;\n        clone.childNodes = new org.jsoup.nodes.Element.NodeList(clone, childNodes.size());\n        clone.childNodes.addAll(childNodes);\n        return clone;\n    }\n\n    private static final class NodeList extends org.jsoup.helper.ChangeNotifyingArrayList<org.jsoup.nodes.Node> {\n        private final org.jsoup.nodes.Element owner;\n\n        NodeList(org.jsoup.nodes.Element owner, int initialCapacity) {\n            super(initialCapacity);\n            this.owner = owner;\n        }\n\n        public void onContentsChanged() {\n            owner.nodelistChanged();\n        }\n    }\n}",
            "src_parent_type": "Class",
            "src_type": "Method"
          }
        }
      ],
      "file_name": "Element"
    },
    {
      "features": [
        {
          "FEATURES_METHOD_INVOCATION": {},
          "FEATURES_TYPEACCESS": {},
          "FEATURES_VARS": {},
          "S10_METHOD_CALL_WITH_NULL_GUARD": "false",
          "S11_FAULTY_CLASS_EXCEPTION_TYPE": "false",
          "S12_METHOD_CALL_WITH_TRY_CATCH": "false",
          "S13_TYPE_OF_FAULTY_STATEMENT_AFTER_1": "",
          "S13_TYPE_OF_FAULTY_STATEMENT_AFTER_2": "",
          "S13_TYPE_OF_FAULTY_STATEMENT_AFTER_3": "",
          "S13_TYPE_OF_FAULTY_STATEMENT_BEFORE_1": "",
          "S13_TYPE_OF_FAULTY_STATEMENT_BEFORE_2": "",
          "S13_TYPE_OF_FAULTY_STATEMENT_BEFORE_3": "",
          "S14_TYPE_OF_FAULTY_STATEMENT_PARENT": "Class",
          "S15_HAS_OBJECTIVE_METHOD_CALL": "false",
          "S16_HAS_Invocations_Prone_Exception": "false",
          "S18_In_Synchronized_Method": "false",
          "S1_LOCAL_VAR_NOT_ASSIGNED": "false",
          "S1_LOCAL_VAR_NOT_USED": "false",
          "S2_SIMILAR_OBJECT_TYPE_WITH_NORMAL_GUARD": "false",
          "S2_SIMILAR_OBJECT_TYPE_WITH_NULL_GUARD": "false",
          "S3_TYPE_OF_FAULTY_STATEMENT": "Field",
          "S4_Field_NOT_ASSIGNED": "false",
          "S4_Field_NOT_USED": "false",
          "S5_SIMILAR_PRIMITIVE_TYPE_WITH_NORMAL_GUARD": "false",
          "S5_SIMILAR_PRIMITIVE_TYPE_WITH_NULL_GUARD": "false",
          "S7_OBJECT_USED_IN_ASSIGNMENT": "false",
          "S8_PRIMITIVE_USED_IN_ASSIGNMENT": "false",
          "S9_METHOD_CALL_WITH_NORMAL_GUARD": "false",
          "ast_info": {
            "dst": "null",
            "dst_parent": "null",
            "dst_parent_type": "null",
            "dst_type": "null",
            "operator": "DEL",
            "src": "private java.lang.String normalName;",
            "src_parent": "public class Tag {\n    private static final java.util.Map<java.lang.String, org.jsoup.parser.Tag> tags = new java.util.HashMap<>();\n\n    private java.lang.String tagName;\n\n    private java.lang.String normalName;\n\n    private boolean isBlock = true;\n\n    private boolean formatAsBlock = true;\n\n    private boolean canContainInline = true;\n\n    private boolean empty = false;\n\n    private boolean selfClosing = false;\n\n    private boolean preserveWhitespace = false;\n\n    private boolean formList = false;\n\n    private boolean formSubmit = false;\n\n    private Tag(java.lang.String tagName) {\n        this.tagName = tagName;\n        normalName = org.jsoup.internal.Normalizer.lowerCase(tagName);\n    }\n\n    public java.lang.String getName() {\n        return tagName;\n    }\n\n    public java.lang.String normalName() {\n        return normalName;\n    }\n\n    public static org.jsoup.parser.Tag valueOf(java.lang.String tagName, org.jsoup.parser.ParseSettings settings) {\n        org.jsoup.helper.Validate.notNull(tagName);\n        org.jsoup.parser.Tag tag = org.jsoup.parser.Tag.tags.get(tagName);\n        if (tag == null) {\n            tagName = settings.normalizeTag(tagName);\n            org.jsoup.helper.Validate.notEmpty(tagName);\n            tag = org.jsoup.parser.Tag.tags.get(tagName);\n            if (tag == null) {\n                tag = new org.jsoup.parser.Tag(tagName);\n                tag.isBlock = false;\n            }\n        }\n        return tag;\n    }\n\n    public static org.jsoup.parser.Tag valueOf(java.lang.String tagName) {\n        return org.jsoup.parser.Tag.valueOf(tagName, ParseSettings.preserveCase);\n    }\n\n    public boolean isBlock() {\n        return isBlock;\n    }\n\n    public boolean formatAsBlock() {\n        return formatAsBlock;\n    }\n\n    public boolean canContainBlock() {\n        return isBlock;\n    }\n\n    public boolean isInline() {\n        return !isBlock;\n    }\n\n    public boolean isData() {\n        return (!canContainInline) && (!isEmpty());\n    }\n\n    public boolean isEmpty() {\n        return empty;\n    }\n\n    public boolean isSelfClosing() {\n        return empty || selfClosing;\n    }\n\n    public boolean isKnownTag() {\n        return org.jsoup.parser.Tag.tags.containsKey(tagName);\n    }\n\n    public static boolean isKnownTag(java.lang.String tagName) {\n        return org.jsoup.parser.Tag.tags.containsKey(tagName);\n    }\n\n    public boolean preserveWhitespace() {\n        return preserveWhitespace;\n    }\n\n    public boolean isFormListed() {\n        return formList;\n    }\n\n    public boolean isFormSubmittable() {\n        return formSubmit;\n    }\n\n    org.jsoup.parser.Tag setSelfClosing() {\n        selfClosing = true;\n        return this;\n    }\n\n    @java.lang.Override\n    public boolean equals(java.lang.Object o) {\n        if (this == o) {\n            return true;\n        }\n        if (!(o instanceof org.jsoup.parser.Tag)) {\n            return false;\n        }\n        org.jsoup.parser.Tag tag = ((org.jsoup.parser.Tag) (o));\n        if (!tagName.equals(tag.tagName)) {\n            return false;\n        }\n        if (canContainInline != tag.canContainInline) {\n            return false;\n        }\n        if (empty != tag.empty) {\n            return false;\n        }\n        if (formatAsBlock != tag.formatAsBlock) {\n            return false;\n        }\n        if (isBlock != tag.isBlock) {\n            return false;\n        }\n        if (preserveWhitespace != tag.preserveWhitespace) {\n            return false;\n        }\n        if (selfClosing != tag.selfClosing) {\n            return false;\n        }\n        if (formList != tag.formList) {\n            return false;\n        }\n        return formSubmit == tag.formSubmit;\n    }\n\n    @java.lang.Override\n    public int hashCode() {\n        int result = tagName.hashCode();\n        result = (31 * result) + (isBlock ? 1 : 0);\n        result = (31 * result) + (formatAsBlock ? 1 : 0);\n        result = (31 * result) + (canContainInline ? 1 : 0);\n        result = (31 * result) + (empty ? 1 : 0);\n        result = (31 * result) + (selfClosing ? 1 : 0);\n        result = (31 * result) + (preserveWhitespace ? 1 : 0);\n        result = (31 * result) + (formList ? 1 : 0);\n        result = (31 * result) + (formSubmit ? 1 : 0);\n        return result;\n    }\n\n    @java.lang.Override\n    public java.lang.String toString() {\n        return tagName;\n    }\n\n    private static final java.lang.String[] blockTags = new java.lang.String[]{ \"html\", \"head\", \"body\", \"frameset\", \"script\", \"noscript\", \"style\", \"meta\", \"link\", \"title\", \"frame\", \"noframes\", \"section\", \"nav\", \"aside\", \"hgroup\", \"header\", \"footer\", \"p\", \"h1\", \"h2\", \"h3\", \"h4\", \"h5\", \"h6\", \"ul\", \"ol\", \"pre\", \"div\", \"blockquote\", \"hr\", \"address\", \"figure\", \"figcaption\", \"form\", \"fieldset\", \"ins\", \"del\", \"dl\", \"dt\", \"dd\", \"li\", \"table\", \"caption\", \"thead\", \"tfoot\", \"tbody\", \"colgroup\", \"col\", \"tr\", \"th\", \"td\", \"video\", \"audio\", \"canvas\", \"details\", \"menu\", \"plaintext\", \"template\", \"article\", \"main\", \"svg\", \"math\" };\n\n    private static final java.lang.String[] inlineTags = new java.lang.String[]{ \"object\", \"base\", \"font\", \"tt\", \"i\", \"b\", \"u\", \"big\", \"small\", \"em\", \"strong\", \"dfn\", \"code\", \"samp\", \"kbd\", \"var\", \"cite\", \"abbr\", \"time\", \"acronym\", \"mark\", \"ruby\", \"rt\", \"rp\", \"a\", \"img\", \"br\", \"wbr\", \"map\", \"q\", \"sub\", \"sup\", \"bdo\", \"iframe\", \"embed\", \"span\", \"input\", \"select\", \"textarea\", \"label\", \"button\", \"optgroup\", \"option\", \"legend\", \"datalist\", \"keygen\", \"output\", \"progress\", \"meter\", \"area\", \"param\", \"source\", \"track\", \"summary\", \"command\", \"device\", \"area\", \"basefont\", \"bgsound\", \"menuitem\", \"param\", \"source\", \"track\", \"data\", \"bdi\", \"s\" };\n\n    private static final java.lang.String[] emptyTags = new java.lang.String[]{ \"meta\", \"link\", \"base\", \"frame\", \"img\", \"br\", \"wbr\", \"embed\", \"hr\", \"input\", \"keygen\", \"col\", \"command\", \"device\", \"area\", \"basefont\", \"bgsound\", \"menuitem\", \"param\", \"source\", \"track\" };\n\n    private static final java.lang.String[] formatAsInlineTags = new java.lang.String[]{ \"title\", \"a\", \"p\", \"h1\", \"h2\", \"h3\", \"h4\", \"h5\", \"h6\", \"pre\", \"address\", \"li\", \"th\", \"td\", \"script\", \"style\", \"ins\", \"del\", \"s\" };\n\n    private static final java.lang.String[] preserveWhitespaceTags = new java.lang.String[]{ \"pre\", \"plaintext\", \"title\", \"textarea\" };\n\n    private static final java.lang.String[] formListedTags = new java.lang.String[]{ \"button\", \"fieldset\", \"input\", \"keygen\", \"object\", \"output\", \"select\", \"textarea\" };\n\n    private static final java.lang.String[] formSubmitTags = new java.lang.String[]{ \"input\", \"keygen\", \"object\", \"select\", \"textarea\" };\n\n    static {\n        for (java.lang.String tagName : blockTags) {\n            Tag tag = new Tag(tagName);\n            register(tag);\n        }\n        for (java.lang.String tagName : inlineTags) {\n            Tag tag = new Tag(tagName);\n            tag.isBlock = false;\n            tag.formatAsBlock = false;\n            register(tag);\n        }\n        for (java.lang.String tagName : emptyTags) {\n            Tag tag = tags.get(tagName);\n            org.jsoup.helper.Validate.notNull(tag);\n            tag.canContainInline = false;\n            tag.empty = true;\n        }\n        for (java.lang.String tagName : formatAsInlineTags) {\n            Tag tag = tags.get(tagName);\n            org.jsoup.helper.Validate.notNull(tag);\n            tag.formatAsBlock = false;\n        }\n        for (java.lang.String tagName : preserveWhitespaceTags) {\n            Tag tag = tags.get(tagName);\n            org.jsoup.helper.Validate.notNull(tag);\n            tag.preserveWhitespace = true;\n        }\n        for (java.lang.String tagName : formListedTags) {\n            Tag tag = tags.get(tagName);\n            org.jsoup.helper.Validate.notNull(tag);\n            tag.formList = true;\n        }\n        for (java.lang.String tagName : formSubmitTags) {\n            Tag tag = tags.get(tagName);\n            org.jsoup.helper.Validate.notNull(tag);\n            tag.formSubmit = true;\n        }\n    }\n\n    private static void register(org.jsoup.parser.Tag tag) {\n        org.jsoup.parser.Tag.tags.put(tag.tagName, tag);\n    }\n}",
            "src_parent_type": "Class",
            "src_type": "Field"
          }
        },
        {
          "FEATURES_METHOD_INVOCATION": {},
          "FEATURES_TYPEACCESS": {},
          "FEATURES_VARS": {},
          "S10_METHOD_CALL_WITH_NULL_GUARD": "false",
          "S11_FAULTY_CLASS_EXCEPTION_TYPE": "false",
          "S12_METHOD_CALL_WITH_TRY_CATCH": "false",
          "S13_TYPE_OF_FAULTY_STATEMENT_AFTER_1": "",
          "S13_TYPE_OF_FAULTY_STATEMENT_AFTER_2": "",
          "S13_TYPE_OF_FAULTY_STATEMENT_AFTER_3": "",
          "S13_TYPE_OF_FAULTY_STATEMENT_BEFORE_1": "Assignment",
          "S13_TYPE_OF_FAULTY_STATEMENT_BEFORE_2": "Invocation",
          "S13_TYPE_OF_FAULTY_STATEMENT_BEFORE_3": "",
          "S14_TYPE_OF_FAULTY_STATEMENT_PARENT": "Constructor",
          "S15_HAS_OBJECTIVE_METHOD_CALL": "true",
          "S16_HAS_Invocations_Prone_Exception": "false",
          "S18_In_Synchronized_Method": "false",
          "S1_LOCAL_VAR_NOT_ASSIGNED": "false",
          "S1_LOCAL_VAR_NOT_USED": "false",
          "S2_SIMILAR_OBJECT_TYPE_WITH_NORMAL_GUARD": "false",
          "S2_SIMILAR_OBJECT_TYPE_WITH_NULL_GUARD": "false",
          "S3_TYPE_OF_FAULTY_STATEMENT": "Assignment",
          "S4_Field_NOT_ASSIGNED": "false",
          "S4_Field_NOT_USED": "false",
          "S5_SIMILAR_PRIMITIVE_TYPE_WITH_NORMAL_GUARD": "false",
          "S5_SIMILAR_PRIMITIVE_TYPE_WITH_NULL_GUARD": "false",
          "S6_METHOD_THROWS_EXCEPTION": "false",
          "S7_OBJECT_USED_IN_ASSIGNMENT": "false",
          "S8_PRIMITIVE_USED_IN_ASSIGNMENT": "false",
          "S9_METHOD_CALL_WITH_NORMAL_GUARD": "false",
          "ast_info": {
            "dst": "null",
            "dst_parent": "null",
            "dst_parent_type": "null",
            "dst_type": "null",
            "operator": "DEL",
            "src": "normalName = org.jsoup.internal.Normalizer.lowerCase(tagName)",
            "src_parent": "{\n    this.tagName = tagName;\n    normalName = org.jsoup.internal.Normalizer.lowerCase(tagName);\n}",
            "src_parent_type": "Block",
            "src_type": "Assignment"
          }
        },
        {
          "FEATURES_METHOD_INVOCATION": {},
          "FEATURES_TYPEACCESS": {},
          "FEATURES_VARS": {},
          "S10_METHOD_CALL_WITH_NULL_GUARD": "false",
          "S11_FAULTY_CLASS_EXCEPTION_TYPE": "false",
          "S12_METHOD_CALL_WITH_TRY_CATCH": "false",
          "S13_TYPE_OF_FAULTY_STATEMENT_AFTER_1": "",
          "S13_TYPE_OF_FAULTY_STATEMENT_AFTER_2": "",
          "S13_TYPE_OF_FAULTY_STATEMENT_AFTER_3": "",
          "S13_TYPE_OF_FAULTY_STATEMENT_BEFORE_1": "",
          "S13_TYPE_OF_FAULTY_STATEMENT_BEFORE_2": "",
          "S13_TYPE_OF_FAULTY_STATEMENT_BEFORE_3": "",
          "S14_TYPE_OF_FAULTY_STATEMENT_PARENT": "Class",
          "S15_HAS_OBJECTIVE_METHOD_CALL": "false",
          "S16_HAS_Invocations_Prone_Exception": "false",
          "S18_In_Synchronized_Method": "false",
          "S1_LOCAL_VAR_NOT_ASSIGNED": "false",
          "S1_LOCAL_VAR_NOT_USED": "false",
          "S2_SIMILAR_OBJECT_TYPE_WITH_NORMAL_GUARD": "false",
          "S2_SIMILAR_OBJECT_TYPE_WITH_NULL_GUARD": "false",
          "S3_TYPE_OF_FAULTY_STATEMENT": "Method",
          "S4_Field_NOT_ASSIGNED": "false",
          "S4_Field_NOT_USED": "false",
          "S5_SIMILAR_PRIMITIVE_TYPE_WITH_NORMAL_GUARD": "false",
          "S5_SIMILAR_PRIMITIVE_TYPE_WITH_NULL_GUARD": "false",
          "S7_OBJECT_USED_IN_ASSIGNMENT": "false",
          "S8_PRIMITIVE_USED_IN_ASSIGNMENT": "false",
          "S9_METHOD_CALL_WITH_NORMAL_GUARD": "false",
          "ast_info": {
            "dst": "null",
            "dst_parent": "null",
            "dst_parent_type": "null",
            "dst_type": "null",
            "operator": "DEL",
            "src": "public java.lang.String normalName() {\n    return normalName;\n}",
            "src_parent": "public class Tag {\n    private static final java.util.Map<java.lang.String, org.jsoup.parser.Tag> tags = new java.util.HashMap<>();\n\n    private java.lang.String tagName;\n\n    private java.lang.String normalName;\n\n    private boolean isBlock = true;\n\n    private boolean formatAsBlock = true;\n\n    private boolean canContainInline = true;\n\n    private boolean empty = false;\n\n    private boolean selfClosing = false;\n\n    private boolean preserveWhitespace = false;\n\n    private boolean formList = false;\n\n    private boolean formSubmit = false;\n\n    private Tag(java.lang.String tagName) {\n        this.tagName = tagName;\n        normalName = org.jsoup.internal.Normalizer.lowerCase(tagName);\n    }\n\n    public java.lang.String getName() {\n        return tagName;\n    }\n\n    public java.lang.String normalName() {\n        return normalName;\n    }\n\n    public static org.jsoup.parser.Tag valueOf(java.lang.String tagName, org.jsoup.parser.ParseSettings settings) {\n        org.jsoup.helper.Validate.notNull(tagName);\n        org.jsoup.parser.Tag tag = org.jsoup.parser.Tag.tags.get(tagName);\n        if (tag == null) {\n            tagName = settings.normalizeTag(tagName);\n            org.jsoup.helper.Validate.notEmpty(tagName);\n            tag = org.jsoup.parser.Tag.tags.get(tagName);\n            if (tag == null) {\n                tag = new org.jsoup.parser.Tag(tagName);\n                tag.isBlock = false;\n            }\n        }\n        return tag;\n    }\n\n    public static org.jsoup.parser.Tag valueOf(java.lang.String tagName) {\n        return org.jsoup.parser.Tag.valueOf(tagName, ParseSettings.preserveCase);\n    }\n\n    public boolean isBlock() {\n        return isBlock;\n    }\n\n    public boolean formatAsBlock() {\n        return formatAsBlock;\n    }\n\n    public boolean canContainBlock() {\n        return isBlock;\n    }\n\n    public boolean isInline() {\n        return !isBlock;\n    }\n\n    public boolean isData() {\n        return (!canContainInline) && (!isEmpty());\n    }\n\n    public boolean isEmpty() {\n        return empty;\n    }\n\n    public boolean isSelfClosing() {\n        return empty || selfClosing;\n    }\n\n    public boolean isKnownTag() {\n        return org.jsoup.parser.Tag.tags.containsKey(tagName);\n    }\n\n    public static boolean isKnownTag(java.lang.String tagName) {\n        return org.jsoup.parser.Tag.tags.containsKey(tagName);\n    }\n\n    public boolean preserveWhitespace() {\n        return preserveWhitespace;\n    }\n\n    public boolean isFormListed() {\n        return formList;\n    }\n\n    public boolean isFormSubmittable() {\n        return formSubmit;\n    }\n\n    org.jsoup.parser.Tag setSelfClosing() {\n        selfClosing = true;\n        return this;\n    }\n\n    @java.lang.Override\n    public boolean equals(java.lang.Object o) {\n        if (this == o) {\n            return true;\n        }\n        if (!(o instanceof org.jsoup.parser.Tag)) {\n            return false;\n        }\n        org.jsoup.parser.Tag tag = ((org.jsoup.parser.Tag) (o));\n        if (!tagName.equals(tag.tagName)) {\n            return false;\n        }\n        if (canContainInline != tag.canContainInline) {\n            return false;\n        }\n        if (empty != tag.empty) {\n            return false;\n        }\n        if (formatAsBlock != tag.formatAsBlock) {\n            return false;\n        }\n        if (isBlock != tag.isBlock) {\n            return false;\n        }\n        if (preserveWhitespace != tag.preserveWhitespace) {\n            return false;\n        }\n        if (selfClosing != tag.selfClosing) {\n            return false;\n        }\n        if (formList != tag.formList) {\n            return false;\n        }\n        return formSubmit == tag.formSubmit;\n    }\n\n    @java.lang.Override\n    public int hashCode() {\n        int result = tagName.hashCode();\n        result = (31 * result) + (isBlock ? 1 : 0);\n        result = (31 * result) + (formatAsBlock ? 1 : 0);\n        result = (31 * result) + (canContainInline ? 1 : 0);\n        result = (31 * result) + (empty ? 1 : 0);\n        result = (31 * result) + (selfClosing ? 1 : 0);\n        result = (31 * result) + (preserveWhitespace ? 1 : 0);\n        result = (31 * result) + (formList ? 1 : 0);\n        result = (31 * result) + (formSubmit ? 1 : 0);\n        return result;\n    }\n\n    @java.lang.Override\n    public java.lang.String toString() {\n        return tagName;\n    }\n\n    private static final java.lang.String[] blockTags = new java.lang.String[]{ \"html\", \"head\", \"body\", \"frameset\", \"script\", \"noscript\", \"style\", \"meta\", \"link\", \"title\", \"frame\", \"noframes\", \"section\", \"nav\", \"aside\", \"hgroup\", \"header\", \"footer\", \"p\", \"h1\", \"h2\", \"h3\", \"h4\", \"h5\", \"h6\", \"ul\", \"ol\", \"pre\", \"div\", \"blockquote\", \"hr\", \"address\", \"figure\", \"figcaption\", \"form\", \"fieldset\", \"ins\", \"del\", \"dl\", \"dt\", \"dd\", \"li\", \"table\", \"caption\", \"thead\", \"tfoot\", \"tbody\", \"colgroup\", \"col\", \"tr\", \"th\", \"td\", \"video\", \"audio\", \"canvas\", \"details\", \"menu\", \"plaintext\", \"template\", \"article\", \"main\", \"svg\", \"math\" };\n\n    private static final java.lang.String[] inlineTags = new java.lang.String[]{ \"object\", \"base\", \"font\", \"tt\", \"i\", \"b\", \"u\", \"big\", \"small\", \"em\", \"strong\", \"dfn\", \"code\", \"samp\", \"kbd\", \"var\", \"cite\", \"abbr\", \"time\", \"acronym\", \"mark\", \"ruby\", \"rt\", \"rp\", \"a\", \"img\", \"br\", \"wbr\", \"map\", \"q\", \"sub\", \"sup\", \"bdo\", \"iframe\", \"embed\", \"span\", \"input\", \"select\", \"textarea\", \"label\", \"button\", \"optgroup\", \"option\", \"legend\", \"datalist\", \"keygen\", \"output\", \"progress\", \"meter\", \"area\", \"param\", \"source\", \"track\", \"summary\", \"command\", \"device\", \"area\", \"basefont\", \"bgsound\", \"menuitem\", \"param\", \"source\", \"track\", \"data\", \"bdi\", \"s\" };\n\n    private static final java.lang.String[] emptyTags = new java.lang.String[]{ \"meta\", \"link\", \"base\", \"frame\", \"img\", \"br\", \"wbr\", \"embed\", \"hr\", \"input\", \"keygen\", \"col\", \"command\", \"device\", \"area\", \"basefont\", \"bgsound\", \"menuitem\", \"param\", \"source\", \"track\" };\n\n    private static final java.lang.String[] formatAsInlineTags = new java.lang.String[]{ \"title\", \"a\", \"p\", \"h1\", \"h2\", \"h3\", \"h4\", \"h5\", \"h6\", \"pre\", \"address\", \"li\", \"th\", \"td\", \"script\", \"style\", \"ins\", \"del\", \"s\" };\n\n    private static final java.lang.String[] preserveWhitespaceTags = new java.lang.String[]{ \"pre\", \"plaintext\", \"title\", \"textarea\" };\n\n    private static final java.lang.String[] formListedTags = new java.lang.String[]{ \"button\", \"fieldset\", \"input\", \"keygen\", \"object\", \"output\", \"select\", \"textarea\" };\n\n    private static final java.lang.String[] formSubmitTags = new java.lang.String[]{ \"input\", \"keygen\", \"object\", \"select\", \"textarea\" };\n\n    static {\n        for (java.lang.String tagName : blockTags) {\n            Tag tag = new Tag(tagName);\n            register(tag);\n        }\n        for (java.lang.String tagName : inlineTags) {\n            Tag tag = new Tag(tagName);\n            tag.isBlock = false;\n            tag.formatAsBlock = false;\n            register(tag);\n        }\n        for (java.lang.String tagName : emptyTags) {\n            Tag tag = tags.get(tagName);\n            org.jsoup.helper.Validate.notNull(tag);\n            tag.canContainInline = false;\n            tag.empty = true;\n        }\n        for (java.lang.String tagName : formatAsInlineTags) {\n            Tag tag = tags.get(tagName);\n            org.jsoup.helper.Validate.notNull(tag);\n            tag.formatAsBlock = false;\n        }\n        for (java.lang.String tagName : preserveWhitespaceTags) {\n            Tag tag = tags.get(tagName);\n            org.jsoup.helper.Validate.notNull(tag);\n            tag.preserveWhitespace = true;\n        }\n        for (java.lang.String tagName : formListedTags) {\n            Tag tag = tags.get(tagName);\n            org.jsoup.helper.Validate.notNull(tag);\n            tag.formList = true;\n        }\n        for (java.lang.String tagName : formSubmitTags) {\n            Tag tag = tags.get(tagName);\n            org.jsoup.helper.Validate.notNull(tag);\n            tag.formSubmit = true;\n        }\n    }\n\n    private static void register(org.jsoup.parser.Tag tag) {\n        org.jsoup.parser.Tag.tags.put(tag.tagName, tag);\n    }\n}",
            "src_parent_type": "Class",
            "src_type": "Method"
          }
        }
      ],
      "file_name": "Tag"
    }
  ],
  "id": "Jsoup_87"
}