{
  "files": [
    {
      "features": [
        {
          "FEATURES_METHOD_INVOCATION": {},
          "FEATURES_TYPEACCESS": {},
          "FEATURES_VARS": {},
          "S10_METHOD_CALL_WITH_NULL_GUARD": "false",
          "S11_FAULTY_CLASS_EXCEPTION_TYPE": "false",
          "S12_METHOD_CALL_WITH_TRY_CATCH": "false",
          "S13_TYPE_OF_FAULTY_STATEMENT_AFTER_1": "",
          "S13_TYPE_OF_FAULTY_STATEMENT_AFTER_2": "",
          "S13_TYPE_OF_FAULTY_STATEMENT_AFTER_3": "",
          "S13_TYPE_OF_FAULTY_STATEMENT_BEFORE_1": "",
          "S13_TYPE_OF_FAULTY_STATEMENT_BEFORE_2": "",
          "S13_TYPE_OF_FAULTY_STATEMENT_BEFORE_3": "",
          "S14_TYPE_OF_FAULTY_STATEMENT_PARENT": "Method",
          "S15_HAS_OBJECTIVE_METHOD_CALL": "false",
          "S16_HAS_Invocations_Prone_Exception": "false",
          "S18_In_Synchronized_Method": "false",
          "S1_LOCAL_VAR_NOT_ASSIGNED": "false",
          "S1_LOCAL_VAR_NOT_USED": "false",
          "S2_SIMILAR_OBJECT_TYPE_WITH_NORMAL_GUARD": "false",
          "S2_SIMILAR_OBJECT_TYPE_WITH_NULL_GUARD": "false",
          "S3_TYPE_OF_FAULTY_STATEMENT": "Annotation",
          "S4_Field_NOT_ASSIGNED": "false",
          "S4_Field_NOT_USED": "false",
          "S5_SIMILAR_PRIMITIVE_TYPE_WITH_NORMAL_GUARD": "false",
          "S5_SIMILAR_PRIMITIVE_TYPE_WITH_NULL_GUARD": "false",
          "S6_METHOD_THROWS_EXCEPTION": "true",
          "S7_OBJECT_USED_IN_ASSIGNMENT": "false",
          "S8_PRIMITIVE_USED_IN_ASSIGNMENT": "false",
          "S9_METHOD_CALL_WITH_NORMAL_GUARD": "false",
          "ast_info": {
            "dst": "null",
            "dst_parent": "null",
            "dst_parent_type": "null",
            "dst_type": "null",
            "operator": "DEL",
            "src": "@java.lang.Override",
            "src_parent": "@java.lang.Override\npublic void create(java.lang.String tableName) throws org.apache.accumulo.core.client.AccumuloException, org.apache.accumulo.core.client.AccumuloSecurityException, org.apache.accumulo.core.client.TableExistsException {\n    if (!tableName.matches(Constants.VALID_TABLE_NAME_REGEX)) {\n        throw new java.lang.IllegalArgumentException();\n    }\n    create(tableName, true, TimeType.MILLIS);\n}",
            "src_parent_type": "Method",
            "src_type": "Annotation"
          }
        },
        {
          "FEATURES_METHOD_INVOCATION": {},
          "FEATURES_TYPEACCESS": {},
          "FEATURES_VARS": {},
          "S10_METHOD_CALL_WITH_NULL_GUARD": "false",
          "S11_FAULTY_CLASS_EXCEPTION_TYPE": "false",
          "S12_METHOD_CALL_WITH_TRY_CATCH": "false",
          "S13_TYPE_OF_FAULTY_STATEMENT_AFTER_1": "",
          "S13_TYPE_OF_FAULTY_STATEMENT_AFTER_2": "",
          "S13_TYPE_OF_FAULTY_STATEMENT_AFTER_3": "",
          "S13_TYPE_OF_FAULTY_STATEMENT_BEFORE_1": "",
          "S13_TYPE_OF_FAULTY_STATEMENT_BEFORE_2": "",
          "S13_TYPE_OF_FAULTY_STATEMENT_BEFORE_3": "",
          "S14_TYPE_OF_FAULTY_STATEMENT_PARENT": "Method",
          "S15_HAS_OBJECTIVE_METHOD_CALL": "false",
          "S16_HAS_Invocations_Prone_Exception": "false",
          "S18_In_Synchronized_Method": "false",
          "S1_LOCAL_VAR_NOT_ASSIGNED": "false",
          "S1_LOCAL_VAR_NOT_USED": "false",
          "S2_SIMILAR_OBJECT_TYPE_WITH_NORMAL_GUARD": "false",
          "S2_SIMILAR_OBJECT_TYPE_WITH_NULL_GUARD": "false",
          "S3_TYPE_OF_FAULTY_STATEMENT": "Annotation",
          "S4_Field_NOT_ASSIGNED": "false",
          "S4_Field_NOT_USED": "false",
          "S5_SIMILAR_PRIMITIVE_TYPE_WITH_NORMAL_GUARD": "false",
          "S5_SIMILAR_PRIMITIVE_TYPE_WITH_NULL_GUARD": "false",
          "S6_METHOD_THROWS_EXCEPTION": "true",
          "S7_OBJECT_USED_IN_ASSIGNMENT": "false",
          "S8_PRIMITIVE_USED_IN_ASSIGNMENT": "false",
          "S9_METHOD_CALL_WITH_NORMAL_GUARD": "false",
          "ast_info": {
            "dst": "null",
            "dst_parent": "null",
            "dst_parent_type": "null",
            "dst_type": "null",
            "operator": "DEL",
            "src": "@java.lang.Override",
            "src_parent": "@java.lang.Override\npublic void delete(java.lang.String tableName) throws org.apache.accumulo.core.client.AccumuloException, org.apache.accumulo.core.client.AccumuloSecurityException, org.apache.accumulo.core.client.TableNotFoundException {\n    acu.tables.remove(tableName);\n}",
            "src_parent_type": "Method",
            "src_type": "Annotation"
          }
        },
        {
          "FEATURES_METHOD_INVOCATION": {},
          "FEATURES_TYPEACCESS": {},
          "FEATURES_VARS": {},
          "S10_METHOD_CALL_WITH_NULL_GUARD": "false",
          "S12_METHOD_CALL_WITH_TRY_CATCH": "false",
          "S13_TYPE_OF_FAULTY_STATEMENT_AFTER_1": "",
          "S13_TYPE_OF_FAULTY_STATEMENT_AFTER_2": "",
          "S13_TYPE_OF_FAULTY_STATEMENT_AFTER_3": "",
          "S13_TYPE_OF_FAULTY_STATEMENT_BEFORE_1": "",
          "S13_TYPE_OF_FAULTY_STATEMENT_BEFORE_2": "",
          "S13_TYPE_OF_FAULTY_STATEMENT_BEFORE_3": "",
          "S14_TYPE_OF_FAULTY_STATEMENT_PARENT": "Package",
          "S15_HAS_OBJECTIVE_METHOD_CALL": "true",
          "S16_HAS_Invocations_Prone_Exception": "false",
          "S18_In_Synchronized_Method": "false",
          "S1_LOCAL_VAR_NOT_ASSIGNED": "false",
          "S1_LOCAL_VAR_NOT_USED": "false",
          "S2_SIMILAR_OBJECT_TYPE_WITH_NORMAL_GUARD": "false",
          "S2_SIMILAR_OBJECT_TYPE_WITH_NULL_GUARD": "false",
          "S3_TYPE_OF_FAULTY_STATEMENT": "Class",
          "S4_Field_NOT_ASSIGNED": "false",
          "S4_Field_NOT_USED": "false",
          "S5_SIMILAR_PRIMITIVE_TYPE_WITH_NORMAL_GUARD": "false",
          "S5_SIMILAR_PRIMITIVE_TYPE_WITH_NULL_GUARD": "false",
          "S7_OBJECT_USED_IN_ASSIGNMENT": "false",
          "S8_PRIMITIVE_USED_IN_ASSIGNMENT": "false",
          "S9_METHOD_CALL_WITH_NORMAL_GUARD": "false",
          "ast_info": {
            "dst": "null",
            "dst_parent": "null",
            "dst_parent_type": "null",
            "dst_type": "null",
            "operator": "INS",
            "src": "@java.lang.Override\n exists() {\n}",
            "src_parent": "public class MockTableOperations extends org.apache.accumulo.core.client.admin.TableOperationsHelper {\n    private final org.apache.accumulo.core.client.mock.MockAccumulo acu;\n\n    private final java.lang.String username;\n\n    MockTableOperations(org.apache.accumulo.core.client.mock.MockAccumulo acu, java.lang.String username) {\n        this.acu = acu;\n        this.username = username;\n    }\n\n    @java.lang.Override\n    public java.util.SortedSet<java.lang.String> list() {\n        return new java.util.TreeSet<java.lang.String>(acu.tables.keySet());\n    }\n\n    @java.lang.Override\n    public boolean exists(java.lang.String tableName) {\n        return acu.tables.containsKey(tableName);\n    }\n\n    public void create(java.lang.String tableName) throws org.apache.accumulo.core.client.AccumuloException, org.apache.accumulo.core.client.AccumuloSecurityException, org.apache.accumulo.core.client.TableExistsException {\n        if (!tableName.matches(Constants.VALID_TABLE_NAME_REGEX)) {\n            throw new java.lang.IllegalArgumentException();\n        }\n        create(tableName, true, TimeType.MILLIS);\n    }\n\n    @java.lang.Override\n    public void create(java.lang.String tableName, boolean versioningIter) throws org.apache.accumulo.core.client.AccumuloException, org.apache.accumulo.core.client.AccumuloSecurityException, org.apache.accumulo.core.client.TableExistsException {\n        create(tableName, versioningIter, TimeType.MILLIS);\n    }\n\n    @java.lang.Override\n    public void create(java.lang.String tableName, boolean versioningIter, org.apache.accumulo.core.client.admin.TimeType timeType) throws org.apache.accumulo.core.client.AccumuloException, org.apache.accumulo.core.client.AccumuloSecurityException, org.apache.accumulo.core.client.TableExistsException {\n        if (!tableName.matches(Constants.VALID_TABLE_NAME_REGEX)) {\n            throw new java.lang.IllegalArgumentException();\n        }\n        acu.createTable(username, tableName, versioningIter, timeType);\n    }\n\n    @java.lang.Override\n    public void addAggregators(java.lang.String tableName, java.util.List<? extends org.apache.accumulo.core.iterators.conf.PerColumnIteratorConfig> aggregators) throws org.apache.accumulo.core.client.AccumuloException, org.apache.accumulo.core.client.AccumuloSecurityException, org.apache.accumulo.core.client.TableNotFoundException {\n        if (!exists(tableName)) {\n            throw new org.apache.accumulo.core.client.TableNotFoundException(null, tableName, null);\n        }\n        acu.addAggregators(tableName, aggregators);\n    }\n\n    @java.lang.Override\n    public void addSplits(java.lang.String tableName, java.util.SortedSet<org.apache.hadoop.io.Text> partitionKeys) throws org.apache.accumulo.core.client.AccumuloException, org.apache.accumulo.core.client.AccumuloSecurityException, org.apache.accumulo.core.client.TableNotFoundException {\n    }\n\n    @java.lang.Override\n    public java.util.Collection<org.apache.hadoop.io.Text> getSplits(java.lang.String tableName) {\n        return java.util.Collections.emptyList();\n    }\n\n    @java.lang.Override\n    public java.util.Collection<org.apache.hadoop.io.Text> getSplits(java.lang.String tableName, int maxSplits) {\n        return java.util.Collections.emptyList();\n    }\n\n    @java.lang.Override\n     exists() {\n    }\n\n    public void delete(java.lang.String tableName) throws org.apache.accumulo.core.client.AccumuloException, org.apache.accumulo.core.client.AccumuloSecurityException, org.apache.accumulo.core.client.TableNotFoundException {\n        acu.tables.remove(tableName);\n    }\n\n    @java.lang.Override\n    public void rename(java.lang.String oldTableName, java.lang.String newTableName) throws org.apache.accumulo.core.client.AccumuloException, org.apache.accumulo.core.client.AccumuloSecurityException, org.apache.accumulo.core.client.TableExistsException, org.apache.accumulo.core.client.TableNotFoundException {\n        org.apache.accumulo.core.client.mock.MockTable t = acu.tables.remove(oldTableName);\n        acu.tables.put(newTableName, t);\n    }\n\n    @java.lang.Override\n    public void flush(java.lang.String tableName) throws org.apache.accumulo.core.client.AccumuloException, org.apache.accumulo.core.client.AccumuloSecurityException {\n    }\n\n    @java.lang.Override\n    public void setProperty(java.lang.String tableName, java.lang.String property, java.lang.String value) throws org.apache.accumulo.core.client.AccumuloException, org.apache.accumulo.core.client.AccumuloSecurityException {\n        acu.tables.get(tableName).settings.put(property, value);\n    }\n\n    @java.lang.Override\n    public void removeProperty(java.lang.String tableName, java.lang.String property) throws org.apache.accumulo.core.client.AccumuloException, org.apache.accumulo.core.client.AccumuloSecurityException {\n        acu.tables.get(tableName).settings.remove(property);\n    }\n\n    @java.lang.Override\n    public java.lang.Iterable<java.util.Map.Entry<java.lang.String, java.lang.String>> getProperties(java.lang.String tableName) throws org.apache.accumulo.core.client.TableNotFoundException {\n        return acu.tables.get(tableName).settings.entrySet();\n    }\n\n    @java.lang.Override\n    public void setLocalityGroups(java.lang.String tableName, java.util.Map<java.lang.String, java.util.Set<org.apache.hadoop.io.Text>> groups) throws org.apache.accumulo.core.client.AccumuloException, org.apache.accumulo.core.client.AccumuloSecurityException, org.apache.accumulo.core.client.TableNotFoundException {\n    }\n\n    @java.lang.Override\n    public java.util.Map<java.lang.String, java.util.Set<org.apache.hadoop.io.Text>> getLocalityGroups(java.lang.String tableName) throws org.apache.accumulo.core.client.AccumuloException, org.apache.accumulo.core.client.TableNotFoundException {\n        return null;\n    }\n\n    @java.lang.Override\n    public java.util.Set<org.apache.accumulo.core.data.Range> splitRangeByTablets(java.lang.String tableName, org.apache.accumulo.core.data.Range range, int maxSplits) throws org.apache.accumulo.core.client.AccumuloException, org.apache.accumulo.core.client.AccumuloSecurityException, org.apache.accumulo.core.client.TableNotFoundException {\n        return java.util.Collections.singleton(range);\n    }\n\n    @java.lang.Override\n    public org.apache.accumulo.core.util.BulkImportHelper.AssignmentStats importDirectory(java.lang.String tableName, java.lang.String dir, java.lang.String failureDir, int numThreads, int numAssignThreads, boolean disableGC) throws java.io.IOException, org.apache.accumulo.core.client.AccumuloException, org.apache.accumulo.core.client.AccumuloSecurityException {\n        throw new org.apache.commons.lang.NotImplementedException();\n    }\n\n    @java.lang.Override\n    public void importDirectory(java.lang.String tableName, java.lang.String dir, java.lang.String failureDir, boolean setTime) throws java.io.IOException, org.apache.accumulo.core.client.AccumuloException, org.apache.accumulo.core.client.AccumuloSecurityException, org.apache.accumulo.core.client.TableNotFoundException {\n        throw new org.apache.commons.lang.NotImplementedException();\n    }\n\n    @java.lang.Override\n    public void offline(java.lang.String tableName) throws org.apache.accumulo.core.client.AccumuloException, org.apache.accumulo.core.client.AccumuloSecurityException {\n    }\n\n    @java.lang.Override\n    public void online(java.lang.String tableName) throws org.apache.accumulo.core.client.AccumuloException, org.apache.accumulo.core.client.AccumuloSecurityException {\n    }\n\n    @java.lang.Override\n    public void clearLocatorCache(java.lang.String tableName) throws org.apache.accumulo.core.client.TableNotFoundException {\n    }\n\n    @java.lang.Override\n    public java.util.Map<java.lang.String, java.lang.String> tableIdMap() {\n        java.util.Map<java.lang.String, java.lang.String> result = new java.util.HashMap<java.lang.String, java.lang.String>();\n        for (java.lang.String table : acu.tables.keySet()) {\n            result.put(table, table);\n        }\n        return result;\n    }\n\n    @java.lang.Override\n    public void merge(java.lang.String tableName, org.apache.hadoop.io.Text start, org.apache.hadoop.io.Text end) throws org.apache.accumulo.core.client.AccumuloException, org.apache.accumulo.core.client.AccumuloSecurityException, org.apache.accumulo.core.client.TableNotFoundException {\n        throw new org.apache.commons.lang.NotImplementedException();\n    }\n\n    @java.lang.Override\n    public void deleteRows(java.lang.String tableName, org.apache.hadoop.io.Text start, org.apache.hadoop.io.Text end) throws org.apache.accumulo.core.client.AccumuloException, org.apache.accumulo.core.client.AccumuloSecurityException, org.apache.accumulo.core.client.TableNotFoundException {\n        throw new org.apache.commons.lang.NotImplementedException();\n    }\n\n    @java.lang.Override\n    public void compact(java.lang.String tableName, org.apache.hadoop.io.Text start, org.apache.hadoop.io.Text end, boolean flush, boolean wait) throws org.apache.accumulo.core.client.AccumuloException, org.apache.accumulo.core.client.AccumuloSecurityException, org.apache.accumulo.core.client.TableNotFoundException {\n        throw new org.apache.commons.lang.NotImplementedException();\n    }\n\n    @java.lang.Override\n    public void clone(java.lang.String srcTableName, java.lang.String newTableName, boolean flush, java.util.Map<java.lang.String, java.lang.String> propertiesToSet, java.util.Set<java.lang.String> propertiesToExclude) throws org.apache.accumulo.core.client.AccumuloException, org.apache.accumulo.core.client.AccumuloSecurityException, org.apache.accumulo.core.client.TableExistsException, org.apache.accumulo.core.client.TableNotFoundException {\n        throw new org.apache.commons.lang.NotImplementedException();\n    }\n\n    @java.lang.Override\n    public void flush(java.lang.String tableName, org.apache.hadoop.io.Text start, org.apache.hadoop.io.Text end, boolean wait) throws org.apache.accumulo.core.client.AccumuloException, org.apache.accumulo.core.client.AccumuloSecurityException, org.apache.accumulo.core.client.TableNotFoundException {\n        throw new org.apache.commons.lang.NotImplementedException();\n    }\n\n    @java.lang.Override\n    public org.apache.hadoop.io.Text getMaxRow(java.lang.String tableName, org.apache.accumulo.core.security.Authorizations auths, org.apache.hadoop.io.Text startRow, boolean startInclusive, org.apache.hadoop.io.Text endRow, boolean endInclusive) throws org.apache.accumulo.core.client.AccumuloException, org.apache.accumulo.core.client.AccumuloSecurityException, org.apache.accumulo.core.client.TableNotFoundException {\n        org.apache.accumulo.core.client.mock.MockTable table = acu.tables.get(tableName);\n        if (table == null) {\n            throw new org.apache.accumulo.core.client.TableNotFoundException(tableName, tableName, \"no such table\");\n        }\n        return org.apache.accumulo.core.client.admin.FindMax.findMax(new org.apache.accumulo.core.client.mock.MockScanner(table, auths), startRow, startInclusive, endRow, endInclusive);\n    }\n}",
            "src_parent_type": "Class",
            "src_type": "Method"
          }
        },
        {
          "FEATURES_METHOD_INVOCATION": {},
          "FEATURES_TYPEACCESS": {},
          "FEATURES_VARS": {},
          "S10_METHOD_CALL_WITH_NULL_GUARD": "false",
          "S11_FAULTY_CLASS_EXCEPTION_TYPE": "false",
          "S12_METHOD_CALL_WITH_TRY_CATCH": "false",
          "S13_TYPE_OF_FAULTY_STATEMENT_AFTER_1": "",
          "S13_TYPE_OF_FAULTY_STATEMENT_AFTER_2": "",
          "S13_TYPE_OF_FAULTY_STATEMENT_AFTER_3": "",
          "S13_TYPE_OF_FAULTY_STATEMENT_BEFORE_1": "",
          "S13_TYPE_OF_FAULTY_STATEMENT_BEFORE_2": "",
          "S13_TYPE_OF_FAULTY_STATEMENT_BEFORE_3": "",
          "S14_TYPE_OF_FAULTY_STATEMENT_PARENT": "Class",
          "S15_HAS_OBJECTIVE_METHOD_CALL": "false",
          "S16_HAS_Invocations_Prone_Exception": "false",
          "S18_In_Synchronized_Method": "false",
          "S1_LOCAL_VAR_NOT_ASSIGNED": "false",
          "S1_LOCAL_VAR_NOT_USED": "false",
          "S2_SIMILAR_OBJECT_TYPE_WITH_NORMAL_GUARD": "false",
          "S2_SIMILAR_OBJECT_TYPE_WITH_NULL_GUARD": "false",
          "S3_TYPE_OF_FAULTY_STATEMENT": "Method",
          "S4_Field_NOT_ASSIGNED": "false",
          "S4_Field_NOT_USED": "false",
          "S5_SIMILAR_PRIMITIVE_TYPE_WITH_NORMAL_GUARD": "false",
          "S5_SIMILAR_PRIMITIVE_TYPE_WITH_NULL_GUARD": "false",
          "S7_OBJECT_USED_IN_ASSIGNMENT": "false",
          "S8_PRIMITIVE_USED_IN_ASSIGNMENT": "false",
          "S9_METHOD_CALL_WITH_NORMAL_GUARD": "false",
          "ast_info": {
            "dst": "null",
            "dst_parent": "null",
            "dst_parent_type": "null",
            "dst_type": "null",
            "operator": "INS",
            "src": "if (!exists(tableName)) {\n    throw new org.apache.accumulo.core.client.TableNotFoundException(null, tableName, null);\n}",
            "src_parent": "{\n    if (!exists(tableName)) {\n        throw new org.apache.accumulo.core.client.TableNotFoundException(null, tableName, null);\n    }\n    acu.addAggregators(tableName, aggregators);\n}",
            "src_parent_type": "Block",
            "src_type": "If"
          }
        }
      ],
      "file_name": "MockTableOperations"
    }
  ],
  "id": "accumulo_46f62443"
}